id,post_time,post_text,Urgency_1_7
2256,1410257468,"This course is now a self paced course (ie. students can take it anytime), but I will suggest anyone who is interested in market competitionÂ to consider Ludwig Maximilians' Competitive StrategyÂ https://www.coursera.org/learn/competitivestrategy/outline. The instructor walks students through various examples/case studiesÂ onÂ applying game theory to real world business, and it is taught with such clarity that the materials should be easily understood by students without economics training. Unfortunately the course extension ""Advanced Competitive Strategy"" just ended, so I don't know when it will be available again.",2
8990,1415873173,"Do you know
any accounting textbooks on IAS/ IFRS, if possible as clear and concise than this
course?

Thanking
you in advance,

[REDACTED]",5
3369,1410698085,"Hi [REDACTED], there is no standard list for this , however you should memorize the most used accounts , and the rest will become conclusions , I will give you examples that you should memorize first .Assets (All of them are debit):LandBuildingMachinesTransportation (Cars ,Trucks)InvestmentsInventoryAccounts receivable (Our customers)CashBank Account (Debit account)Prepaid expensesRevenues receivableÂ  Liabilities (All of them are credit accounts):Bank loanAccounts payableDividends payableExpenses payableAccumulated depreciation accounts (but those appear on the left side of the balance sheet, subtracted from the related assets)Stockholders equity (Also credit accounts ):Common stockAdditional paid-in capitalRetained earningsNote that all expenses and prepaid expenses are debit accounts , and all revenues and pre received revenues are credit accountsBUT the expenses payable are credit accounts ( because they become obligations) , AND the revenues receivable are debit accounts.I hope that this will help you , Don't worry if you didn't get it completely , because as time passes you will figure it out , you just have to look at them from time to time .",2
249,1409774443,"Hi, classmates! I'm [REDACTED] from [REDACTED]. Hope it would be a nice time! would be glad to discuss the course. Here's my linkedin profile:[REDACTED]",1
6004,1412508467,"Sorry, I made Â a mistake",1
9533,1416415566,"Thank you Dr. [REDACTED]!Â  Wow, have I learned a lot!Â  While I originally signed up to work towards a certificate, my work and home life situation did not allow for that.Â  However, I am plowing through this course at my own speed.Â  I cannot tell you how much I have appreciated all that you have taught us.Â  I have a new job which involves keeping the books for numerous buildings and a holding company that my employer owns, and was basically thrown into the accounting world with little preparation.Â  I've learned a good deal on my own by googling, asking friends, etc., but your course has brought it all together for me. You are an outstanding instructor, and I have thoroughly enjoyed your corny sense of humor.Immense thanks to you Dr. [REDACTED] for a job very well done!Â  You have definitely found your place!",1
243,1409774072,"Hi all! I am [REDACTED] from [REDACTED] working with [REDACTED]'s cloud division. I am here to increase my financial accounting knowledge. You can connect with me at [REDACTED]. Cheers!
",1
1248,1409946187,Three basic rules of accounting:1) Debit -- what comes inÂ  Â  Credit -- what goes out2) Debit -- the receiverÂ  Â  Credit -- the giver3) Debit -- expenses and lossesÂ  Â  Credit -- income and gains,1
1001,1409902349,"Hi all,I am [REDACTED] from [REDACTED]. I am now a last year Accounting student. Nice to meet you all here in Corsera.",1
4503,1411285498,"I hope that I am wring in the right forum.In the video 'Financial Statement an Closing Entries', around playing time 12:21, professor mentioned 'Debit Retained Earning'. But I guess what he actually meant was 'Debit Rental Revenue'.Probably just small error during 'lecture' but would be nice to be corrected to prevent confusion for future students.Â Thanks.//[REDACTED]",2
1839,1410116927,"Retained Earnings are not a part of liability, they are a part of stock holders equity. And Moreover, liability is a claim on assets by non owners(creditors).Stock holders equity = contributed capital(comes from issuing stocks/bonds) + retained earnings(comes from opreations)",1
1744,1410095143,Hi..I know it is too early to ask..but is it possible to get videos till this topic atleast. I am pursuing MBA and need these videos as I am already in a term where ratios have been started. It will be a great help. Should I tag also somebody??,5
9023,1415918369,Thanks Prof. for teaching me Credit Time and Debit Knowledge. I hope to see you in other interesting courses.,1
5563,1412046828,Problem: No credit for submitting homework  quiz #4URL: [REDACTED]Browser: Chrome 37OS: Windows 7Additional details: I have submitted homework and hit enter . it did not record any of my answers Â and they all show up blank can you look into this and reset my account,5
8742,1415595668,"Hello,Â If the problem caused you to miss the authentication step for one of your quizzes or assignments, donâ€™t worry. We can allow a small number of quiz and assignment submissions without full authentication in each Signature Track course that you complete, so long as you have verified most of your coursework with both your typing pattern and a webcam photo. However, if the problem prevented you from authenticating several assignments, please contact us.Also, please note that we do not support assignment submission through mobile devices. Also, Signature Track authentication is only supported on our iOS app.Â Weâ€™re aware that this is an issue for many students, and weâ€™re working on providing better support for mobile devices in the future. We really appreciate your patience! In meantime, you can still watch video lectures, participate in the forums, and save drafts of your quiz on a mobile device.We ask that you try to submit your coursework from a desktop computer with a physical keyboard and working webcam whenever possible, to avoid any problems with authentication.Sorry for any inconveniences!",1
8498,1415172281,"Hello [REDACTED],Â Thank you for letting us know! We appreciate your suggestion on how to improve the course. We have alerted the course staff about this and they will take the action they find necessary. However this problem may not be fixed within this session. We do appreciate that you notified us for your coursemates and for the benefits of future learners!Happy learning!",1
6900,1413340435,Ok guys you want to study together Add me on FB:Â [REDACTED] whom among us is more knowledgeable can help us.Â ,1
1939,1410150681,"I recently started my own limited liability company for my own business.Â Since this is an actual ""legal entity"" with its own bank accounts, tax ID#, own credit history for borrowing etc. I decided to use QuickBooks. Part of this was what [REDACTED] says- if my business becomes large, most external accountants use QuickBooks so I wanted something that was standard- at least in the US. Also it was only around $US 200 and the interface is very user friendly- you just click buttons such as ""add a vendor/supplier"", pay a vendor, send a customer an invoice- and the software does all the debits and credits and creates new ledger accounts as needed.I know people who are self-employed who used EXCEL to run their business accounting since they were NOT set up as a separate legal entity. In the USA, if you are not concerned with customers suing you and coming after your assets or not concerned with having your company fail and ruin your own credit scores then you can run your business as a self-employed and not be a separate entity. Here you use Tax Schedule C to record your business income or Tax Schedule E to record your real estate business income. So you might be able to get away with EXCEL if you keep very good records or rely on an accountant to help you with difficult questions.",2
9815,1417402130,"The material for this class just went up. Here is the syllabus. As expected it looks like a very good followup to our accounting course since it mentions different corporate types. what type of financials investors want to see, how to build business plan projections for your business, Â the types of funding an entrepreneur might want, there are weekly NON-PEER reviewed computer graded mini-projects to analyze a ""fake"" start-up company as it goes for funding.SyllabusHelpNEW VENTURE FINANCE: STARTUP FUNDING FOR ENTREPRENEURSOverviewThis course is for aspiring or active entrepreneurs who wants to understand how to secure funding for their company. Examine the many financing options available to get your new venture funded. Learn the basics of finance, valuations, dilution and non-dilutive funding sources. Understand capital structure for new ventures, term sheets and how to negotiate them, and the differences between early-stage versus later-stage financing. Develop an understanding of how to develop winning investor pitches, who and when to pitch, how to avoid common mistakes that limit the effectiveness of the pitch, and how to â€˜get to the closeâ€™.Key questions answered within the course include:Â When to raise outside capital?What kind of investors invest by stage and where to find them?What are the myriad of fundraising options?What are the key components of the term sheet?How to perform company valuations?How to pitch to investors?What techniques help the entrepreneur â€˜get to the closeâ€™?Course FormatThe class will consist of a series of video lectures each week. Assignments are provided to apply and reinforce learnings each week.Recommended BackgroundThis introductory course is designed for the entrepreneur who wants to understand the intricacies of what it takes to fund a new venture. While it does not require a background in finance or business, completing Courseraâ€™s â€œDeveloping Innovative Ideas for New Ventures: The First Step in Entrepreneurshipâ€ before starting this course is highly recommended.Â ScheduleWeek 1: The Early Stage Investment LandscapeLecturesDo you speak the language of raising start-up capital?Why should you start with the business plan?What financial statements do investors want to see?How do you develop a balance sheet?What should an income statement present?What is the purpose of the cash flow statement?What corporate structure should I use?How do investors view your early stage venture?Assignment due by week's end. The percentage of the overall course grade is listed.Opening Survey (1%)The Early Stage Investment Landscape Quiz (10%)NEWCO Project (12%)Week 2: Sources of Capital for the Early Stage CompanyLecturesSources of capitalWhere to find investors?Why consider friends and family as investors?Whatâ€™s bootstrapping?Are incubators and accelerators a fit?What are angel investors?When to explore early-stage venture capital?When are you ready for late-stage venture capital?Assignment due by week's end. The percentage of the overall course grade is listed.Sources of Capital QuizÂ (10%)Sources of Capital Project (12%)Week 3: Â Getting Funded â€“ Steps in the Funding ProcessLecturesWhat is due diligence?What is your company worth?How to negotiate a term sheet?How to establish common stock?When to use convertible notes?What is preferred stock?When to use alternative sources of capital?Assignment due by week's end. The percentage of the overall course grade is listed.Steps in the Funding Process QuizÂ (10%)Steps in the Funding Process ProjectÂ (12%)Week 4: Pitching Investors and Closing the RoundLecturesWhat do investors need to see?How to create the pitch deck?How to tell your story?What are the doâ€™s and donâ€™ts of the pitch?How to close the round?Assignment due by week's end. The percentage of the overall course grade is listed.Pitching and Closing Investors QuizÂ (10%)Pitching and Closing Investors ProjectÂ (22%)Closing Survey (1%)Suggested Course MaterialsOur suggested textbook for the course, also available as an eBook, isÂ Raising Capital: Get the Money You Need to Grow Your BusinessÂ (Third Edition), by Andrew Sherman. This is a valuable resource for the course, and include many sample financial and legal documents for entrepreneurs. The checklists, charts, and sample forms are valuable for business planning, raising capital, and more.Additional readings are detailed within the weekly announcements.",2
5206,1411742237,"If we had a customer pay upfront for unlimited rentals over a period of greater than 1 year, would it change the activity type? Would it become a financing activity (since customer is effectively now a creditor - advancing money in exchange for a long term liability to provide rentals)?Furthermore, let's say it was three years - could we categorize 1/3 as operating cash-flow, and the remaining as financing? Or would it all be financing?",5
7451,1413808547,The videos require alot of bandwidth. Â I pay for the highest level of Internet speed at home and I still sometimes have trouble. Â I would suggest downloading the videos and watching them offline. Â There isn't anything I can do on my end.,3
4329,1411142741,"Dear [REDACTED]I believe the answer of Prof. [REDACTED] could be interpreted as follows:Even if the sale was on account (without cash collection), it should still show up on the SCF. As I understand, here we are talking about the indirect method, where we work backwards, from net income to the SCF. Then, if the sale was made on account, it means that the accounts receivable of the company increased, so the increase of the asset leads to decrease in cash, hence it shows up as a negative amount on the operating section of the SCF.Hope this makes sense.",2
3762,1410813314,Accounts payable is 'Credited' when good or services are purchased on credit terms (or on account as given in the question as opposed to cash) and is 'Debited' when payment is made. ,1
3833,1410838502,"1. -&gt; This violates the balance sheet equation because all it did was increase the ""left"" side of the balance sheet and nothing happened on the right side of the statement.2. -&gt; Assets and Expenses are debit accounts so we increase them with a Debit entry because their normal balance is debit. This is explained in Video 1.3.1 on Debit and Credit Bookkeeping.Good luck!Â ",1
3426,1410712226,"Thank you [REDACTED] for your quick reply and explanation. Two questions though :1- What is the difference between Inventory(materials) and Supplies? I would consider oranges, water, sugar as supplies . Never knew about Inventory(materials)...2- I m kind of lost with the 2nd and 3rd journal entries. Production costs as an account is not intuitive to me. From my understanding it is not an expense because that would be double counting (Expenses are accounted for in the COGS (last journal Entry)). Then What does it mean an how to interpret it?Â  Â  Â  It is more intuitive to me to combine the 2nd and 3rd journal entries, directly transforming Inventory(materials) in Inventory(finish goods) as such :Â  Â Dr Inventory (finished goods) $1300Â  Â  Â Â Cr Inventory (materials) $1300Is it POSSIBLE and OK to do that and bypass the Production costs ?Thanks",5
6648,1413165205,"I hope he does, but as he has said that it takes a lot of time and work to prepare a MOOC, so we might not see any new courses offered by him in the short run.Â Hope for the best!!",1
5714,1412175128,"No, a company based in an IFRS country could not report any of its inventory using LIFO. Â Only companies using US GAAP have the ability to report inventory under LIFO, and it would only be their inventory in the US.",1
1339,1409967415,"I would suggest you watch the lectures 2-3 times each and give yourself time to think about the material.Â I just completed my 4th year of graduate school education in biology (so that's 8+ years more than high school!) and I am pausing in the videos to take notes and to think about the lesson. Â It really seems like a different language, and there's no problem if it takes some more time to learn it.I say keep trying!Â ",1
3532,1410739088,Good idea.,1
1290,1409953391,"Hi,I would like to know if we have people participating in this course from [REDACTED] and [REDACTED] Areas. It would be a good idea if we can form a Study Group."" if any, letÂ us try to connect.",3
695,1409837823,"Hi there! I'm [REDACTED] from [REDACTED], living and working at [REDACTED] as a business consultant.Nice to meet you all here and meet me at [REDACTED]",1
9832,1417639276,Good luck everyone,1
3824,1410835884,"I got the submissions. You are fine. 
Coursera support, do you know what is causing this problem?
",5
6033,1412521042,"As far as I understand, we can convert LIFO to FIFO, but we can't convert FIFO to LIFO, right?If so, the following statement is ""true"" because it says ""it cannot use the LIFO method"".However, they graded this answer as an incorrect. Hopefully, they re-grade my score. Any explanation will be helpful. Thanks.Question 10Which of the following are true? (check all that apply)Your AnswerScoreExplanationCompanies that have a policy of selling their oldest product first cannot use the LIFO methodInorrect0.00",5
4112,1411016247,I'm a former actuary and current economist who never previously took an accounting course. I'm interested in demystifying the information in financial reports and understanding the basics of accounting to satisfy my intellectual curiosity about the subject.,1
5993,1412495291,I want to know if we can save draft or not....,1
4309,1411130155,Hello Everyone! I'm from [REDACTED] and currently working towards a Masters in Chemistry. I'm looking to go into the business side Â of the energy sector and thought some accounting knowledge could only been a boon to me and any future employers. Best of luck to everyone!Â ,1
3617,1410760365,"Proposal:Â To make clear, that the net income consistsÂ of the 50 k$ in cash, by writing e.g..:.Net Income:Â  Â  Â  Â  Â  Cash Â  Â  Â  Â  Â  Â  Â 50My mistake:From how Q3 is typed, I had the 50k$ Cash understood as being part of Total Assets (300 k$) and that a figure for net income was missing",4
5138,1411694735,"[REDACTED]
I think your calculation is right. The Gross receivables as at 31/12/2012 was $10,000. If management had made provision for $1,000 then management expects only $9,000 ($10,000-$1,000) will be collected. I stand to be corrected.",2
9860,1418103531,Hi dear all. Got my SoA and very proud! Thank you Prof [REDACTED] Thanks to all. ATB ..Captain,1
4121,1411021585,"Hi, is there anyone from [REDACTED] that we should make a group and discuss effectively.Regards,[REDACTED]",1
9775,1416777178,"I watch the goodbye video over &amp; over. It makes me so happy, joyful and laughing like when IÂ was young.Â Â I overflow with gratitude, this Thanksgiving Day and every day. There is a word hard for non-native English speakers. When he says ""plenary"" speech, the word that appears in English captions is ""plethora,"" something quite different.
So I post a definition from http://en.wiktionary.org/wiki/plenary_talk
""plenary talk
	1.	A talk during a conference or similar meeting that is scheduled at a time when everyone can attend, e.g. at a time when nothing else is scheduled.""",1
6517,1413015614,"The way we calculate the Pre-tax Income in the financial accounting is different compared with tax accounting, otherwise why the last should exist :)For example I think about the way bad debts are managed:- financial accounting: it is percentage the management calculate from the past- tax accounting: a bad debt is recognised when written offObviously this is my guessâ€¦",2
8313,1414964345,"Too ""taxing"" for me.Â  I only got 4.6 out of 10 on the homework, and I'm not going to try a 2nd time.Â  I'm not here to learn that much about the tax law portion of accounting, so I think I'm going to dropout at this point... I'm sorry to say.",3
2583,1410372659,"Thanks [REDACTED].. yes I understand the RE formula now. I did not at first so .. which video is that covered in please . .I need to review it I think. But .. what I am trying to get to here is ..am I understanding the accounting formula as a whole or not. If that problem had given me ""total stockholder's equity"" then it would mean that I totally did not understand the accounting formula. IF instead that is a value that must be derived .. as I think what I did would do that . then I am ok in my understanding. So the question here is not Â .what is the answer asked for .. I see that now .. and everything else was just.. extra information. But it did confuse me that it had said total stockholder equity so this is the answer I have found for that situation and I am asking if it is valid or am I even more confused than I thought?",5
552,1409816083,"Hi, am [REDACTED], am a software developer from [REDACTED], i just hope this course will help my understanding of the accounting process",1
2357,1410294187,"Hi everyone!I think it might be a good idea to create a multilingual vocabulary of accounting terms in our languages.Â I just started a spreadsheet on google docs for English, Russian and German:Â [REDACTED] (link for viewing and editing).If you want to participate, add a new page with your language and/orÂ new terms in one of the threeÂ categories:- Balance sheet (e.g. Assets, Liabilities)- Income statement (e.g. Expenses, Depriciation)- Cashflow statement (e.g. Operating activities, Income taxes paid)Let's see whether that works!Â Of course, any suggestions are welcomed!Best [REDACTED]",2
333,1409779650,"Hi everyone,Â  I'm a Program Manager @ [REDACTED]. Keeping up with accounting basics. ",1
6329,1412765953,"Confused about the dividends in the balance sheet equation The equation says Asset= Liabilities+contributed capital+ Prior retained earning+revenue-expense-dividends Why in the debit/credit video he removed the dividends account and considered it as a decrease in retained earning, while retained earning = prior retained + net income-dividends   So i want it to be proved mathematically to make sense
Did he assume that net income = 0 or something?!
",5
1630,1410052470,"according to Relic Spotter Corporation case(Exhibit 2: T-accountsÂ ),Â Prepaid Advertising is asset account while Advertising Exp. is expense account, so how can Advertising Â ExpenseÂ would be increased with a Debit? and hasÂ debit balances?i thought theyÂ were different,Â Prepaid Advertising is Debit account whileÂ Advertising Â Expense is Credit account.",4
6635,1413156308,Professor [REDACTED]: Would it be possible to provide us with a case study similar in content to Relic Spotters but for a manufacturing company. I think this would go a long way to help clarify the inventory flow for companies that build and sell goods and also show us a good comparison to the financial statements for the two types of companies. Thank you.,6
1016,1409904846,Hi! Count me in as well: [REDACTED],1
295,1409777063,HI all.Â  This is my first online class but mainly a review of accounting and GAAP for me.,1
9181,1416166669,"hello [REDACTED],itp is calculated for the official tax use:it is calculated using the statutory rate since the tax authority does take not into account the internal tax caluculations Â of a company.it is used with the taxable income.the effective tax rate appears since there is a difference between the pre tax income end the taxable income:this difference comes from the permanent and temporary differences.what prevails is the official tax rate (aka statutory)and the taxable income.best[REDACTED]",2
2658,1410409154,"Coursera does have its app for Android and for Apple, but the app only support watching video lectures but not writing exams. This is a pity for guys who could not attend the exams at a desired time.",2
3813,1410834589,"There is one actually. I didn't think to look myself - would have made this much easier. It's the document alongside the third video from Lesson 1. The first three slides are worth printing and keeping for future reference. With these equations, this question was finally simple.",1
9171,1416155800,"First off, thank you so much Professor [REDACTED] for the course. This is my first MOOC and I wasn't sure what to expect. What I got was an interesting, very informative and rigorous class. You are an excellent teacher and it's obvious you put a lot of work into putting this course together. Very early in the course, you enabled me to ""get"" debits and credits and journal entries which has been a practical benefit for my job.For my fellow students...or Professor [REDACTED]...do you have any suggestions about online courses about non-profit accounting? Non-profit accounting is in some ways much simpler but in other more complicated than for profit accounting. I work in non-profit bookkeeping and would appreciate any suggestions you might have. Thanks!",4
4985,1411582630,"Question:Â Must exchange difference be always added back to net profit under operating activity. Anyway to do a quick operating activity figure, so that we know what is the figures.Thanks.",5
1025,1409905942,"You can try as well 
""Principles of Financial Accounting"" from Belverd E. Needles, Jr and Marian Powers,
Regards
",1
