id,post_time,post_text,Urgency_1_7
940,1389944151,"Hello [REDACTED],Thanks. Yes, I get the answer to the question as to why the limit doesn't exist (because it goes to + or - infinity);&nbsp;but what's wrong with L Hospital's rule here? Why is it not giving the right answer?",4
2133,1391632292,"Ah! &nbsp;Gone away to do more research and I now realise what I didn't understand. &nbsp;I can now implicitly differentiate&nbsp;Y^2(X-3) or&nbsp;Y^2.X - 3Y^2 (and get the same answer, BTW!) so I'm happy.",2
3679,1396824168,"That was very helpful. I assumed it was a shifted series. I forgot that with logarithms, the parameters can simply be expanded out with simple addition. That problem had been bugging me for a while. Thank you for that. ",2
3428,1395536616,"Problem: Code of Conduct violationType ID: flag-overviewProblem ID: flag-abuseURL: [REDACTED]Additional details: A Student in ""Calculus: Single Variable"" had written a hostile post to one of my fellow coursemate and friend in the forum using inappropriate language including swearing words, which I will quote: ""Screw you"". Please take appropriate action in order to maintain the forum a harmonious place for others to discuss things pleasantly. Thank you.",5
1838,1391023471,What about the problem makes you think it requires the third derivative?,3
2708,1392945019,$$\large x(t) = \frac{1}{-t + C} = (-t + C)^{-1}$$$$\large \frac{d}{dt}x(t) = (-1)(-t + C)^{-2} \frac{d}{dt}(-t + C)$$$$\large \frac{d}{dt}x(t) = (-1)(-t + C)^{-2}(-1)$$$$\large \frac{d}{dt}x(t) = (-t + C)^{-2}$$$$\large \frac{d}{dt}x(t) = ((-t + C)^{-1})^2$$$$\large \frac{d}{dt}x(t) = (x(t))^2$$Etc.,2
1028,1390000711,"Did anybody solve this problem more simply? I started by attempting to evaluate lim as x goes to &nbsp;infinity of p(x)/e^(lnx)^a. P(x) is polynomial. I took the log of the limit separated using log properties to get ln(p(x))-(lnx)^a. I then assumed that in the limit ln(p(x)) goes to lnx( if we ignore constant multipliers.) I then got lnx(1-(lnx)^a-1). Then I hypothesized that if a&gt;1, 1-(lnx)^a-1 would go to -infinity, so lnx(1-(lnx)^a) would go to -infinity, and putting e to it would produce 0 in the limit, meaning that any polynomial would be in O(e^(ln)^a) If a were less than 1, lnx(1-(lnx)^a-1) would go to infinity, and putting e to it would produce infinity in the limit, meaning that no polynomial is O(e^(lnx)^a)",4
3358,1395180803,"At the beginning of the catenary example in Lecture 35, I do not understand where the sqrt (1 + u^2) comes from...What am I missing?",4
233,1389415784,"I can barely remember that. we didn't use Taylor Expansions in our class.There's this Second Derivative Test right? plus, there's this determinant, Hamiltonian IIRC, you check if its equal, greater than, or less than 0 to determine if it's max/min, or saddle..BTW, is it delta F or Df, as in the total differential? it's too long a video, I don't want to watch it. http://en.wikipedia.org/wiki/Exact_differentialhttp://en.wikipedia.org/wiki/Total_derivative=======[REDACTED] ",3
3806,1397508814,"The practice problems are starting to use the limit as x goes from 0 to infinity of $$(1+1/n)^n$$ a lot, along with more complicated variations of the same limit. I'm pretty sure it has something to do with e, but I forget why and how. Does anybody know what lecture I could go to to find this out?",4
2563,1392494086,"I really do not understand what is wrong with this conceptually:$$ C_{k+1}(k+1)Â + C_{k} + C_{k+2}(k+2)(k+2) = 0 $$Also, why were we able to eliminate all the ts? Some posters have said that sine the power series is always equal to zero, therefore the coefficients must be equal to zero, is that sufficient?For example, can we really say that an equation of the form Bt+ Ct^2 + D = 0 (for all values of t) then B+C+D = 0??I mean, could there be values for the constants so that terms could reach zero without the sum of coefficients being zero? How can we be sure they are all equal to zero? Is this a rule of algebra? Are there any internet resources about it? (like a proof?)",4
1930,1391222008,"Sorry my trig skills are very rusty. Any suggestion on how to tackle this exercise?
",3
1881,1391094654,"yes, you'll see a few more /mindblown/ bonus lectures in this class, i hope. and the thing that should really make you marvel is that this is just the beginning of mathematics -- there's so much more out there. happy travels!",1
2632,1392645270,Is it possible that one of the answers is missing the ^2?I get an answer very close but I get (x - 2)^2Otherwise can I start with u = x^2? Â  Is that best?,4
39,1389348793,"It&#39;s good to be back! All hail......Jessus [REDACTED]!!!
",1
3666,1396797883,"Started to apply the ratio test to series$$\sum \frac{ ...(4n-3)}{ ...(3n-1)}$$I ended with this limit$$\lim_{n \to \infty}  \frac{ (12n^2 - n - 1)}{ (12n^2 - n - 6)}$$I see that the numerator is greater than denominator, but after trying to factor out the biggest term I calculated the Limit = 1 (even wolframalpha agrees).But the results say, this series is diverging, that means limit should be greater than 1. Can anybody explain why?",4
2550,1392485751,"Hello [REDACTED], thanks! There's an enroll button which leads to an error. Seems it hasn't gone online yet.Â ",5
510,1389579353,"After puting the derivatives of ln(1+2x) and ln(1-2x) together:2/1+2x + 2/1-2x = 4/1-4x^2, I wrote it as a geometric series, and then integrated, achieving:$$\sum_{k=0}^{\infty} \frac{2^{2k+2}x^{2k+1}}{2k+1}$$even though there are similar answers, none really match. First of all, why does all the answers start from k=1, and not 0?Thanks in advance, [REDACTED]",4
1810,1390983774,"hello all,Sorry about the confusion. The correct histogram has now been posted. Thanks for your patience.S.",1
1421,1390500991,"sorry [REDACTED]. the time deadlines are hard-coded, especially for the final exam. perhaps you should try the quizzes anyhow and see how it goes. if you're simply interested in self-evaluation, then you can always print out a copy for your personal use.&nbsp;",1
1306,1390339669,"I factor the function and get 1/ (x+1)(x+3), and x near -2 so 1 / (x+3)(x+5), and what should I do next?",4
2698,1392843076,Thank you!I had forgotten that you could legally use constants to modify the integral to make it integration-friendly.I remembered something about a constant but immediately shrugged it off as being illegal (and too good to be true!)Next time I'll check my textbook :),2
2702,1392892156,you lost me here! How on earth did people get to add a 'pi' into this question? Where did it come from?I got as far as this:x(t) = -ln(C-t^2/2)Not quite sure where to go from here - though I'm sure it's staring me in the eyes.,4
1384,1390426811,"[REDACTED] LOLZ!!! Bwahahahha I was like this: "" :O"" when I saw the email notification :PPPP and then...and then....and.............I see it.... lolz :PP good job!!! (for both the homework and the prank :P) I did it on second as well :D",1
120,1389373298,"Nice to see you again, [REDACTED]!",1
842,1389835952,hii just enrolled in this coursewhere do i find the diagnostic testthanks[REDACTED],4
1895,1391112228,Quotient rule is good practice here but it can also be done with some algebra and the power rule:$$\frac{x^{1/3} - 4}{x^3} = x^{-8/3} -4x^{-3}$$,2
3059,1394084891,I am just finding it impossible to understand these Volume problems. I tried by finding the Area of the base (through area between curves concept) and then got stuck reading about the different cross-sections perpendicular to y.How is everyone doing this?,4
2612,1392587579,Staff??,1
3131,1394367438,"Do you mean the triangle wedge?You know that the area of a triangle is described by $$\frac{1}{2}bh$$Â Now if you let your radius $$r$$ be the base of a triangle, then $$r*d\theta$$ is the height, because you might recall from physics or math of a circle that $$\theta=\frac{s}{r}$$ where $$s$$ is the arclength of the traced out circumference. So $$s$$ which IS equal the height in the triangle as we are speaking of INFINITESSIMALS is $$s=r*\theta$$It works exactly because we are dealing with $$d\theta$$ infinitessimals.Hope that makes sense?",2
200,1389402034,"Hi guys. I took this course last year, along with 3 other courses, and barely managed to pass two, including calculus One.   I ran out of time and only managed a few points. After studying some pre-calculus,  I'm back to again. This class is a great challenge for anyone who wants to have good knowledge of mathematics. Professor [REDACTED] Thanks again for letting me be here, now I will put more effort into learning everything possible.",3
