id,post_time,post_text,Urgency_1_7
781,1367516537,"I dont totally agree with some classmate. In my opinion, every artwork have a gap or aim, althought it can be express your feelings. Design can be use to express it too, but it isn't the main aim of design. Design is a tool to improve the life of people, so there are needs and artifacts try to resolve them.But functionality has to be engaged with shape, and connect with user, sometime here is when art and design are convergenced, and confused as well.So, I think Inversion is closer to art than design, although it is combined with artifact like handbook is an important part of product design too.",2
400,1367369400,Hey [REDACTED]I knit too... And face similar issues.What I do is make this&nbsp;http://www.knitideas.com/profiles/blogs/leftovers-yarn-bowl&nbsp;once in a while...It makes really colorful bowls which i store tiny things in :)&nbsp;,2
857,1367542567,This is great - thanks so much for putting these all in one place.,1
4503,1369928187,"If anybody would like to take part in my purchase intent test for the laptop stand I am working on, I'd be very grateful.I already have a few responses from printed fliers but a few more would be helpful. I live in a remote place and face to face surveys are a bit problematic.If you wish to take part, please leave your survey responses via the multiple choice survey&nbsp;on the page, thanks.[REDACTED]",2
1072,1367646101,"Hey&nbsp;[REDACTED],&nbsp;I added some quotes from you on my ""My Gap"" page, I think it makes it a little more interesting, please tell me if you have any objections to that so I can remove it from the post, but I really think it enriches the page and gives the project a deeper meaning I really like.",2
3152,1368472332,Go to&nbsp;[REDACTED]and check your assignments.If it is evaluated you will get the score.,1
4952,1370315522,"I almost went crazy one day after submitting peer review, only to have it seem to disappear. It turned out that I have signed into Weebly using two different email addresses, and I'd signed in using the wrong one. I've had no issues with submissions, though I've had to pay pretty close attention to detail. &nbsp;I'm sure that if [REDACTED] had a large staff of graphic designers and UI experts at hand, that the submission process might have been more friendly to those of us with short attention spans. :)",6
782,1367516898,"I have been successful submitting my homework assignments, but am unclear on how and when I need to review my peers. Is there a specific evaluation period at the end of the course, or am I supposed to evaluate 5 different peers each week? If so, how do I find their sites to review?Thank you!",5
4020,1369336469,Thank you again. Any suggestion has been a great help!,1
3338,1368625640,"I agree with you that would be a good idea- maybe that would be a good project- the only thing I know of would be a web service like weebly or google blogs. A thought, if we put keyword search on our blogs they could be cat organized. 
",2
2045,1367859129,"Hello,I am [REDACTED]. When I click on [REDACTED]'s web address, within the Students' Website Forum, it takes me to&nbsp;my own web site ([REDACTED]).&nbsp;How can we fix this? Thanks.[REDACTED]",5
1908,1367837432,"Hello, my webpage is[REDACTED] I would absolutely love any feedback on my website PLEASE, since I'm not using weebly and haven't had any formal design training. Really looking to improve.Thanks!",4
4874,1370222193,http://hgsprojectportfolio.weebly.com/5/post/2013/06/assignment-51-concept-testing-one-concept.htmllooking out for suggestion....thanks!!!,4
172,1367268315,Hello from [REDACTED]..looking forward to this cours,1
4475,1369896472,"Hi [REDACTED], I just voted on your tool organizer. I am afraid I probably would not buy, because I am currently very satisfied with the way I have organized a drawer in my kitchen to hold all my small tools. Here's my site: [REDACTED]please vote!",2
6050,1373381149,Do you know how difficult has been to write this from my cellphone?&nbsp;,3
904,1367580634,Oh wow! So many people from around the world! this is gonna be a great learning experience!!I'm [REDACTED] I am from [REDACTED] too! :D I am in [REDACTED] at the moment! ,1
5705,1371990300,"Thanks for a great experience. Learning to organize the thought process for product development has been wonderful. I have many questions about the course structure, number of participants and idea generation/success and have blogged about them here [REDACTED]
",4
2879,1368379140,Thank you for your replies - you have been very helpful!,1
5561,1371635278,"Hi everyone, I found a presentation with a lot of resources that can help in the naming design process. There are name generators, reverse research tools, puns, merges and a lot of other stuff: [REDACTED]HTH,[REDACTED]",2
5575,1371671125,"Hugs, yes I hope to see you all next time! We don't say good bye but only bye for now only xxx",1
1305,1367733231,"Thank you for the offer :). i hope I'll get to it, since it seems very interesting.",1
38,1367226713,"I don't think you need to worry if a gap has been filled or not. Start with gaps that you experience on a day to day basis (clearly, these aren't filled for you!). Your solution can be different from those out there and they might be better too! One step at a time. It's not as useful to envision the final perfect solution.",2
5313,1371242970,"Hi [REDACTED],When I started the course I look all site and homework and the prototype was there, I'm no designer neither have manual skills, however with a bit of will and without much accountability I managed to make the prototypes, not a work of nature but pass the essentials. I think doing something that does not have domain, endeavored more than if I had chosen something I domain. I hope you have enjoied the course.",2
559,1367430192,"No visual design background for me. Except for hobby related collage, photoshopping, drawing, painting and doodling. No serious background. I am a studying sound designer, however.:)",1
1027,1367624253,"Hi everyone, here is my site. 
[REDACTED]",3
597,1367444405,"Hi guys,I am still looking around for gaps. It turned out it's pretty hard, because even if I find something annoying, that could be easily solved by going to the store and buying the right device that addresses the issue. Anyways, here's the list of some things that I find annoying in my everyday life. I know, some of these could not be solved&nbsp;easily, and therefore could not be used as a potential gap for the project. Please be patient, and I would appreciate any feedback. So,It gets annoying when- a neighborÃ¢â‚¬â„¢s dog barks during the night.- TV remote gets lost.- I loose signal on the phone. (service coverage map mobile App?)- coffee mug gets upset.- too much ads on the radio.- people show up unexpectedly next to my cubicle.- credit cards get scratchy (in the wallet!).- home key gets lost in the backpack, and IÃ¢â‚¬â„¢m looking for it in the dark.- great Coursera classes start at the same time!- people talk too much when I need to go.- I get hungry right before sleep.- traffic (duh!).- I go to the public toilet, all the cabins are busy.- GF/wife yells without reason.- gym machines/equipment are busy for too long.- I forget to recharge the phone/laptop/tablet, and it dies when I need it.- people leave shopping trolleys on the parking lot.- I canÃ¢â‚¬â„¢t find shopping basket at the store.- stupid driver cuts in front of me.- I canÃ¢â‚¬â„¢t wear sunglasses in the water on a sunny day.- I donÃ¢â‚¬â„¢t have change for a vending machine.- I have to use 2 different Instant Messengers, because some of my friends just donÃ¢â‚¬â„¢t use gTalk!- the bread gets stale, food/milk gets bad.- I canÃ¢â‚¬â„¢t find the right words.Thanks!- [REDACTED]",3
595,1367444003,Sound interesting !I just &nbsp;registered there :)&nbsp;,1
4808,1370192614,"Please take mine !!I have taken yours too, so please ![REDACTED]",2
411,1367371976,"I concur on the less distracting here! I was literally about to suggest a new thread when I looked at the thread list and saw this one here. That was posted 9 hours ago. Clearly, you were way ahead of me this morning!My family was not really into anything nerdy when I was growing up (probably the opposite, actually). But I read CS Lewis when I was itty bitty, found Frank L. Baum after that, followed by Tolkien shortly thereafter. It was all down hill from there! Asimov and McCaffrey were also on the list of authors I got into in middle school. I was a ravenous bookworm once I was old enough to read (I even went as a bookworm for halloween one year). Before high school I consumed nerdy stuff almost exclusively via books, but added art and television/movies shortly after I got there. And rpg's (no kids for me yet, but I do have several friends who do have them, they're usually around while we game, since we only meet up once every month-ish, though as they grow older we'll probably have to make the games a bit more kid-friendly when they want to join in) after that and into college (where I joined the Science Fiction and Fantasy Guild while I pursued my art degree for graphic design!)Not into supernatural (yet), only caught a couple of episodes here or there and didn't like them much. But that was the same impression I had of Buffy before I sat down and watched it from beginning to end, so I've hardly passed judgement on it. I think we may start watching it later this year, after most of the tv shows we dvr go on break!&nbsp;I watch Castle mostly for Nathan Fillion, though I do really like the actors playing his mother and daughter as well! They just have some amazing chemistry together on screen as a ""family"" and are really hilarious.&nbsp;",2
3795,1369070369,"Yes, you can easily unenroll. Just click your name at the upper right corner of any Coursera page and select ""Courses"" from the dropdown. You'll see a course status page listing ALL your Coursera courses, including those you have completed or which have not yet begun. You'll see an unenroll option under the title of all out active courses.You can unenroll at any time before the end of the course, so if you have the spare time now, you may want to wait to unenroll, and glean whatever you can this time around (e.g. class discussion will be different each semester, so this session's forum may offer some unique insights). Once you unenroll, this course will no longer show up on your list, and you won't be able to access the course assets/materials",1
5214,1370979518,"First of all, I want to extend my appreciation to all the wonderful people that have made this course possible for us. We are all very grateful to you; Mr [REDACTED], Ms [REDACTED], [REDACTED] and every other person behind the scenes. I'm sure a lot of us were very thankful to have week 7 lectures available last week as it was very helpful. Some of us would like to know if it's possible to have week 8 lectures posted this week, for those who would be unavailable next week. It would mean so much, because we've come a long way in this course, and we don't want to stop at this moment when it's just about to come to fruition. We would love to fully complete this wonderful course! Thank you very much in advance.",6
5197,1370952590,I see this too. Just added a comment to bump this thread.,1
2740,1368260168,"I try to use open source software when possible, but I have to concede that there is some merit in using a free download of Adobe Photoshop CS2 (which is not the latest version) from a software site like Techspot or from Adobe itself (where you can also get several other Adobe CS2 products free) You may have to use Adobe on some future project, and the skills you learn are fairly readily transferable to other products, because others generally tend to model on Adobe, the market leader, not vice versa.I actually prefer PAINTshop Pro (which I have been using ~18 years, from its introduction by JASC in the 90s through its buyout by Corel) For well over a decade, Paintshop worked faster on Intel machines than the originally Mac-based (Motorola CPU) Photoshop, which was only *ported* to Intel. That's changed a bit since Apple went Intel -- but older Intel (Windows) computers will still run Paintshop faster than PhotoshopI just checked Adobe's page, and after millions of downloads this past month, they have now&nbsp; added a dissuasive message that wasn't there last month.&nbsp; Please note that though they ""strongly advise"" against using outdated software [""PAY for our new stuff instead""], it's legal enough that 100% legitimate commercial software sites are re-distributing it! -- and frankly, given Adobe's long history of security bugs, which were worked out of CS2 over years-log reign as ""the current version"", it may be safer than CS6+. I still prefer to use MS Office 95 (the last version before they introduced macros, which were a major source of security problems for the next decade) on my personal computers, even my work has given me all the later Office versions (""assure compatibility with our current version""). I've always been a techie-type but I honestly never miss any of the ""new"" features (only&nbsp; professional Office users even *know* about 90% of the new features since Office95) I much prefer the interface (from the days when MS was still working on increasing usability rather than justifying a new edition for a fresh revenue stream) and I'm safer.",2
4301,1369683495,"I understood the instructions clearly from the beginning, but I can see why Professor [REDACTED] took this step: the evaluation procedure was not intended (nor would it serve any purpose) to weed out those who didn't catch on the methods/procedures immediately -- not even those who could/should have understood.D:AiS is richer for the participation of *each* student. We're better off having them than discouraging them",2
5301,1371213814,"I think not really, the assignment does not specify it. &nbsp;I think some people (like me) do it to explain how they come up to the name. But if you already have one I think itÃ‚Â´s ok. :)1. The name you will give your artifact. This could be a brand or product name if you are doing something in a commercial context, or could simply be what you will call this artifact. I would like you to use your skills in naming from the video modules this week to create this name.2. One or more nice images of your prototype. (In most cases this will be a photograph, but in the case of websites or other non-physical artifacts, you may use other types of images.) Provide some annotation or explanation of the artifact if needed to understand how it works and its key features.3. Some background on the gap you addressed and your problem definition (e.g., the key user needs).4. A very short (i.e., one paragraph) description of what the next steps would be to further refine and develop your artifact.5. Any other information you feel might be interesting to your classmates, or relevant to evaluating your work.",1
5056,1370702296,"The problem summary:Can not view the assignment, when I click on "" go to assignment"" for this week, due tomorrow Sun 9th, absolutely nothing happens. I will try not to panicSteps to reproduce:Screenshot:",5
54,1367236202,"Hey :) So I have this friend who wants me to design a logo for her. She's just started this new clothbag-making hobby and she's just started selling them. Is this a good enough ""gap"" or problem? Or does it have to be more personal? Confusion. Help me please?",4
1797,1367820205,I am traveling and I had some difficulty posting and submitting my assignments.&nbsp; As a result I did not meet the deadline.&nbsp; My work was submitted but I am still not sure it was submitted correctly.&nbsp; I too would like to continue with the course.&nbsp; I hope the work that I submitted can still be graded.,6
6043,1373021002,"When you enter on Coursera website Ã¢â‚¬â€œyou must be logged inÃ¢â‚¬â€œ, you should see 2 links just under the name of the course and the number of days since it finished:""Get statement of accomplishment. View grade""With the first one you get it just in one step. The View grade option drives you to Coursera Records. There, you could see your grade and download your statement of accomplishment too. I think that you don't receive a personal mail. You must look at your own records on your profile.I hope this helps.Cheers!",1
5857,1372098081,"Thank you for sharing this article, [REDACTED]. It&#39;s right on!
You may enjoy this one from the KLM magazine (I read it on the plane a few weeks back and found it online). It&#39;s also related to content inthe course:
http://holland-herald.com/2013/06/nothing-succeeds-like-failure/
",1
3388,1368678328,"Hertz Tells Me It Has No Idea How To Read A Fuel&nbsp;Gauge [link]""Anyone who has returned a rental car with less fuel than agreed to knows
 full well that rental company employees understand how to read a fuel 
gauge, because there is money to be made if youÃ¢â‚¬â„¢re coming back light on 
gas. But one Consumerist reader says itÃ¢â‚¬â„¢s a different story when you 
prepay for fuel and youÃ¢â‚¬â„¢re the one looking to be reimbursed."" ",1
4656,1370093577,"Hallo everyone!I was working on my assignment and I realised [REDACTED] did not include the cost of the products in the forced choice concept test. I am uncomfortable with this, as for example when a consumer like one design more than the other, he/she may not purchase the favourite design due to the high cost and settle for a cheaper alternative that is acceptable.What do you think? How are you approaching your project? I will probably need to make a decision tonight.",3
310,1367334558,"Thanks [REDACTED], I imagine there are more people who feel like we do. I hope the instructors will be understanding in our cases. I really want to work on something good, for my own ease and pleasure and I feel if there is a too strict deadline on it, I'll end up disappointed.Of course, I wouldn't restart by week 7. That would be just plain silly.",6
788,1367519274,"Hello,My site is: [REDACTED]good work!",2
3923,1369231251,I had the same issue,2
5615,1371822766,This is always difficult no matter how much you plan. Sorry we cannot get to every post but I'm sure you came up with a good solution - you'll be happy at some point that this happened - we learn a lot more from these kinds of situations.,1
5082,1370791528,"Hi, [REDACTED]. I think constructing your actual size chair from cardboard is a really smart idea. You can get an idea of scale and dimension and see how it will work without spending so much money on wood. It's much easier and cheaper if you need to refine your design. Good luck!",1
1457,1367775149,"HI [REDACTED]!&nbsp;u're right, our gaps have smthg in common. i really liked ur project. &nbsp;and the way you represented it. the sketch and prototype are very well done! and the ideas of photos is interesting, and probably as u said if it's magnetic they can be removed and placed easily!&nbsp;",1
2594,1368141535,"I think this course could be the kind of ""creative/innovative space That Johnson describes in other books (the Parisian salons of modernism -- or coffee houses, both in the age of enlightenment, and in political revolutions today). I'd like to encourage all of you to post in the threads of other projects. It can be hard to ""put yourself out there"" (I've been a tinkerer all my life, so I have a lot of experience with a lot of random stuff, but I don't want to come across as a know-it-all) but it's really what we all need.Give and ye shall recieve -- at least that's my misbegotten operating plan. If I'm wrong, well, at least I gave",2
419,1367373715,"I think you can set it up so that the image redirects to its source; that might work? For mine, I used a screenshot from a pattern I downloaded, and credited the pattern via a link in the text. I'd love to know if that's wrong/inadequate, though! (I haven't made it live, though)",3
2847,1368349619,"Totally agree. It&#39;s 2013. Soundquality should at least be good!
",2
1548,1367787362,I really need to stop leaving things to the last minuteBut here's my website![REDACTED],2
1773,1367815695,"Hi, I had the same question and was hoping someone could answer the 2nd part of [REDACTED]'s question; that is, where/how do we review others' work? Do we just pick any 5? Are we assigned them randomly? Also, where do we do this? I see the area where we can assign points etc. when I am in the area to submit my own work, but not sure where I would find that equivalent for others. Clarification please? Apologies if it's on the videos somewhere and I've missed it, but I did look through everything and don't see this answer.&nbsp;Thanks in advance.",5
5075,1370761882,"Nice !! An yeah if you are not good at carpentry, may be you can make do with the current prototype.&nbsp;Regards.",1
3337,1368625103,"Is it possible that if you complete more than the required 5 peer evaluations, and then self-evaluate and then complete additional peer evaluations, you will be penalized for not re-submitting your self evaluation??? It seems this has happened to me.
",5
3347,1368639359,"Hi classmates! Could give me a feedback , please. :), Thanks",2
5987,1372653275,This course is amazing and I'm so interested in taking more time studying on the topic of design. Any further courses or suggestions?,3
2255,1367929451,"I'm very interested in sustainable, and specially in the upciclyng concept. My main gap for this course is the creation of a good looking cat tree/scratcher recycling my moving boxes. Here is my web page.&nbsp;If you're interested in sustainable life, this is a great website, because they go beyond the simple recycling concept.For upciclyng this is a good site, plenty of examples.  &nbsp; &nbsp;",2
4420,1369837910,"Hello&nbsp;&nbsp;[REDACTED],I honestly donÃ‚Â´t understand your Gap. Prototypes B and C already exist in the market. Also the Photos you posted seem to be from some website. Could you explain it further to be able to participate?&nbsp;",1
2748,1368271452,Why all that complications?You need to post only a paragraph about the inetrviews...[REDACTED],2
1824,1367824446,This is mine:[REDACTED]Please review. Thanks,2
4042,1369360782,"[REDACTED], That's EXACTLY what I have done for week 3 and will continue to do moving forward.",1
5036,1370606132,"I appreciate your advice,&nbsp;[REDACTED], and I tried it but I had problems with Inkscape which, to be honest, took me to the limits of my patience. I feel like I am chasing around after a bit of paper blowing in the wind which may or may not be a Ã‚Â£10 winning lottery ticket.So, as per [REDACTED]'s advice, I have uploaded the two files in .eps format here:[REDACTED]If anybody could convert these into a format which I can use and extrude&nbsp;in AutoCAD, I'd be very grateful. I'm not asking for anybody to do the extruding as I think that ought to be something I do myself.That all said, I think I am running out of time to get this done and 'printed' by the end of the course but I may carry on with my project after the course just to see it through. And if I gat a working foldable laptop stand out of it, so much the better. ;-)",4
4114,1369508279,I have a crush on her voice :D :D,1
3973,1369292444,"I'm loving [REDACTED]'s use of Management with design. He has so far taking examples of management from both operations management ( TQM) as well as marketing management ( consumer research). I sometimes wonder why in our field of design, we don't have a more structured ""design management"". After completing 5-6 years teaching as a well as practicing design, I learnt management as well. I was surprised how much was borrowed by marketers for design (concepts like brainstorming) and how little is borrowed by active designers. Even some HR professionals have now started coming up with tangible quantification methods for evaluating intangibles like creativity. For one, I have tried Johari window concept, that makes me get a grip on presentations.&nbsp;Or maybe there are some of you who have been practicing management principles to design. Can someone give examples of how you have applied or seek to apply different management principles to this creative field?Does anyone want to take this as a further project some day?[REDACTED].",2
3054,1368447841,"It occurs to me that my case may be related tothe grading glitches that we had on this question last week, and may not apply to the course's overall grading.I don't know if this is the case, but it's plausible.I'm still curious about how the evaluation averaging is *meant* to work.",4
2773,1368287624,i just cant submitt the second assignment FIND THE GAP for some reasons it shows only evaluation bar ....can any 1 help me my site is right here [REDACTED],5
2022,1367857282,"This has been fixed, please award the student 1 bonus point.",1
1921,1367840491,"Greetings everyone,Like I posted earlier in week1 thread, I will reiterate my suggestion here.I know I have started a duplicate thread but the urgency of this issue has forced me to do so. So here it goes :I would like to request the staff of this course to extend the deadline of first homework by one day, and if possible incorporate 2 day soft deadlines so that issues like time-zone and server-errors can be taken care of before the hard dead line.&nbsp; &nbsp; &nbsp; &nbsp; &nbsp; &nbsp; &nbsp; &nbsp; &nbsp; &nbsp; &nbsp; &nbsp; &nbsp; &nbsp; &nbsp; &nbsp; &nbsp; &nbsp; &nbsp; &nbsp; &nbsp; &nbsp; &nbsp; &nbsp; &nbsp;-=^.^=-",1
3719,1369028319,"[REDACTED]: the dates are correct, as far as I'm concerned. It's the evaluation of week 2 assignments that was supposed to be finished on May 20th, not the submissions.Good Luck",1
4581,1369996517,"I took your survey [REDACTED]..nice concepts, very practical.",1
4926,1370288426,6a and 5c are combined within week 5. ,1
