id,post_time,post_text,Urgency_1_7
2747,1368270574,"Hi,Am I still able to participate in this course at the time of writing?Best Regards",4
5942,1372326321,Hi GuysI did not realise &nbsp;a discussion had started regarded Linked-in and I started one myself ([REDACTED]).I had just created a Linked-in profile yesterday regarding the course:&nbsp;[REDACTED]&nbsp;and i'm easy regarding joining this or the existing group. the point is to stay connected and support one another.&nbsp;Good luck on all future projects.[REDACTED]Ps - if it's easier to manage I can change it class specific - ie April 2013 class only - so we have the option of one for this class and one general one (the existing older group),2
5054,1370700544,"Good morning!Given the behavior from [REDACTED] and the not very clear behavior in the management of the [REDACTED] Microeconomics course and for the issue of relative certificates, I would like to know if anyone here has problems with outputting the certificate of Microeconomics course at [REDACTED].Also, I must point out that the Microeconomics course and the course of [REDACTED] have been removed from the page at [REDACTED].Thank you!",5
1317,1367736612,"Websites of many architecture firmsandwww.chinavisual.com&nbsp;www.designboom.comand some interesting magizines,some artists' blogs",2
3716,1369026554,"As long it the intent is clear, it should not matter whether the numbering is alphabetical, roman or numerical. We are here to learn design and in design you are not expected to stick to rules that do not matter..&nbsp; :)",2
79,1367245083,"Yes, and take a look at the ""Website Example"" I've given some other sites. Please use whatever you'd like.",1
1054,1367637870,"Are these references online/referenced online? (even an amazon listing for a book title or artifact) If so, then you could link them in the text where you discuss them, but if those online references are more along the lines of an amazon listing than a digital resource, then I'd suggest either a brief listing at the end of the blog post where they're discussed or a separate reference page with all references in addition to the link. Which of those you choose would, in my opinion, depend on the number of references in the post. If the latter, I would still recommend directing readers interested in citations to the reference page at the end of any post with sources.",2
2489,1368051362,How do i contact the TA's or prof? Does anyone know? Thank you&nbsp;,4
2468,1368043499,I am unable to understand this assignment.Please explain do we need to write a paragraph for the refinment or a single line.Also please explain other points too.,4
2949,1368416771,"Hello Everyone,Can you please fill out this user needs survey for my world saving mobile app? Thanks!Permaculture Eco-Guide Design Survey:[REDACTED]",2
5331,1371288169,"Hi :)I voted for all your projects and it was funny!I want to thank all of you for voting mine, too!Have a nice weekend :)",1
32,1367223069,"I'm in [REDACTED] and the time difference means that even if I post before the due time of Sunday 11:59PM US Eastern, my blog post would show that it was posted on the Monday, because that's what day it will be here. Will this be accounted for in peer reviews or will I have to change my system dates back to US time? Submitting on Sunday in [REDACTED] (to get the blog post time set to Sunday) when it's still only Saturday in the US doesn't really seem fair as it means almost a full day of work time is lost.",5
387,1367367331,Hey [REDACTED]! I am not clear as to what page you are unable to access.. The link which you have is accesible to me. It opens. I guess just try after a reboot and a break ! :)Hope all goes well soon!,1
5774,1372058715,"The problem summary:Steps to reproduce:Since week 1 im asking about this issue, I submitted my work for first week but no one evaluated it. Its not important as I have 99 of the 100 points of the course, but I would be happy to have 100 of 100 points .",5
373,1367358914,"If you're using a tablet/stylus for digital sketching, I'd still consider that sketching compared to using, say the pen tool, in Illustrator which may still be considered ""sketching"" for this course.I have a scanner, but I prefer to sketch digitally on my tablet using a stylus pen and Sketchbook Pro so that I don't waste paper and all my ideas are accessible digitally. :)",2
947,1367596933,"Oh, and by the way, your website doesnt have a blog, I dont think it is necessary, you've done everything they've asked so far, and you have the correct structure, I believe. I did add a blog to mine, but it's an extra, so I can post my personal notes and so on.[REDACTED];)",2
2426,1368029405,"Cooler necessary to refrigerate groceries on hot days while transporting from store to home (walk, bike, public transport or car trunk).",1
3372,1368664110,"Hi, yes, you only need to post your perspective drawing of a chair.",1
5314,1371243243,"Hi [REDACTED] and [REDACTED],I have no words to thank the possibility of doing this course. I always liked design, but knowing the methodology increased my admiration for the area. I am a tech person, and I intend to use the methodology of the course to create and improve services I provide.Thank you very much for the opportunity.I speak of course of you to everyone I know.I'm from [REDACTED] and Coursera is still not much known here.Congratulations for the work.hugs,",3
1088,1367662608,"You do not need to do it.It's optional and it's both a way to pay back Coursera for the great service is providing and a more reliable way to show your study accomplishments.Non ce n'ÃƒÂ© bisogno.ÃƒË† facoltativo, ed ÃƒÂ© allo stesso tempo un buon modo per ripagare Coursera per il magnifico servizio che offre e per avere un modo piÃƒÂ¹ autorevole di esibire il risultato dei propri studi.",2
2283,1367939253,"The problem summary:Unfortunately some of students posted invalid Weebly link, so their work can't be evaluated&nbsp;Check your published link (send to friend or just open it in another page or tab) and be sure it works for all.Where to find the link? See screenshot here: [REDACTED]Thank you!",1
2063,1367861849,+1 for this.,1
2256,1367929686,"I ended up nearly missing the deadline but making it in roughly 3 hours, it is bad practice but remember that even doing sloppy work is better than nothing, sometimes you come up with the most interesting ideas when you race to the deadline.I can't speak for everyone but I'm not really doing this for the points or for someone else, it is more of a personal challenge that I must meet and the points are just there to keep me in check.Do you really get anything out of the points in the end?",3
1257,1367709545,"Hello from [REDACTED].., I'm [REDACTED] and this is my site.",3
2152,1367878126,Is anyone else working on a garden project?,2
2561,1368127892,"Hey all! Great ideas all around. Any other folks living in small spaces (apartments, studios, etc) that would benefit from a room divider or better organization for books, files, knick knacks, etc? I'm working on a multifunctional and modular&nbsp;room divider storage center (most likely for books, in my case) and would welcome any user needs that people had. Have limited access to friend group, though a couple people expressed interest in a solution like this, so any additional input is welcomed!&nbsp;Thanks looking ^_^[REDACTED]",3
1007,1367617648,I also have this problem.,3
3733,1369035719,"""A 20% penalty has been applied because you did not complete the entire evaluation portion of the assessment.""I've got a penalty when&nbsp;I actually evaluated all&nbsp;5 students for each assignment. The points are important to me as I am considering paying for signature track.However, one student posted the wrong link, with weebly homepage instead of&nbsp;his/hers website adress so I gave 0 points for that particular task as I haven't been able to see the completed assignment. Is this can be the reason why I have received a 20% penalty?&nbsp;Can anyone from staff respond to this querie please?",6
2350,1367965540,Same Problem!,3
5472,1371476759,"As I had the same doubt , I downloaded the videos , subtitles and PDF. In the 'Download Lectures' section there are links for all of them. &nbsp; 1.39GB all the course. &nbsp;I dont want to share it online cause I think It would be bad for the purpouse of the course, but If authors of the course does not mid that people share the material I could share it here by Torrent for example.",4
2804,1368302274,It helps if you find a picture of a chair and sketch from it,1
2395,1367998093,"If I may be more cynical, this assumes added privileges and rights to the consumer or individual beyond the rights of the community society or environment at large. And if consumption entitles you to more rights, then the more you consume, the more rights you have.Is the user the only person we design for? ",3
4050,1369386304,"Hi [REDACTED], It looks great Clear and species, great ideas :)Personal I like your design idea: Rubber Donut best&nbsp; ",1
942,1367595809,"Well, im sending my page: [REDACTED]I will make it better, in time...",2
4376,1369775309,It's in week 5 of the syllabus https://class.coursera.org/design-002/wiki/view?page=syllabus#week5video: https://class.coursera.org/design-002/lecture/140rules: https://class.coursera.org/design-002/wiki/view?page=tshirt,1
3721,1369030127,"so do I, and I know I did all 5 and more!",3
4009,1369327287,"I think it could be something like a flowchart&nbsp;with some sketches and pics.&nbsp;You can find&nbsp;simple templates here: [REDACTED]Have to say, I feel this course doesn't provide enough info on the design process for creating non-phisycal artifacts. There is certainly room for improvement.",3
1779,1367816772,[REDACTED]HERE is mine and hope u enjoy surfing on that..I will really try my best next time since people here are really doing great job!,2
4917,1370283516,"I have friends who have successfully made some 3D prints based on what&nbsp[REDACTED]&nbsp;Maybe you want to give that one a try...regards,[REDACTED]",2
3279,1368561140,"[REDACTED], I didn't post a weebly link. Thanks [REDACTED].",1
2204,1367894815,"Here it is:[REDACTED]&nbsp;I am truly excited and&nbsp;energized&nbsp;to see so much of wonderful stuff created by my classmates.I welcome your suggestions and feedback.Thank you. You have a wonderful day ahead.Regards,[REDACTED]",2
2180,1367882941,Yes I'm doing a garden. Here is my link.&nbsp;[REDACTED],2
520,1367409441,"My inspiration comes from the fact that every time I try to eat tortilla chips with salsa/dip, the small chips at the bottom of the bag are impossible to dunk without getting your hand covered in dip, and even more difficult to scoop with. It's a fairly abstract problem but one I think could be fun to solve...anyone have any thoughts on it? Many thanks in advance.",4
650,1367456263,"The statement of accomplishment will give you a ""piece of paper"" with [REDACTED] on it and [REDACTED]'s signature. The signature track means that they verified you as a user and it's more of a branded certificate. Both require you to earn a threshold score, I would probably advise against it for now if you're not sure.",2
2589,1368139965,This is my gap:[REDACTED],1
3634,1368987255,"I love it :) Do you know the danish company RICE ? http://www.rice.dkYou can probably sell design ideas like that, to this company :)",2
4291,1369679748,"[REDACTED], I found something in my house that might help with your design, made a video to show it to you..[REDACTED] dont know if you already know the product.. anyway, hope it helps.",2
5125,1370844591,"Yup, I have the same exact thing. I hope this will be solved asap&nbsp;",3
1495,1367779931,"I thought too it could be easier considering that is only the beginning, it took me all the day to do it...but eventually I got it :-)By the way, here&nbsp;is my website:&nbsp;[REDACTED]",3
4760,1370166034,"Thank you for providing a comment box on your survey. I really like the designs and they made me think about what would work for children at table. I wanted to be able to share my thoughts, and I did!",2
5134,1370852999,Please fix..thanks!,4
1067,1367645256,"Hello Everyone,&nbsp;I am [REDACTED] from [REDACTED], U guys are really rocking, almost all the area was covered by you guys, i was in dilemma in choosing process, it was quite challenging as well, Guys here is my website its in process, give your views and&nbsp;critiques:&nbsp;[REDACTED]&nbsp; &nbsp;",3
4323,1369720488,"It doesnÃ‚Â´t have to be necessary stated as ""IWWMW"" ..So I think as long as it is a clear and defined problem statement it is ok.",2
5096,1370817070,"I jumped on the 3d printing bandwagon and had a much easier time getting a prototype out in time.
I have a printer at home (actually won it in a drawing) and just needed to brush up my Cad skills. Initial attempts at cardboard prototypes made me realized how lucky that was. Woodworking would be hard .i only hand my hand on building book shelves due to the precision limits if my table saw.
",2
2500,1368066011,"hello! i have made sketches for this weak, but the submission page is not showing any upload icon, now tell me what can i do",5
2536,1368117045,"Perhaps you might think about designing a reusable shopping bag? This could be a reusable shopping bag for more than just groceries, too.I live in [REDACTED] and the city now charges people 10Ã‚Â¢ per plastic or paper bag if they need it if they don't have their own reusable bag. I think reusable bags are great, and I have used plastic bags as garbage bags (still do if I end up getting one), but that shouldn't be an excuse to not be more sustainable.You might also think about having a gap on what ways you (or others) might use plastic bags from the groceries when they accumulate. Another gap might be not forgetting to bring your reusable shopping bag with you (I do this half the time and so I accumulate plastic bags from the times I forget to bring my reusable one).",2
1934,1367842885,Hello everybody! This is my website! Any suggestions?[REDACTED],3
5871,1372117582,"Thank you [REDACTED] and staff...it was a very interesting, concise, progressive course. [REDACTED]'s drawing videos and [REDACTED]'s to-the-point and informative approach, speckled with some fun comments. You moved me to ""make"" and make I did!! Hope this isn't our last course with you. Peers, you have been great with your comments and suggestions. Design on!THANK YOU!!",2
4129,1369525722,"I'm so jealous. That was a great image/prototype! I'm using sketchup too because I have absolutely no skills when it comes to making the beginning physical prototypes of what I have imagined (I have a plan for the alpha and beta prototypes though), and I'm currently struggling to even draw a hollowed out circle. I have no idea how to use it. I'm going to see if I can find a guide online somewhere that explains things simply.&nbsp;",3
1238,1367706266,"Hi [REDACTED],I saw your portfolio it's amazing and useful object you have processed, I will try it when having pain and may be back to you for results keep working and good luck.",2
2873,1368374709,"Hello [REDACTED],Make sure you copy the link from your website directly, not from the weebly site where you edit it.I hope that helps![REDACTED]",1
5888,1372157433,"Very very laye, bur here is my site:&nbsp;[REDACTED]/I am grateful to all the staff of course in particular to professor [REDACTED] by this excellent course (I would like to have had more time to devote to the construction of prototypes)All the best[REDACTED]",4
405,1367370275,"I think it DOES have to do with the main project, since it has an entire page on the website to itself.My project is to create a pillow set, so I'm gonna start by tacking/taping things onto an old pillow for my prototype.For physical ideas, I'd recommend just adding things onto something that already exists, very crudely.For systems, maybe a flip-book or power point explaining the structure of the system.For theoretical/mental ideas, &nbsp;you could make a chart.Overall, I'd just suggest modifying something (like my pillow thing) and using your resources.",2
4922,1370287033,"I had the same issue with peer reviews--I am confident I completed and submitted the full number of required reviews, but was assessed the penalty for week 4. &nbsp;Thanks for investigating this. &nbsp;",4
3463,1368789895,"Hi [REDACTED],You can use the three methods if you want and if your artifact can be decomposed in all three ways.&nbsp;(please note that the videos state that ""Decomposition by sequence of User Actions"" is primarily but not exclusively used for services).What the assignment asks for is for you to show only one of it on your webpage:Show one decomposition of the design problem that you used to guide your exploration. This could be a function diagram, a sequence of user actions, or a set of latent needs. You need provide only one such decomposition, even if you used several. You can express this in sketch form if you like (adhering to the sketch guidelines). You do not need to show all of the solutions to the sub-problems that you considered. Rather, you can simply show the way you decomposed the larger design problem into smaller sub-problems.Hope this helps :)&nbsp;",2
5198,1370958154,"I don't understand this either but given that all other assignments have simply required links to blog sites, and that the page in the Submit Homework and Review Peers section is the same, I am assuming that the link which is not in the Submit Homework and Review Peers section is superfluous because the&nbsp;Submit Homework and Review Peers&nbsp;is where we will go to find submissions to review.",3
3801,1369074347,"Hi Green friends! I was thinking&nbsp;open the discussion forum about this subject. I am glad to find a group that is thinking in this way.:) Thank you [REDACTED]!I am missing the discussion forum of this course, because I am keeping my time working in things that I really enjoy: painting, drawing and creating out of a computer. But I can not be out of this necessary&nbsp;approach.&nbsp;We should think green! &nbsp;My project does not show it&nbsp;yet, but&nbsp;will be a sustainable artifact with biodegradable materials.What you thinking to create a survey? How many of our classmates are developing a green artifact.How far you are engaged with your artifact? Until it arrives at a consumer's hands? or&nbsp;Further? When it is no more a desire object, and floats or sinks at somewhere?&nbsp;[REDACTED]",3
3358,1368648699,"would we need to redo all of week one and two and three if we do decide to change? &nbsp;mine emptying the AC is not the most interesting one I picked and think I would have had more fun with something I could be more creative with. I am thinking of just sticking it on a table. &nbsp;Also I do not own wood working tools, can afford to buy the wood required or if I decided on metal nor have the skill to build one. which is why I was thinking of sticking it on an existing one",5
1671,1367804291,Hello !&nbsp;Finally here is my website :&nbsp;[REDACTED]Would love to hear from you guys !,3
2415,1368018891,"This is such a powerful video. Yesterday, I feel like I had a real breakthrough with my project, and initially, I felt it was a dud. This video reinforces the idea of patience. It also underscores something I've been saying to others who often view creatives as wasting time ""dreaming."" Sometimes, what the world views as frivolous dreaming is an incubation period of the creative hunch. Thanks so much for sharing this.",2
2120,1367870845,This is awesome!Here is mine: [REDACTED]gap: Coursera Planner,2
513,1367406120,Hi everyone!Here is my site:&nbsp [REDACTED] Let me know if you have somee comments or questions to me!,4
6046,1373222690,"Hi again,Some more USER NEEDS:19-The Coursera Community helps students how to organize themselves when attending multiple courses (this is for you [REDACTED]!)20-The Coursera Community&nbsp;is fun21-The Coursera Community&nbsp;is free22-The Coursera Community&nbsp;fosters participation23-The Coursera Community&nbsp;allows photo and video integration24-The Coursera Community&nbsp;integrates polls -with stats- to ease discussions among students (note that this is not the same as &nbsp;#12, which is a staff's tool for asking students about their needs)25-The Coursera Community&nbsp;is a permanent resource -messages remains after each edition ends26-The Coursera Community&nbsp;allows students to see old messages -previous editions- once they get the statement of accomplishment or a grade that is higher than the one specified for the course27-The Coursera Community&nbsp;integrates individual learning, discussions and teamwork in the same platform28-The Coursera Community&nbsp;automatically recommends threads that may interest students depending on the courses they are attending and the optional information they provided29-The Coursera Community&nbsp;alerts students about deadlines30-The Coursera Community&nbsp;provides stats and rankings about courses -in pursuit of excellence in quality of teaching31-The Coursera Community&nbsp;allows students to decide if their grades are visible -in pursuit of excellence in learning...I'm sure you have a few more in mind. Please share them with us!",3
1468,1367776009,"Hey [REDACTED]!&nbsp; Great idea.&nbsp; I just have a couple thoughts: I have a smallish closet and this would take up quite a lot of the space, also, my husband would destroy that in days because he is brutal with hangers.&nbsp; How about just a collar support on one hanger?&nbsp; Best of luck and nice to meet you![REDACTED]",2
1013,1367619359,"As long as you somehow indicate that it's the prompt (i.e. teacher assigned and written), then I would think it'd be okay.",1
953,1367599282,Is the deadline for creating the prototype Sunday 5th may? I read in the instructions that we could complete the prototype in 8 weeks and finish it before the course ends.&nbsp;,5
4391,1369806811,"uploaded? downloadable?&nbsp;I did download them from net images there, Wheter it scales or not, hope somebody in the States buy it and tell me. Anyway imagination tells anything..[REDACTED]with a slide from my project... (""scalable ego"") :) But worth this course...&nbsp;Nice week to all",2
4854,1370216926,If you have some minutes will you please take my survey?[REDACTED]thank you[REDACTED],3
1777,1367816361,Is there a way I can complete the course requirements even though I have missed the deadline for the assignment 1..?,5
5632,1371833586,"Thank you [REDACTED],I always appreciate when people are not afraid of sharing and competition.&nbsp;I' ll try to make it.Good luck!&nbsp;",1
943,1367595814,"Hi folks, here is my site [REDACTED];Still working on content. Love the work all of you are doing.&nbsp;[REDACTED];, you are making me depressed.&nbsp;",3
5028,1370537025,"I also can't afford time and money spent on the physical alpha prototyping of my concept.The product I'm working on is a shower head holder, that everyone should intuitively know how to use and what to expect. The refinements of the product I have introdeced with my concept, and the combination of features that were not commonly found in the product class is what matters for my design. So I wouldn't need to have a working alpha product to get the user&nbsp;feedback, as ALL the parts of the artifact I designed&nbsp;are existing in a similar form and the identical function. I am talking about&nbsp;nickel plated light metal or chrome finished&nbsp;hard plastics, the construction of the holder, the slider, the winch rim, the clothes line, the hook, the locking wheel.... these are all known, already invented&nbsp;things. What is&nbsp;new about my&nbsp;design is the form, aesthetics, and the combination of features which is not very common for the artifact of its class. Lastly, the packaging&nbsp; would be new for the product of such type.",3
3464,1368791714,"hi [REDACTED], your site is nice and you are so talented.",1
591,1367441331,"Hello everyone!&nbsp;Nice websites, this is mine =)[REDACTED]",4
2105,1367867835,A further question on leniency? A number of reviews I was given were pointing to sites with blank placeholders &nbsp;or no content at all. I scored them zero. I rechecked all of the sites today and one had some content so I was able to adjust the score. .. but am I expected to keep checking back.right up to the review deadline for the others? Am I being unfair if I don't regularly check the others? Or should I stick to the submission deadline &nbsp;and be strict about it? &nbsp;But then their review success would depend on when other reviewers get around to scoring?,5
2959,1368420014,"Hi,&nbsp;I just realized I didn't attach the published web link for week 1 assignments. I noticed a lot of students encountered the same problem. Is there any possibility for us to be re-evaluated? Wouldnt want to lose those points especially when I completed the assignment before the deadline.&nbsp;Any help is greatly appreciated =D&nbsp;[REDACTED]",6
3505,1368836424,"I joined the course after week 1 was completed. Due to work commitments I was not able to view the videos or work on assignments of week 2 Despite the fact that I can not be evaluated on assignments of week 1 and week 2 , I would like to complete those assignments and submit them so that peers evaluating my future projects understand where I am coming from / starting with. I am working hard towards getting Week 3 assignments done before the deadline so that I can be caught up with my peers. &nbsp;Can someone please help me understand how to handle this situation better. ",5
2499,1368065986,"hello! i have made sketches for this weak, but the submission page is not showing any upload icon, now tell me what can i do",5
2914,1368393807,This is my website for Design of Artifacts class. [REDACTED],2
