id,post_time,post_text,Urgency_1_7
502,1367400434,"And hello from [REDACTED], everyone! Hope you' re enjoying the course so far :)",1
2052,1367859503,"Since there were four separate assignments for Week #1 (1.1, 1.2, 1.3, and 1.4), you will be evaluating 5 project websites per assignment Ã¢â‚¬â€ so, basically 20 evaluations total. The five students you evaluate will automatically come up when you're in the evaluation phase; once you evaluate the first student, you click on ""Evaluate next student"" and another homework submission from another student will appear.You'll also be able to evaluate more than 5 if you wish, which is great if you have time so you can see the work of more of your peers. :)",1
107,1367251693,I'm curious about this too since I work the same way.,2
4870,1370221908,feedbacks are welcome!,1
2979,1368426955,"Hello Everyone!Here's a platform for everyone to share their grades with&nbsp;each other&nbsp; and introspect on your work, clarify your doubts, where you went right, where you went wrong and get feed back from others!Hope this helps! :)",1
530,1367413692,"Hi there, I&#39;m going to make a bag for assignment 1.4, can I submit more than one photograph to show the internal details? Or just show it from the sketch? 
",5
2313,1367951853,"I'd give full marks and then leave my commentss in [REDACTED] (and translate, of course. But seeing the German might get the point across viscerally) Aber veilleicht is es nicht so lustig wenn man Deutscher ist. Ich bin Americaner, so bei mir Kommentare auf Deutsch wird viel spass machen.",1
2250,1367927636,"Hi [REDACTED], I agree this would be very helpful. You might also find this thread interesting, someone's gap is to design a better navigation system for the course: [REDACTED]",1
1814,1367823228,I'm having the same problem evaluating assignment 1.2.,2
4416,1369837351,Hi everybody!I've choosen improvng our course design as the gap. So I really need your help to make the choice. Please also put some comments to the post&nbsp;with your requests and&nbsp;remarks.Here is my project:[REDACTED],2
5953,1372374872,How did someone know their shirt placed 24th?&nbsp; Is there a list we can go to?&nbsp; Thanks!,4
2538,1368117644,Awesome suggestion - just added mine -&nbsp;,1
2352,1367966381,"The problem summary:The video starts, but after few seconds, sometimes a minute or few minutes, stops. The only way how can I watch lectures,&nbsp;is to download them, but then I can't answer to the questions asked in the middle of the lecture.&nbsp;I'm taking other Coursera courses and it doesn't happen with them. Does somebody know an explanation?",5
371,1367357835,"Newbie here! Biomedical Eng background, professional experience as a technology consultant (IT multinational company), currently on the last effort to finish a PhD on BioEng/Haematology/Immunology. So this course is a way to entertain my restless mind and to help me look into things with a different&nbsp;perspective!&nbsp;",1
195,1367273857,I do think that sometimes the lecture is longer than it needs to be but then the speed control option comes in handy! :D I kinda find it fun too.,3
1746,1367812362,"Hi All,I have created my website - Please have alook at it and would be glad for your valuable comments This is my website[REDACTED]",2
2279,1367938564,"Dear [REDACTED],&nbsp;This is great, well done :)I am already following you on pinterest but my work doesn't seem to be on there yet.&nbsp;Here is my page:&nbsp;[REDACTED]Cheers,[REDACTED]",1
4955,1370320722,"Thank you all for your input. Each sentence means a lot to me. I'm listening/mulling, and I hope to hear more. For
the rest of the course, I'm going to proceed as if I'm really going through
with this product (I bet my evaluators will just&nbsp; LOVE my departures
from the rubric), and we'll see where I stand in three weeks. That can
be a lot of time, sometimes.Progress report:
I just got back from a scouting run to IKEA (I'd never been) for other
base candidates.&nbsp; Having seen the scope of the place, I'm less optimistic
about getting any sort of discount on an order of 100 lamps. The night
manager said it seemed likely, but I think he was just being polite, as
IKEA staff seem to be.

I may have missed the boat on the webcam I'd hoped to use. Best Buy discontinued
it (in favor of a new 2Mpxl model that is slightly less desirable in my
mind, but is widescreen HD (1920x1080) rather than the older 4:3 format
(1600x1200), and their liquidation arm (Cowboom) which was selling them
""refurbished"" (they never admit it's unsold stock) for $8 for a few years, has
apparently sold off all their old stock.

I'm sure other suitable candidates exist (the WEB2C came out in 2008),
but if I can find 100 WEB2Cs for my first model, I'll grab them. I have
emails out to sellers who seem to have stock. 100 isn't such a big order.
It would have been easy to fill 1-2 years ago, but times move fast &amp;
warehouse space isn't free..

I've got some emails out to fabricators, and am working on designs suitable
for prototyping on Ponoko (primarily beause I know their site/materials
the best, and have long wanted to use them) If you haven't read Professor [REDACTED]'s blog, e.g  his article on using Ponoko to fabricate the media shelf or  bike seat he described in lecture,
you probably should -- every tidbit helps, right?

Sadly, I can no longer avoid learning a good 3-D design program -- without
specs, I can't get meaningful quotes. I've mastered many other technical
programs in the past, but it's always been a significant time investment.
I can only hope that having a specific project makes it easier to learn.
It usually does.

The cash investment isn't a problem for me, though I've always been frugal
by nature (indeed, that's partly why I have the cash to throw around).
A 4-credit course at any local college, even a community college, that
offers hands-on experience designing, building, managing and selling would
likely set me back at least $2000 after all the fees were included.
A production run of 100 shouldn't cost more than $4000 (less for a partial
kit) and I'll make part or all of it back, even if I don't sell out the
run. So the cost is likely to be less than a course, and the experience
will be unarguably real, not academic.

I just wish it *were* a course, so I could have you all to moan to, when
things get rough!
",2
103,1367250648,"I'm using Blogger/Blogspot&nbsp;where the content of sub-pages do not appear
in a blog format ([REDACTED]) and therefore do not have a date attached. Does this mean I'll have to use a different site?",4
3931,1369243920,&nbsp;I am dealing with the same issue.&nbsp;,2
5158,1370886545,"The web-side has not been created with the parameters required (there is no GAP, no weeks, no artifact...) so there is no way to grade it I think..",1
3565,1368930743,"Here is my approach:&nbsp; 3.1 -a list with a hierarchy of bullet pointsI am going with ""sequence of user's actions"" so I will do a series of flow charts for the 10 Concepts...Thoughts?",2
2633,1368186049,"I signed up for the class 1 week late and finished the first assignment but it was after the due date. &nbsp;Will I still be able to ""complete"" the course if I finish all the other assignments on time?",5
3002,1368430033,[REDACTED] i am working on windows only.I had same problem during week1 also but some how managed by making other website but this time its troubling a lot please help.,4
1667,1367804173,http://[REDACTED],1
1942,1367844632,"Hi [REDACTED]!Nice to see you here :)&nbsp;Good luck with this Gap, sounds interesting and helpful.&nbsp;I'm&nbsp;only too happy to complete the 3 courses I was doing, and now I am only doing this one...unlikely to repeat doing more than two course&nbsp;simultaneously&nbsp;in the future - it is too demanding, and I land up having less fun with the course itself.Take careCheers[REDACTED]",1
3920,1369227891,"I came across this site months ago...For the ones who really could be interested in ""bringing to life"" their own artifact:http://www.quirky.com/ ",1
6006,1372698897,Me too!,1
281,1367321032,"Hello,i ask for definitive answer about how to submit our homeworks. I understand that part about posting hw to our websites, but &nbsp;there is lots of disscusions about how to submit them to coursera. In coursera there are boxes for text and box for uploading photos, should we use it and write and upload to these boxes or you just want us to submit the links to our individual website posts?Thank you in advance for making this matter clear!&nbsp;",5
4030,1369341891,"hi [REDACTED], i have the same concern. but in the homework instruction i&#39;ve read: &quot;your goal is to identify the few concepts (2-4) you will explore using prototypes. maybe the staff can answer...
",3
