id,post_time,post_text,Urgency_1_7
343,1415516667,"I think technology has still room for improvement, look at the recent failure of NASA space launch and the Virgin Galactic test. However it is now an inevitable part of our daily life (ie: smartphones). TV are now connected to Wi-Fi! however technology still needs 10-15 years to reach its climax??",2
1213,1418626659,"Problem: There is a typo or other mistake on the page (e.g., factual error, information omitted)Problem ID: pages-mistakeURL: https://class.coursera.org/globaltrends-002/help/report/pages-mistakeBrowser: Chrome 39OS: Windows 7Additional details: Kindly refer to slide 35 in the lecture notes for week 7 . In the map , Kashmir is shown as a part of Pakistan. Globally , Kashmir is considered as a disputed territory. But The organizers of this course have gone one step ahead and granted this territory to Pakistan.??Screenshot:",5
1347,1419335332,hey therethe new link provided is working finethanx alot,1
643,1416116339,"As of the moment we have organizations targeting fast food chains thus forcing them to provide us with healthier options. The FDA and other federal food research/inspection organizations have to ensure ingredients are safe to consume i.e BHTs in cereals, etc. I think they should also let us know if these ingredients have addictive qualities. We need to manage our diet to prevent further harm. It may require accommodating it to some extent in the beginning in order to manage it. The goal should be health eating, healthy calorie intake, healthy life style choices. Some individuals who may appear overweight are healthy and others who are underweight are unhealthy i.e. have high blood pressure, high cholesterol, etc... We need to link excessive eating to obesity to remove stereotype from other who eat healthy but are large structured by genetics.",2
580,1415978712,"Prof [REDACTED], I'm requesting for reading materials on latest statistics on clothing industry &amp; contribution of obese people to total purchase in US.",4
710,1416259896,"Dear Professor, interesting proposition. I do believe Education is the solution for the majority of the problems in developing countries; the challenge is, what kind of education is the right one for those countries, right? How many Countries these days produce the professionals they really need? Even developed countries are struggling to produce more scientists, engineers, mathematicians to keep innovating ... etc. In other words and answering your question, I believe a degree from the US could be a pathway to individual success, but it doesn't address the need of a particular Country/Economy/Society and it is not culturally compelling to many of those countries. Those countries need an education system aligned to their needs and realities to really move the needle. Exposure to western political system will certainly help, but again, those countries have their own realities and ways to do business, which not necessarily are perceived locally as negative business practices. Showing them that there is a different way of doing things is very helpful, but ultimately they will have to pick and choose what they believe are the best accepted business practices in their countries to be successful and make a positive impact in their societies.",2
280,1415386174,"Well, I suppose it will be the countries' choice wether or not to let them starve and be isolated forever. I can't imagine a scenario in which the country (be it Cuba or any other for that matter) will be totally isolated from world economy - it is not possible anymore. Another thing we need to think about is that embargoes are a way for each country to protect itself in the international context, so it is very important to the functioning of the global relations.??It is also important to point out that as globalization progresses, international morals are more and more concerned about the state of poor countries and how we can help them - even if right now we are not able to do so, or can't concentrate our efforts to accomplish something in a global level.My fear wouldn't be so much of the developing countries once they hold the economic power, but on humanity as a whole letting this sort of thing happen (something which I believe is highly improbable) - we should strive to develop social and moral??aspects??according to our development in economic aspects.",2
810,1416579903,"Hi [REDACTED],Thank you for letting us know about this issue!I've asked a member of our team who will be better able to help with your particular issue. You can expect a more detailed reply within one business day. Thank you for your patience!",1
665,1416159702,There is a new theory out on why it is so hard to eat healthy.?? It is in are genes from the hunter gather stage of human development. It makes sense if you think about it.?? In the early days hunter gathers did not know when or what they would eat next.?? So they gorged when they could and fatty meat stores more calories.??Add that to they did not know how much energy they would expend getting their next meal.?? These traits could be the cause of??are inability to stop eating.??,2
382,1415597090,Hello everyone! I'm from [REDACTED] but currently living in [REDACTED]. I recently graduated with my master's degree in August but have missed school so I decided to sign up for this class! I am currently not using any of my degrees and am just trying to figure out what I'm going to do next.??I look forward to learning from you all!??[REDACTED]??,1
273,1415373757,"Hardly!?? While the world bank issues its own currency, that asian continental bank is not......The world bank serves as banker of central banks ....Not the case of the aforementioned asian continental bank",1
454,1415747880,"I'm concerned that this model is too heavily skewed toward only one country -- the United States.How does this model hold up when you compare countries like Japan, where savings rates are among the world's highest?... or emerging countries where stock markets tend to be less evolved and unemployment among those 20-30 years old tends to be much higher and thus they consume less and rely more on their parents and grandparents?.. ..Also, stock markets in the U.S. have broadly doubled in the past 5 years, even while more people than ever are entering retirement age.?? Shouldn't we see the opposite trend if this model holds true?I suspect this model doesn't really follow the same pattern in the U.S. as it might in other countries... but perhaps I'm wrong ;-)",3
1173,1418316685,"Well put [REDACTED]! But just as you mentioned ""......Returning to a classical capitalist economic system rather than the current neo-classical predatory capitalist model coupled with a change in consumer habits"" is what might bring us the perceived balance we care for. I think that might be really hard to attain because of the many human nature such as greed,??insatiable??wants, and habits which are very hard to predict. All forms of developments has brought both positives and negatives effects on earth on the global scale though debatable. Is like if we compare amongst all creatures on earth humans seem to be the one changing or kinda reordering things....my thoughts!",2
277,1415384453,"In my opinion, this is the 6th wave of global/internationalization over human history. ??What is unique seems to be the emerging power of global commerce powers and non-state actors. ??Whether or not the philosophical Heglian state can be maintained is the big question. ??Is it philosophically correct to restrict humanity in its choice of where it consumes, where it chooses to reside for political choice, where it practices free thought and where it ultimately wants to be at any given time. ??The ultimate democracy would remove these artificial boundaries leading to unlimited restrictions on human decision making. ??",2
347,1415525810,"As I've undestood no deadlines this week, quizzes are starting from the second one.https://class.coursera.org/globaltrends-002/wiki/syllabus",2
486,1415794542,"Problem: Explanation - not availableURL: https://class.coursera.org/globaltrends-002/forum/list?forum_id=10006Browser: Firefox 33OS: Windows 7Additional details: I tried to attempt quiz 2 and answered 8 questions. 6 of 8 are correct, next 2 questions were shown as incorrect, but I couldn't find the correct answer and explanation for them. Quiz on demographic trends. 6. Obesity is highly correlated with: my answer was height7. Obesity has a large impact on the following industries:

my answer was clothing.why these answers are not correct?Thanks in advance,[REDACTED]",5
735,1416331604,"Obesity is a syndrome that is a risk factor for many diseases; however, what is it cause? Life style, food choices, environment,and depression are some of the reasons. The implications of obesity it is studied more and more. We could accommodate and make larger seats in the airplane, larger clothes; or we could at least try to stop the tendency to the new ""normal"". As a doctor, I really believe people should mitigate to be obese. It is not an easy task, but things start in the childhood, and parents should walk more with their kids. The family should adopt a better lifestyle to nurture a healthier ""future generation"".",2
1103,1417837360,The top 10% of the??US population owns almost 85% of the assets in the USA. The bottom 50% has almost nothing!!??,2
779,1416486385,"Thanks [REDACTED]. So, darlings, do be careful, and be well warned by me:Never trust a cricketer, whoever he may be.And watch the wicketkeeper, girls, he?â‚¬?s full of flair and dash;And if you raise your heel, he?â‚¬?ll whip them off in a flash.If you take the field with the captain, you had better know the score;Or he?â‚¬?ll have you in positions that you never knew before!The cricket commentator is a nasty sort of bloke,He watches all the action and describes it stroke by stroke.Even the kindly umpire, who looks friendly as a pup;You?â‚¬?ll quickly find you?â‚¬?ve had it, when he puts his finger up!",1
85,1415076931,"[REDACTED] I had pretty much the same reaction to contrasting hunger with obesity as you.?? Hunger is an issue of survival and human suffering.?? An existential issue.?? Obesity is, for lack of a better term, a high-grade problem, a quality of life or medical issue.?? For me, obesity doesn't even rank as high as things such as infectious, chronic??or prevalent diseases on the hierarchy of global issues.?? The contrast made little sense other than to perhaps highlight the winners and losers in the globalization sweepstakes.?? United States, highest obesity rates in the world - winner.?? Sub-Saharan Africa, widespread deprivation - loser.?? Or maybe its a criticism of developed nations for not sharing our wealth.However, what I took away from the material is that the globalization of effective farming practices, farming technology, crop nutrients and land management have served to reduce global hunger.?? That seems to me to be a huge win from globalization of technology and knowledge.?? Obviously, it needs to extend to those areas where suffering from hunger still exists.?? Or, if such areas are simply unfit for agriculture, migration to more productive regions should be facilitated.?? However, we know that migration is one area where globalization, bringing people closer together, conflicts with the desires and prerogatives of individual nations.",2
635,1416081596,"The professor brought up an interesting comparison that in the 1980s and 1990s the collective society rose up against smoking through many bans, education programs, and laws which dramatically reduced smoking worldwide.
Yet when it comes to fat and sugar in our food, and an obesity epidemic with far worse health effects, we lack the will to make change. School lunch program changes have been rallied against, and pizza continues to be classified as a vegetable since it contains a few grams of tomato sauce. There is no ""recommended daily value"" for sugar printed on nutrition labels. Is this really the result of the food industry politically blocking change, or a lack of collective will to do so?
",3
1062,1417623989,"Major game changer, the implications are evident, and this is the beginning......http://youtu.be/9x8OgUcNyJUhttp://youtu.be/G2gshu8nnco ""We the people"" don't rule anymore.Under the misnomer ""people united"" or more likely (Corporations United,)The world economics will be reshaped and??governed by multinational corporations.We all know that corporations only care about profits, not peopleIf this does not change soon, the whole world will feel the impact.",2
509,1415843549,"I believe in an effort to accommodate the large aging population, the government is encouraging members in the aged population to work longer. There may be strain on the health care system due to limited capacity and resources. ",2
67,1415057586,"Is it just me or do the ""paradoxes of globalization"", thankfully only one slide in the materials, just seem like so much academic jargon.?? The three so-called paradoxes, in my opinion, can be equally applied in both national economies and the global economy.?? I don't think they are in any way unique to globalization.?? Frankly, I'm not sure I understand the paradoxes at all.?? What does ""there is increasing institutional decoupling between adoption dynamics and outcomes"" mean??? Plain English please, with examples.",4
506,1415841573,I believe providing additional conveniences to the obese is just treating a symptom to a much larger problem. The focus should be on providing services such as exercise and nutritional education. You absolutely can change your lifestyle with the proper steps and fall back into a healthy body mass index number. I personally got into nutrition and exercising within the past few years and have seen so many transformations take place due to people having the proper knowledge at hand.,2
1268,1418891166,will fall apart,1
168,1415212079,Bilateral trade can hinder the process of Free Multilateral Trade which helps develop specialisation and has been a critical component of improvement in GDPs of most of the countries. Its the Government role of regulating markets that is lacking the checks &amp; control mechanism which has lead to recent financial crisis.How do we trust the people in government to hold the law and regulations above dirty politics ? Main issue to address worldwide.,2
904,1416863890,"I have a few questions about this lecture. This is a topic I have heard brought up many times in various places, and after a bit of searching I still haven't found some answers to some basic questions.In the past, has there been situations where countries borrow money to have a deficit, or is this a recent phenemonon???What are the consequences of a trade deficit? Is it bad that a country carries a deficit? What are the effects, positie and negative, for the lives of average people in coutries that carry debt? More cheap crap to buy? Less jobs? Whatever. Who is the loser, the country with the deficit, or the country with the surplus? Is there interest paid on these defecits? If not, it looks like a bit of defecit could act like a free loan. Or am I thinking about this the wrong way?What do we mean when we say the US owes money to China? Who exactally? The federal reserve? The US congress? Taxpayers? What part of the government in China (and elsewhere) do they owe the money to???What about Canada? Who in Canada owes money? The taxpayers?A thought experiment, because surely this would never happen, but what would happen in the future if the US pulled an ass move and just says to China, ""nah, we don't want to give you these trillions of dollars, because, say, you stole some intellecutal property form us"", or whatever. Sure, China would be pissed. But who would suffer? Is there an international body that oversees these debts? The world bank???Any reply or links to related resources would be greatly appreciated. I would also like to know if anyone has similar questions in mind.",4
860,1416757066,"Problem: Quiz 1 repeat after hard deadlineURL: https://class.coursera.org/globaltrends-002/wiki/syllabusBrowser: Chrome 39OS: Windows 7Additional details: Dear all,I had missed the first quiz (2.A Quiz on Demographic Trends). Two weeks from now I had an accident which made it so hard to follow up my courses. I would like to apologize but this wasn't on my purpose. I'm a displaced [REDACTED] live in [REDACTED] and I wish this course will help me in future.I do apologize and I will accept any responses from your side to my problem.Yours Sincerely,",4
572,1415971361,"?â‚¬?Free to Choose:A Personal Statement "" written by Milton Friedman and his wife Rose D.Friedman and "" The Price of Inequality ?â‚¬? ??written by ??Joseph E. Stiglitz . They ??are all about free ??market economy .And the????authors strongly opposed to??Keynesianism ???I ??recommend??to you .",2
726,1416316462,"Hello Everyone,I am [REDACTED] from [REDACTED]. I have completed 14 courses from coursera and more than 20 courses from other MOOC platforms and at present doing my specialization in Entrepreneurship - Launching an Innovative Business from [REDACTED] and several other courses including this. I am also serving as a CTA for a course on 'Total Leadership' - Better Leader, Richer Life course by [REDACTED] offered from [REDACTED]. You all are invited to that course as well.??To connect with me follow this link [REDACTED]",1
411,1415686110,"I am really enjoying the video clips from around the world, particularly from Havana. ??A great way to visualize the effect of long-term sanctions.",1
523,1415849800,"the real challenge here is and as asked by Bilderberg group: Who is gonna afford the current demographics???  We have got a thrashed, polluted and overpopulated planet, right now",2
499,1415825440,"""we the people are losing our voice"" ....... yeah, sorry ...??not holding my breath .... mouth full ... chewing on my burger.Sorry, interesting post.",1
1297,1419034562,Opinions of??vitalij dubenskyj and??Artem Shcherbyna have no value since they live on Ukraine and are very biased.,1
828,1416622985,"We are so right to be concerned, [REDACTED]... Sovereign Debt is rising today at the exact same time that economic growth appears to be on the decline globally.Indeed, the economies of China, India, and many emerging economies are slowing as we speak.Japan is now in recession.For details: http://www.ft.com/intl/cms/s/0/4df99d28-4590-11e4-ab10-00144feabdc0.html#axzz3JlBHCQsk",2
109,1415116823,"I see structure and predictability as the processes that maintain the global system. ??Your example, of quantitative easing is an example of a process that is predictable in that a certain goal will be achieved by utilizing the process. ??It is as if a structure (like a building) has been developed, but that it also has stress points. ??That is, each individual country may utilize different processes that create stress or friction between other structures, but they act in a way that maintains the overall structure of the system. ??The problem with structures, though, especially when they are maintained by friction, is that they are somewhat rigid in their reaction to the unpredictable and unforseen. ??So, the paradox is that the systems, while predictable, are only responsive to ""known"" tensions and threats and not to unforseen circumstances which act as ""tornadoes"" that destroy some underlying support for the system as a whole. ??Once a ""leg"" or support has been destabillized, new support systems have to be developed to take their place. ??It seems to me since we are entering a new phase of economic realities (without borders or boundaries) they may affect boundary systems such as political systems in destabilizing ways, hence the proliferation of failed states.But, I am thinking out loud and have to finish the rest of the videos for the week. ??",2
1237,1418739353,"Hello, I took the quiz 6.A twice today. 1 day late. first score was 6 point. 2nd score was 8 points. I then applied the 1 late day. I believe I should have applied the late day after each test. can this be corrected... A little confusing.. ??Thank you! ??[REDACTED]",5
284,1415388049,"Hi All , Please take a minute to also post your introductions on the Course LinkedIn Group at [REDACTED]With over 360 members on the LinkedIn Group, we have some great discussions going. The Introductions page is at : [REDACTED]…Look forward to see you on board.Regards[REDACTED]",1
134,1415144661,"Hello Everyone! I'm [REDACTED], an [REDACTED] in [REDACTED]. I work in online marketing (for mobile apps and games). This is my first course on coursera and I'm excited to be learning with all of you.Feel free to add me on linkedin: [REDACTED]",1
487,1415803710,"Hi everyone, I am [REDACTED] from [REDACTED] and I am very glad to meet you guys up??here! Thanks to Coursera.Also, I would like to disscuss with you about the double 11 (11.11) phenomenon in China...(as professor [REDACTED] talked about in lesson 2-8 in terms of TAOBAO)here is my linkedin link: [REDACTED]",1
761,1416414309,I enjoyed the discussion on the topic of the middle class this week. This is specially important to companies seeking to export to developing countries. It reminded me the article included below about about the middle class in China. I had just read it a coupe of weeks ago. Enjoy!https://globalconnections.hsbc.com/us/en/articles/top-10-things-american-businesses-need-know-about-...,2
1375,1420462985,Could somebody tell me where I can find my certificate since I have verified and paid for it.??Currently I only got the statement of accomplishment.Thanks.,5
1292,1419007197,"By ""bonded"" are you asking about the hyphenated connection at the end of the phrase ""- at least for now"", or the part that you have put in bold case?",1
366,1415564095,"Globalisation has it's pros and cons, but we should strive to increase the pros and cut the cons.",1
1071,1417642820,"If you submit after the due date (but before the hard deadline), your submission score will be penalized by 20% for each day after the due date. So by using late days, you shift the ""due date"" for the quiz by that amount, so that you can submit without any penalty. Note that the you can't shift it past the ""hard deadline"", even if you have enough late days to do that. ",1
947,1416991960,"According to a James F.Eder book titled?? ''A generation later"" the definition is as follows:''But the crucial constraint is the relatively unfeterred ability of the wealthy and politically powerful to get their way, including their way with the exploitation of natural resources, an ability captured by such terms as ''predatory elite'' and ''plunder economy''.http://books.google.pl/books?id=zxDOgXqobIQC&amp;pg=PA19&amp;lpg=PA19&amp;dq=%22predatory+elite%22+economy&amp;sourc...",2
758,1416411095,"Women certainly hold the key to poverty alleviation.?? As famously discussed in the book ""Half The Sky"" authored by the New York Times writer Nicholas Kristof -- and supported by UN studies -- when women control assets or earn income, they support their families far more than men.?? For every dollar a woman earns in developing countries, she invests 80 percent of it into her family (and extended family), whereas men invest only 30 percent of each dollar they earn.And the investment from women is more often in family nutrition, education, and health care.?? Sadly, too many men invest in gambling and alcohol.When you empower a woman, you empower upwards of 7 others within her extended family.?? This creates a multiplier effect against poverty:?? wealth earned and created by women flows to more people, and helps slow population growth.It is clear to me (a man) that comprehending this relationship between women/s empowerment and poverty alleviation, including connection to improvements in literacy, health education, and overall prosperity, has been a huge factor in achieving many of the Millennium Development Goals of recent years.",2
1021,1417402871,There seems to be a larger middle class. Perhaps this is happening during an economical situation that requires improving consumer confidence. Or perhaps it is closely around election of new government time.,2
432,1415713612,"I would think that the replacement of retired workers with young ones is more complicated than I proposed. You're so right about the technology factor, Craig. That is a major point. Technology is affected the work force in alarming ways. There are so many factors affecting both workers and the stock market... The market has been so fickle since the even before the sub-prime.??",1
576,1415977091,"As far as I know, joining Signature Track is indeed only a proof of your identity that give more weight to your success on the course. Requirements to validate the course (with or without a distinction) remain unchanged. I guess only signature track gets you a signed a printed certificate, but this you will have to check by yourself, sorry.",2
