id,post_time,post_text,Urgency_1_7
668,1416178167,"Here I attach you some defenitions os defined benefit and defined contribution. Is?? a copy of American Institute of CPAS.Health and welfare benefit plans??include plans that provide (a) medical, dental, visual, psychiatric, or long-term health care; severance benefits; life insurance; accidental death or dismemberment benefits; (b) unemployment, disability, vacations or holiday benefits; (c) apprenticeships, tuition assistance, day-care, housing subsidies, or legal services benefits; and (d) postemployement benefits such as salary continuation, supplemental unemployment benefits, disability-related job training and counseling. Health and welfare benefit plans may be either defined-benefit or defined-contribution plans as explained in the following:Defined-benefit health and welfare plans??specify a determinable benefit, which may be in the form of reimbursement to the covered plan participant or a direct payment to providers or third party insurers for the cost of specified services. Such plans may also include benefits that are payable as a lump sum, such as death benefits. The level of benefits may be defined or limited based on factors such as age, years of service, and salary. Contributions may be determined by the plan's actuary or be based on actual claims paid, hours worked or other factors determined by the plan sponsor. Even when a plan is funded pursuant to agreements that specify a fixed rate of employer contributions (for example, a collectively bargained multiemployer plan), such a plan may nevertheless be a defined-benefit health and welfare plan if its substance is to provide a defined benefit.Defined-contribution health and welfare plans??maintain an individual account for each plan participant. Such plans have provisions that specify the means of determining the contributions to participants' accounts, rather than the amount of benefits the participants are to receive. The benefits a plan participant will receive are limited to the amount contributed to the participant's account, investment experience, expenses, and any forfeitures allocated to the participant's account. These plans also include flexible spending arrangements.As i understan ""pay as you-go"" is very similar than defined benefit. In some countries of Europe Welfare state covers defined benefit programs with taxes (normally income taxes, you must pay to the govermenet part of your salary).Them all the expenses of the system are covered by taxes as whole. Each individual do not have an individual account with contributions and expenses, but the system works as a big bag ...... With changes in demography what is going to happen in some countries is that with the contributions (taxes payed by people working) state will nnot cover the expenses generated by the system ( aging and obesity are increasing expenses really fast). Less?? people (workwers in inverse or flat age pyramids) are paying more expenses (retire and old people, who do not pay income taxes)... This is why system would be in?? bunkruptcy in some years if changes are not applied and is a big debate btwe. defined-enefit and defined contribution (where you received what you have paid in the past...).Another question would what happens with poor people in defined contribution plans .... But this is another historyBest regards[REDACTED]",2
2,1414986522,"Hi y'all,
[REDACTED] here. I suppose I'll share my Twitter. Excited to hear everyone's thoughts! 
",1
817,1416602305,"Hi, I just found out about this course today and just finished the first quiz with 8 out of 8. There is no rational??reason why a penalty should be applied. ??I think the deadlines should be more flexible as this is a MOOC and not an in class assignment at a physical school. Just my opinion...",6
778,1416486243,"I think the definition of Poverty line itself is an ambiguous??term. $1.5 per day can offer??less good in a basket of goods in USA, compared to countries like India, China or other developing nations. The happiness index is not at all related with the poverty line because it does not affect the income of the people. It is independent of whether the person is under poverty line or not. So, my view is that instead of making a universal one, it will be better to fix the income subjected to the cost of living of a partucular country.",2
672,1416196401,"In Japan, although obesity rate is less than 3%, some designers are trying to supply XX clothes to obese people, especially to young girls. A lot of ""fat girls"" appears in fashion magazines.(Some people may complain these girls are not fat at all, but in Japan they are categorized as obese.)??",2
457,1415751194,"The question is far too general and unclear to be given a really adequate answer. Globalization can present both positive and negative outcomes for educated and uneducated workers relative to the context in which we view it. For instance globalization can increase the availability of information and capital that allows an educated/skilled worker to be more productive and can also increase the availability&amp; variety of jobs (albeit menial ones) for low skilled workers. On the flip-side, higher aggregate productivity among high skilled workers could drive down the aggregate price of their labor, given that demand stays the same; and greater availability of jobs does not necessarily guarantee low speed workers better wages or standards of living. Then you have oddballs like NAFTA which greatly hurt low-skilled workers in both USA and Mexico, forcing many low skilled workers in manufacturing and industrial sectors in the US into unemployment and agrarian workers in Mexico to abandon their farms due to cheaper US imports and emigrate to the US to seek menial lie skilled jobs.??Overall, globalization has positive effects for the global economy, but how it affects certain industries and different skilled workers varies on a case by case basis...",2
709,1416259697,"Hi guysDoes anyone have the archives to a recent course ""Corporate Finance Essentials""? If so, could you please message, so you could share them with me. Its a little urgent!Thanks a lot!",1
1356,1419444962,is there anything left for us to do before the certificate is issued ?,4
292,1415395819,"Actually, if their investment spans through the Euro Zone and America, they do compete at some level with the World bank. Also understand that they will be , at first place, a second alternative, to WB for Asian countries. ??As long as they prioritize the Asian countries more the WB does, Asian countries will consider investing more funds in AIIB than the world bank also. ??At the end of the day, they will end up competing. ??I foresee the formation of an Asian block with a strong currency same as the Euro now competing with the US $, at another scale.??",2
631,1416077705,"The obesity problem in the world needs to be erased!?? How this can be accomplished has yet to be
found.?? As a master fitness trainer in
the military one of my duties was to monitor and motivate overweight soldiers
to lose weight. This had little success unless the soldier wanted it to.?? Financial losses even to the point of being
unable to stay in the military had no success in making the soldier lose
weight.?? That is the problem in the world
today lack of will power.

?????????????????????? There are
company?â‚¬?s making money with sales of instant weight loss pills, because people
want to lose weight, but with no commitment.??


?????????????????????? The United
States need to start by funding cities to put in more bike paths or hiking
trails. They need to encourage exercise programs in school as much as they do
for education subjects

?????????????????????? Even this
will have little improvement unless people want to lose weight. ",2
732,1416325385,"I think that college education is a bit of both -- an aspiration, since one's status is definitely marked by attending a University, and hopefully, college education will lead to increased economic power. The problem is the student debt. College tuition is extremely costly and it rises each year at least by 2%. There are a few ways around this -- for example, by attending community college and then attending a more prestigious university. However, student debt will still exist, so if a college graduate cannot afford to buy a house and remains in debt for several years, that will pose a problem regarding increased economic power. As long as jobs are available after graduating from a university, there is optimism. However, with the economy remaining flat, jobs are difficult to come by for graduates.??Regarding your other point, I definitely believe that western political culture affects the middle class in developing countries especially because of Isomorphism.??",2
751,1416355070,"Related to last week's lecture. Short succinct message. 
http://www.economist.com/blogs/graphicdetail/2014/11/daily-chart-10?fsrc=scn/fb/wl/dc/vi/endofpopulationpyramid
",1
884,1416836445,"Dear Course TA's,In my opinion the possible reply to Question 4 in Quiz 4, according to the lecture videos, includes two correct answers. I marked one of them to see that it was marked incorrect!Could you please check the Question again.Thanks,[REDACTED]",5
1293,1419009297,"Also thanks from my side to Prof [REDACTED]. The world is a complex place and any tool that can help make sense of it is great. Prof [REDACTED] definitely achieved that. At the same time, the difficulty with any model is that it is a simplification of reality. I would love to learn which other models are being used to make sense of worldwide trends. I wonder whether the seemingly comprehensive model introduced this last week, ""the four institutional gearboxes shaping global dynamics in the 21st century"" could be further improves upon, taking into account some of the latest trend(s). For instance shouldn't the exponentially increasing digitalisation of the world (think Internet of Things, Big Data, additive manufacturing) and the impact that new business models have, become a bigger part of the analysis of global trends? Just think of how entire sectors have been changed ""overnight"" such as the travel industry (e.g. Expedia, but also AirBnB), the book and printing industry (e.g. Amazon and Adobe pdf). Now, new developments are rapidly approaching of which the first signals are already there, such as industrial internet by General Electric, where through sensors and big data they get a better grip on the use by their customers and therefore build bigger barriers to entry. The financial sector that is confronted with peer-2-peer lending and crowdsourcing. The educational markets that are confronted by MOOCs and services as Khan Academy.The last years, mass production has been taking place more and more in Asia. This model was mostly based on lower labor costs. Labor costs are increasing in countries as China, while customer demands are more focussed on Just-in-Time delivery, and products need to become more customized. Lead times of months are less-and-less feasible. 3D printing/additive manufacturing will become the way to solve the issue; it will make lead times tremendously short, and may also move manufacturing to where the consumption takes place. As Marc Andreesen has said, any sector is becoming a software sector.These are just some of the trends taking place. It would be nice to see how these factors would still further change wordwide positions, maybe not tomorrow, but maybe already next week, or otherwise certainly in the near years to come.Once again, thank you Prof. [REDACTED]. You did a great job of giving some guidance of making sense of the global trends to come. Let's all contribute to further improve on the model.[REDACTED]??",2
427,1415711071,What does failed states mean and what the major/common signs happening on a failed state ?,4
446,1415741511,"Who knows what the source is of slide 37, 'how important are MNEs':?â‚¬?There are 104,000 MNEs in the world.?â‚¬?They control about 790K subsidiaries.?â‚¬?71% of all MNEs are based in rich countries.?â‚¬?The 500 largest MNEs account for 25% of world product, and 50% of world trade.?â‚¬?MNEs receive 80% of all payments for technology royalties and fees'Thanks in advance!",4
1206,1418601597,"Interesting piece, very infomative truly enjoyed it.",1
47,1415038368,"This trend of the emancipation of women -- and especially education of girls and young women -- seems particularly evident in India, where I recently spent some months teaching English at a women's empowerment center in [REDACTED] state.?? At the beginning of class, I asked all my students why they want to learn English.?? Many of the girls and young women shared that it was their families who encouraged them to study English, that indeed they were there ""for my family.""?? I think this shows how the women especially are seen by the family as the leading option to better education, and thus better income and financial options for the overall family.?? Whereas the boys and young men seem more encouraged to go out to do more manual labor, to drive cabs and trucks, to work in agribusiness, for example....?? The girls, on the other hand, seem to have aspirations to work in law, education, health care, etc. This is NOT to suggest that boys and young men don't have higher aspirations for themselves.?? It's just interesting to see how families and family decision making play a huge role, particularly in developing countries, around who goes to school and who gets educated.There is no doubt in my mind, based on my experience in India (however limited), that this trend of emancipation of women and greater education options for women is going to have major implications on population growth, as women who gain education tend to delay bearing children, and that family size is directly impacted by the level of education of the woman -- you could say, the true head of household the world over is the woman!Further evidence can be found in places like Iran where women outnumber men on college campuses.This trend seems to be just beginning in many parts of the developing world, so we can reasonably expect that population growth and family size will continue along the ""low"" to moderately low projection, as discussed in class.-- [REDACTED]?????? [REDACTED]",2
740,1416336615,"Wealth distribution programs are badly deployed....Rather than Welfare, we need a government to turn slackers into wealthy people ...you can not tax poor people and if so, how are they going to pay??",2
911,1416880865,"I think a change in people behavior habits, like eat to fight stress, or lack of do exercise, and more time dedicated to play videogames, is bad and propers these obesity high levels in countries like USA and Mexico.",1
1223,1418668088,"Great class! I learnt a lot , more aware of what's going on in the world today. I am certainly looking forward to advance level course in similar area.??",1
162,1415204397,"Hi, my name is [REDACTED], from the [REDACTED] area ... looking forward discussing relevant globalization topics with you all ;-) [REDACTED]",1
1108,1417892376,"It was Ronald Reagan that started the trend of income inequality since his main support was for the wealthy and the American corporate structure. This why corporate CEO's now make a?? 380 to 1?? compensation ration to the lowest workers, the highest in the world!",2
1183,1418393355,We have not completed the course. We passed exams but we still need to watch/read  Week 7 material: Global Power of the 21st Century. After that I am sure that we will receive a certificate :),2
934,1416949218,"Why no mention of the growing importance of innovation as a key driver of growth in a country's economy today?...?? Innovation strikes me as the most important driver of economic growth in the late 20th and early 21st centuries.... more than manufacturing or even trade.Could it be said -- as discussed in class -- that in spite of running these enormous deficits in terms of trade and sovereign debt for the last few decades, which ordinarily would have killed any other economy years ago, that the U.S. economy has NOT in fact fallen off the mantle of preeminence in the global economy largely due to its ability to innovate -- i.e. to produce new ideas that result in new products and services and new economic exchange well before there is any market for those new products or services. One paradox that strikes me is how the manufacturing sector has eroded so significantly in the United States in recent decades; and yet, this has not brought down the U.S. economy, not by a long shot....Indeed, one reason why the U.S. runs such high trade deficits is because the manufacturing sector has eroded to such a degree...?? you could say, the U.S. no longer really ""makes"" anything!?? Instead it purchases low costs goods from others.Yet, how can the U.S. economy function so well with such high deficits in trade, etc.??? The answer seems to be innovation, no?Which leads me to wonder: has innovation surpassed manufacturing in terms of its importance for creating value in an economy?...?? ",3
1074,1417654565,"India is a special case for its large territorial size and high population; however, I`m think it is not a failure state.The lack of public services and infrastructure have direct relation with the education of its people and their spiritual point of view. For?? Indian citizens, money not represents the same as occidental citizens, and they not pretend to have the same things like in the advanced countries. Therefore, Indians are not producing enough to export and increase their GDP.On the other hand, we can not put all the nations in the same ""kind of life"". Are the US citizens live better than Indian citizens?? Too much people in US lives stressed and debts money to the bank; Indian people don`t debt money to the bank, they don??t have sufficient public infrastructure but they are happy and friendly!!!.Are the economical model in capitalist countries best than other models?.?? Do we must to think that private investment is the salvation for the national economy? or maybe, we can think and build another type of principles and policies to govern our countries.",2
226,1415292152,"[REDACTED], yes, it can be measured in so many ways. % international trade can potentially still increase in a lot of countries, but in other ways, can we be even more global today in terms of knowing immediately what is happening around the world? In some ways, we might have already achieved the pinnacle in globalisation. News travels within minutes, or even seconds, so what is the scope to increase that? On other levels, globalisation certainly hasn't reached it's top. Agree with you analysis that there will be regional differences and that some countries will only embrace globalisation if it benefits them.",2
248,1415325726,"In the chart of data concerning 'Measuring Globalization' in the first lecture and 'International Trade' in the third lecture, I noticed that, contrary to the general trend, the percentage of emerging economies' imports/exports to their GDP actually decreased from 62.0% to 56.7% from 2005 - 2010. Does anyone have any insights as to why trade decreased during this time?",4
208,1415279475,Hey all!Great discussion!We all can see the effects of Globalization (or what might be put to as few top groups or organizations or countries holding on to power and used to influence many others)But also believe that if Cuba can imitate what China has done by empowering itself and let the rest of the world want to associate with it!My opinion!,2
1216,1418643643,Are the surveys and forums mandatory for soa? Could you please clarify the grading policy so we don't miss anything important?,5
597,1415999765,"I am [REDACTED] from [REDACTED]. Originally from [REDACTED], I am a Computer Science Engineer and worked at [REDACTED] for about 2 years before moving in to [REDACTED] for my Masters in International Business.Globalization is a very interesting topic and I believe, the deeper we go in it, the more we learn and the more we can apply for the betterment of the society. [REDACTED]",1
1099,1417813040,"In economies, middle class is the class that buys consumer goods, earns good amounts of money, and spend that money too..if middle class stop purchasing consumer goods, all the economies will struggle, because rich don't spend money in all type of consumer goods, and poor dont't have money to spend a lot.",2
279,1415385426,"I don't think they are neglecting anything. You need to understand that the political state in many countries becomes a barrier most of the time to economic development. If their political state is not stable, how can they focus on anything else? There is a limit to what economic growth can do, and to the influence MNEs and such have on the country they are established. You need to think too about the culture of that people: perhaps the change need to be made not only on a political level, but on a social level as well, so that all the population starts to open its eyes to the global context.",2
1220,1418655060,"Hi there,??I am [REDACTED] from [REDACTED] running a small company. I am a MBA grad from [REDACTED] and have worked in the industry for 2 yrs. [REDACTED]",1
842,1416693332,"Dear [REDACTED], I find the question you pose really interesting. I too am becoming increasingly frustrated with the trends in growing inequality in the US. I also am increasingly angry at the role corporate multinationals, also many of which are approaching the point of industry monopolies, and their role in generating increases in income inequality. These are my thoughts in response to your questions... (this is my general train of thought)In terms of economic growth it is viewed as the ideal because I believe what it is considered to imply is that with more money moving around the economy the quality of life for the general population is also thought to increase. I think though this often does not display the whole picture, and as a response that is why many are pushing to not view GDP as the sole indicator for the economic stability of a country. But from a corporate perspective economic growth is viewed as the most important factor. And to be honest, with the current economic model of capitalism, I am not sure if it will be possible to separate the incessant drive of economic growth from the capitalist corporate business model. I believe the goal is always to make more and more money. But we are talking about a system, overall, that has limited resources across the board, and so corners need to be cut somewhere in order to continually maximize profit, and those cuts are being proven to not be made at the executive level, at least not in the US. I have a professor that pointed out to our class that when the economy was going into a tailspin during the most recent recession, in Japan, many corporate executives cut their own pay instead of laying off tens of thousands of employees like what happened here. Which seems to mean it is more a problem in the US than with the corporate capitalist system as a whole. I have yet to understand this dynamic in its entirety, but I truly think it is related to social and cultural norms present in the US, which I think tend to be more cut-throat, individualistic, and self-serving. We tend to be less community minded. I honestly think this is the root of the problem in the US, cultural values. I mean if you think about the foundation of this country it was founded on the notion of individual freedom, innovation, and capitalism. I hope that with women joining the workforce in greater number, and with women holding higher positions we are able to rein in the corporate greed. However, if the statistics shown in this weeks lecture are correct this could very well be. If women are more civic minded, more risk averse, and tend to be more forward thinking this could very well translate to the business sector. I think though the next question is how we can get more and more women to these upper management positions given the number of barriers also mentioned in this lecture. From what I can see, it may be one of the best chances we have to alter this economic system which is proving to benefit an increasingly small few. ",2
1195,1418505237,"That is interesting, but looking at the geopolitical restructuring and how there is more movement into regional unions, we needs to see pass China, US etc but start focusing on regional intergration as countries are integrating for EU, AU etc. With regionalization it seems there is a global restructuring of global powers and even UNSC has to be regional more than certain countries based.",2
481,1415788379,"Hello there, related to week 2 quick, i read the deadline is the sunday the quiz is published, however on the quiz page, it seems the deadline is Friday 14, november 8:59 pm pacific time. can you clarify a bit ?thank you very much[REDACTED]",5
876,1416823315,"I support that women have a major role to play in the growth of a country.Considering the fact that they (women) make up a crucial percentage of the population of any country,there is a need to integrate??the female gender??into the different aspects of any economy.You find that in most developing countries,there is still a great??disconnect and inequality between the male and female in the work place or business world.This is the case in Africa where i'm from and many third world countries.The few women that thrive in these countries have to struggle through certain bottlenecks as a result of their gender.It sometimes require brilliance of the part of the women for a few to succeed.",2
711,1416264423,Why do tax system subsidizes the middle class not the poor? Don't the poor needs more tax reduction in order to reduce inequality?,4
