id,post_time,post_text,Urgency_1_7
953,1417012972,When will oil cease to flow?How will it impact GDP?Here some estimates of peak oil production:http://en.wikipedia.org/wiki/Predicting_the_timing_of_peak_oil,3
880,1416825494,"I agree with the previous post.I believe it will take a more aggressive approach to combat obesity and its effect on global economy.Beyond the physical health of obese people and their clothing or insurance,obese people are increasingly becoming more dependent than they used to be some years back.Now you have young obese people increasingly dependent on family and even the country in some cases because Some move to homes when??they can no longer move around individually.An increase in the percentage of obese people means in addition to the old age and young dependent,there are more dependants the economy has to cater for.Governments have to take a stern approach to this and realize that this has a far more reaching impact on the economy as a whole and not just on the individuals.We can accomodate them all we can but it does not solve the problem.",2
26,1415025552,Hey everyone! Grreting from [REDACTED]. Would be nice to work with you on the subject.Feel free to contact me: [REDACTED],1
696,1416236010,"I agree with the first two poster's, the ratio between what individuals earn (after taxes)??and what they actually have to spend out on a monthly basis leaves you almost no choice but to buy the cheaper unhealthy food items.??The balance in some households is spending the extra on healthy item for the children so they are eating correctly and the adults eating the unhealthy.?? That may result in a healthier child but if the parent dies??young??(due to an unhealthy diet) we now are moving into another social issue with orphaned children.?? Something to think about.",2
728,1416317455,"I believe the poverty was reduced because of higher productivity. The increased productivity could come from different aspects such as foreign investment (""trickle-down effect""), the prevalence of basic education, the availability of knowledge/information thanks to internet, and so forth. Specifically, the migration of lower margin/value-added industries from developed countries to less-developed ones increases the poverty population in developed countries, while at the same time lift more people in the ower-cost countries??out of poverty. I believe the net effect reduces the global population of poverty as a whole.",2
1180,1418370876,"Hello [REDACTED],This course hasn't finished yet, so you'll have to wait until the course ends to get your certificate.??Aslo,??after your course officially ends, it might take about 2 weeks for course staff to finalize grades and issue Certificates for so many students. Could you please wait for some time and check back for your certificate at your Course Records page https://www.coursera.org/account/records?Thanks for understanding and have a great day!",1
1036,1417497928,???Is that important?,2
549,1415901485,"I do agree with most of you that think this is a supply problem - because they don't have the options, obese people tend to not care about fashion for themselves. However, when they do have the options I do believe the whole community will have to take action regarding the mindset: even ??if they have the option of buying clothes in international brand's store, obese people might not want to for fear of being badly treated at the store, or by people who see them there - they might feel they don't belong there.Summarizing, supply problem caused the mindset problem, and even if we can fix the supply problem, we still have to do something about the mindset problem.",2
973,1417171075,"Hi [REDACTED],Nice topic that you raised. However, I don't fully agree with some points. I think mobility is a hot topic in political discussion, and is still far away from ""the optimal balance"", but you need to understand that the EU and USA have different social, economical, cultural,etc. background.I??m a European citizen, and it's funny but I moved to [REDACTED] 1 year ago!!!Tax Rules- Tax rules and very high tax rates discourage job seekers:Yes is true (everybody want lower taxes), but if you compare with other Eu countries that different in tax is decreasing very fast. Then, the country have free health system, free school (every High-school or university student receive money monthly from the government), good infrastructures and transportation and other benefits. And the salaries are higher here. I don??t see why high taxation can discourage job seekers, if the system works.- The [REDACTED] tax authorities is known for abusing their power through double taxation, not allowing complaints or by making complaints extremely expensive (high legal cost)EU already enforced rules against this??double taxation, and with E-tax system (internet) you should be capable to check and correct this situations. About complains, I agree with you.- The high taxes on cars makes it unpractical to bring a car to and from [REDACTED]To bring a Car (used), you will spend the same money as if you buy the same car(used) in [REDACTED]. But you also received high salary.??And when you leave the country, they will give part of the import tax back. I'm sorry, I don't agree with you. This is a fair system and quite simply (bureaucracy).Pension RulesThis I agree with you. In my job, I??m moving constantly and I face problems with the pension system. For me, the worst is the ""maintenance"" fees that some countries charge. So, if you work during 3 years in a country then you move to other, and you only retire in 30 years. That country will charge you a fee, because your pension account doesn't have any income, so with time this money will disappear. There is some agreements between some countries(specially in Euro group), but i read that European Union wants to change this. But What will happen with if a unified pension system is created? There is countries with ""healthy"" pension system, other not so good!!!DiscriminationNever heard about sex discrimination!!! Actually, I think Scandinavia have a good gender equality. About race or nationality you think US is better?? In my experience there is a long road to be made in both sides.""Several EU countries the focus is not on qualifications such as skills and experience like in the US, but mostly on having the right personality profile."" I don't now the type of job you are talking, but for my job ??it was the??opposite.??However, here the work quality is very important, and having someone that can create problems with the??colleagues, or becoming a problem to the company is taking seriously.Basically the work culture is very different. There is no wrong or right type, all have the pros and cons.Residency requirementsI agree with you. This can be a barrier for a foreign to move and settle down. The only thing missing in your point, is that you can require permanent residence permit after 5 years, but is far away from a good solution.Substandard Transportation Systems and PoliciesIn part I agree. I also don't like this feeling of be ""forced"" to use public transportation, bikes, etc... But the public transportation works very good. And if you compare with US, it works much better. In U.S., If I don't have a car is just impossible to go from one city to another. I can say that in US you are forced to use cars!!!LanguageIf the ""international language"" was [REDACTED] you don't think this will happen in US???",2
288,1415391927,Greetings from [REDACTED]. Looking forward to participating in this course with all of you.,1
1050,1417568308,"I just want to point out, that Somali piracy is very much affecting neighbouring state Kenya...1. Somalis are migrating to the capital Nairobi were there is already a part of the city called Eastleigh predominantly inbabited by Somali migrants or Kenyans with Somali origin. As these migrants are mainly rich (from piracy), the prices of the real estates increased a lot. Purchase of Kenyan properties is also used as piracy money laundering2. There are increasing tenstions between Kenyans and Somalis in Nairobi. Kenyans don't like their expansion in Nairobi and also the threat of terrorist attacts by Al-Shabab (there were already many of them in Nairobi - most medialized was the Westgate shopping mall shooting). The Somalis in Kenya don't like that the Kenyan army has joined the international forces and is fighting against the clans in the Southern part of Somalia (mainly to protect its Northern border)3. The Kenyan coast is also affected as there were several prisons reconstructed and those patrolling forces are bringing Somali pirates to Kenya for detention before legal trial.However Kenyans are clever as well - to get some money from documentary movie makers they don't hesitate to pretend that they are Somalis. Here's a short trailer of such document:https://www.youtube.com/watch?v=3Q9kYEaMxu0",2
236,1415306950,"Hi, my name is [REDACTED]. I have a masters in Resource Economics from [REDACTED]. I want to become a stellar data scientist and I took this course to learn about global trends.??
Let's connect: [REDACTED]",1
24,1415025416,Hello all - I'm [REDACTED] and I have an extensive IT and??International Business background. I look forward to our discussions and the course. [REDACTED],1
945,1416970197,"I do not think a super union of EU/US will work. The reason is we will never be able to overcome China or India??as long as??they do not have to play by the same rules in manufacturing as EU/US do.China and India do not comply with an Environmental Rules??outline to keep us from destroying the planet or worker safety.?? They have a government controlled??labor union with??very few if any labor laws. The work force is almost slave labor.They do??not??honor patent rights as outlined by the WTO.?? China's major cities??air is black with smog, they look just like Europe and US cities did in the early nineteen hundreds. The US and Europe spend billions of dollars annually on keeping up with protecting the??environment and honoring WTO patent rights.?? As long as these differences stay as??they are the??US and Europe cannot stop??China.????????????",2
138,1415158208,"Hey everyone! My name is [REDACTED], I'm new to this online class setup, but I've learned a decent amount in the first week. Can't wait to learn more!",1
1159,1418186787,"Would like to shift the discussion somewhat to something
that has been bothering me about global warming and its underlying cause.?? I see a lack of intellectual/academic and
even personal integrity on both side of the divide on the global warming
debate.?? The questions, also briefly discussed
by [REDACTED], is whether there is a long term global warming trend that
trumps the effect of man created emissions.??


In 1660 the Glacier Bay glacier in Alaska was in a valley substantially
back from the hedge of the sea, by 1750 the little ice age had thrust the
glacier forward?? covering the entire ??land and further jutted the glacier into the
sea, in 45 years it retreated five miles (even though world population was still
relatively small), by 1880 it retreated 40 more miles, eliminating in the
process the original valley now covered by water, and today one needs to go up
65 miles up the bay to view the tidewater glaciers. 

The question is: if there were no humans on this planet,
would global warming still happen.?? One
does not hear much about this critical questions from scientists, likely
because the answer is enmeshed in politics or political correctness and there
is money to be made by sticking to 'men is the cause'.?? (I believe many scientists must be aware of
the secular trend but are preferring to keep quiet).?? 

The response to the question is critical because
it impacts the solution that is required to address the problem.?? If?? it
is a long term trend, then let's start migrating people from low lying areas,
build seawalls around major cities near oceans- as in New Orleans, basically
have a long term plan to address the inevitable.?? If caused by man, it may be worthwhile to
remove man from the earth (just kidding).??
My belief is that we are in a long term trend, with the speed of the
warming accelerated by man-made emissions.??
Thus there would
still be a need to address the emissions into the atmosphere to at least not accelerate the trend further.?? ",2
420,1415701294,"Since much of this week's discussion centred around the issue of obesity it led me to consider the merits and pitfalls of markets, as well as governments, response to this global epidemic.??Whilst it is essential to keep ""what is"" in the forefront of our minds when it comes to addressing significant trends in economics and society, to what extent do we accept the majority of people with self-debilitating conditions and alter social, political, and economic norms accordingly as opposed to using the Nudge Theory proposed by behavioural economics to slowly change direction?Sure, there are benefits to individual companies and entrepreneurs, especially in food, clothing and medical-related industries by capitalising on the obesity epidemic and all of the ensuing health and psychological problems it presents, but is it the right thing for societies in do???Would it not be a wiser course of action to, in the short term, provide what is needed to make life a bit easier for the obese, but long-term shouldn't the focus be on engaging in business and cultural avenues encouraging those in this unfortunate state to get the education and resources needed to overcome their weight and health issues? Entrepreneurs could make just as much money providing goods and services to promote health rather than disease.I am not in favour of making an ailing population the norm. I have several members of my family and close friends who suffer terribly with issues relating to either obesity, smoking, alcohol, or drugs (legal and illegal) and unfortunately this has caused chronic illness and even death amongst some of my loved ones. A similar plight has befallen over 1 billion people worldwide and is growing. Furthermore, this is only factoring in the obese, not the overweight, which I imagine would bring the total of the world's population with an unhealthy weight to well over 50%.??Any thoughts about whether economics and politics should make use of ethics, morality, and public good in setting policy and practises? I am obviously in favour of such measures.",2
113,1415118606,"I have also commented on the paradoxes; and I share [REDACTED]'s view.?? Growing globalization does not make the world more predictable in my view.?? Perhaps instead it creates common ground for global actions, such as the coordinated efforts of the Fed, the ECB, the IMF and other central banks during the 2008 financial crisis (isomorphism of financial institutions and practices).?? The crisis was surprising (unpredictable, I guess, but in hindsight perhaps fully predictable - many smart people warned of the packaging and selling of junk loans to credulous dupes (banks) in the months and years leading up to it).?? However, the response to the crisis was predictable and had the desired calming effect, ie. crisis did not, except in isolated cases, result in a global run on the banks.Whether locally or globally we are still subject to the weaknesses of human nature and the madness of crowds.?? For example, except for the few, most of us still think the stock markets are least risky when prices are high and rising and most risky when they are low and crashing.?? Those weaknesses extend to global behaviors, I think.To me, perhaps the most powerful slide in the first week's presentations was the one showing how much the Great Recession was correlated worldwide compared to past recessions (showing that 90% of nations contracted in harmony, versus 30-40% in past recessions).?? Too bad the chart did not extend back to the Great Depression for comparison.?? It seemed clear to me from that slide that the consequences of globalization and its tight(er?) connections between nations results in a more coordinated global economy ...... during good times and bad.It also highlights the need for at least some supranational institutions and standards to mitigate the inevitable future ""once in a lifetime"" events.?? As example, I can think of the Basel accords to hold banks in all countries to minimum permanent capital ratios (to mitigate against insolvency, panic and contagion) and international accounting standards (boring, I know, but to maintain integrity of financial markets).?? As always, its a trade-off between regulation (a cost to society) and innovation (a benefit).All that said, as humans our destiny seems to be to forever repeat our past mistakes, each generation relearning the lessons of our parents.",2
189,1415238823,"Hi everyone,[REDACTED] here from [REDACTED]. I was previously a FX dealer in [REDACTED]. Currently taking a break from work to pursue my interest in cooking! Have been learning cooking from a chef in [REDACTED] for the past 6 months.??Taking the course to stay relevant and have always taken an interest to economics! [REDACTED]",1
747,1416337732,other than hard work if your government is corrupt and not interested in promote entrepreneurs but blue collar slaves or a patriarchal government heavily devoted to Welfare and Idleness no matter your business: you will die pennyless,2
944,1416963876,"It's an unsupported comment by a fellow by the name of Jack Goldstone about youth unemployment, education and development in Africa as part of the discussion around risks that exist today in the global economy.?? By ""unsupported"" I mean there is nothing in the material that indicates who or what the predatory elite might be.Goldstone is an expert on political demography, whatever that is, and has written about the causes of various revolutions for what that's worth.",2
629,1416069317,The glitch has been corrected in the information system and in the General discussion:Deadline quiz week 2. Shouldn't it be on Sunday?,5
1167,1418308525,Technology driving progress behind clean energies is not cost effective...Fossil fueled power is not sustainable over the long term,1
883,1416836179,"Dear All,Here are my thoughts of the trade bloc policies based on my observation of EU policies.Pros: The trade within the bloc is increasing dramatically. All countries that joined EU witnessed dramatic increase in trade with countries within the bloc (more investments leading to more export as well as import) The next big thing is the structural investments encouraged by EU. The memberships fees are distributed for purposes often ''forgotten'' by the government. By the ''forgetting effect'' I mean the budget cuts that member states do often, which leads to lower investment in infrastructure projects. EU does not have such constraints as predetermined membership fees is distributed as per long-term perspective lasting 6-8 years. The next thing is free flow of labor (which leads also to negative consequences). After joining the EU, many people from Eastern Europe moved west (mainly UK/Netherlands) in search of better paid work. This lead to an increase in average pay in domestic countries (as the unemployment lowered) but also lead to negative budgetary consequences (the pension system fees decreased rapidly). In the immigration countries their economy became more competitive as the immigrants were on lowest-end of wage scale.?? However their unemployment must rose a bit (not much however considering that their citizens were not willing to work for such low salaries as immigrants do). Cons: Some pathological consequences of policies reduced. For instance, the farmers are paid not to produce certain groceriy so that not to lower its price on common market. This makes people also lazy as ''EU-money'' is given for not working! The next thing is that EU-made infrastructure investments-money is often wasted. The roads bild for EU money must meet certain strict requirements?? that are silly, like building very costly noise barriers next to the highway in the rural areas where noone lives. Cost of such barriers can increase the cost of road by more than 30%! In other projects it is often so that when it is close to the end of budgetary financial perspective and there is still plenty of money not used for certain purposes, the money is quickly spend on not-needed, unnecessary projecrts in order not to return the money back to the budget of the EU (which happens in case when resources are not fully utilized).As you can see from the examples that I have given, the mechanisms behind being a member of integrated trade bloc lead often to inefficiencies and non-rational actions that economic superorganisations should prevent rather than encourage.Maybe you can name a few other strange actions existing within trade blocks (maybe not only EU, but from other blocs as well (NAFTA maybe?)).I am looking forward your input!",2
460,1415753163,My reference to my note is on Australia. We are much affected by globalisation wherein our manufacturing is disappearing every day and moved to other countries that has lower wages hence the government intervention on re-skilling our manpower and even our unemployed who are on employment benefit. The other problem is the the free trade agreement between our two countries- China and Australia. It was rumored that even manpower is on the agenda. Now if cheap manpower comes to our shore the more we Australians will be disadvantage since we can't live on on the standard that our partner has.Thank all for your very interesting inputs and this help understand your references as they differ very much. As Professor [REDACTED] is saying there are winners and losers.,2
514,1415844692,"Recently I have seen African in the news and it is mostly on research pertaining to health issue. They seem to have increased investment in science and research. I would not have believed they would have the highest population growth rate in the future.
",2
312,1415454200,"Dear
all,??

??

Book
recommendation: The zero marginal cost society. Jeremy Rifkin. He gives an absolute
different view about the future of??Globalization and the end of this
economical model. I don??t fully agree with his theory but he points out so many
factors that will change shortly the economical environment in the world. As
change drivers he highlights the beginning of a new paradigm of transport,
energy and communication base on the ?â‚¬?Internet of things?â‚¬?, integrating in it
the ?â‚¬?Internet of energy?â‚¬? (base in a pull of many different renewable and
no-renewable energies), the ?â‚¬?internet of logistics?â‚¬? made by intelligent system
to integrate horizontally the whole logistic process. In this process will play
a big role the 3D printing and the renewable energy and the consolidation of
collaboration economy. All those will suppose to increase tremendously the
efficiency to produce and provide products and services and this will lead an
economy with a marginal cost very close to zero. 

??

I think
this book gives a different view and take into consideration many factors that
can play a role in the future of globalization. 

??

Hope this
can be useful for this discussion. 

??

Kind
regards, 

??
[REDACTED]",2
684,1416216564,"I am not sure whether the analogy with empires in the past is very accurate. What is probably being missed , is the level of interdependence that has been created by Globalization. I am commenting , based on the premise that Globalization????is being used to describe "" a process of growing interdependence that represents a fundamental change from a world of individual and independent states to a world of state interdependence."" As a result political boundaries, and also economic and cultural boundaries, are being made redundant. Interdependence has increased to an extent that if something happens to one, all or most others ??will also be affected.I am not expert on world history , but I think it is fair to assume that most of the??historical??empires worked to attain self - sufficiency - unlike today , when??interest??of large sections of people in one country is compromised to??honor international trade agreements.??",2
584,1415981518,"I know it sounds scary, but do you know if anyone is trying to factor in potential impact of wars on populations? I guess a global conflict can have a very profound effect on populations, not just related mortality rates, but number of births (before, during and after such events) as well as other demographic dynamics.??",2
840,1416690469,"The general idea around here seems to be that economic inequality is a bad thing.??Does this imply that economic equality is a good thing?As long as people have the ability to live satisfactory, productive lives to their full potential, then all is well. I don't feel like economic is necessary or even beneficial to this.",2
