id,post_time,post_text,Urgency_1_7
1173,1429357732,"[REDACTED], [REDACTED], bear in mind that we're attempting to meet the error and confidence guidelines. Â We don't know ahead of time whether the probability of an unacceptable error,\begin{equation*}Â  \operatorname{\mathbf{P}}\biggl\{\biggl|\frac{S_n}n - p\biggr| &gt; \epsilon\biggr\},\end{equation*}will be less than a specified $$\delta$$. Â But suppose the relationship between the sample size $$n$$, error tolerance $$\epsilon$$, and confidence parameter $$\delta$$ is such thatÂ \begin{equation*}Â  \frac1{4n\epsilon^2} \leq \delta.\end{equation*}What can we conclude? Â Indeed that the error and confidence guidelines are met. Â This is because we know that the Chebyshev bound on the left is an upper bound for the probability for any choices of $$\epsilon$$ and $$n$$. Â Given any two of the parameters, if we now select the third so that the inequality holds then we are assured that we are within specification. Â In other words, the Chebyshev bound provides a sufficient condition which, if satisfied, will automatically satisfy our error and confidence guidelines.",2
452,1426383105,Thanks [REDACTED]. I will think about this logic and post back if I have questions. Your input is appreciated.,1
113,1425334297,"Hi everyone,While we appreciate thoughtful, productive discussion, we've found that many posts in this thread aren't in line with what we expect from our community. First, I want to be clear that all Coursera courses are open to everyone. I also want to reiterate the importance of our Code of Conduct, and call your attention to its second point:Be sensitive.Â Coursera is a global forum with participants from many different cultures and backgrounds. Be kind, thoughtful, and open-minded when discussing race, religion, gender, sexual orientation, or controversial topics since others likely have differing perspectives.We've deleted several posts in this thread that we've judged to be in violation of our Code of Conduct.Â We will be monitoring this thread going forward, but if anyone feels that a post is in violation of the Code of Conduct, please don't hesitate to reach out to us through our Learner Help Center.Best,[REDACTED]",1
741,1427339219,"The 5 coins are: (HH), (HH), (TT), (HT), (HT)In Q.5, we are told that a head shows up at the upper face, thus excluding (TT).The coin drawn must be one of 4 remaining coins: (HH), (HH), (HT), (HT) with equal probability. There are 8 faces from these 4 coins and 6 faces are heads. Thus the required probability should be 6/8 or 3/4. But it is not one of the choices given. Any ideas?Regards,[REDACTED]",4
1043,1428720670,"Instead of using binomial method, if one uses classical method, the result is different. In this case, the difference is not small.Â To explain the difference, let's use a simple example, 4Â word misprints randomly distributed into a book of 2 pages, what is the probability that first page gets 2 misprints? Â This isÂ slightly different from the original question for the sake of explanation, one should easily extend this to the actual problem.Here is the solution using what I called classical method: Let's use 0 for misprint, and 1 for division of the pages, 01000 means the first page gets 1 misprint and 2nd page gets 3. The sample space becomes: {00001, 00010, 00100, 01000, 10000}, the event where first page gets 2 misprint is 00100. So the probability is 1/5 = 0.2.Â However, if one uses binomial method, one would get $$\textstyle {n \choose k}\, p^k (1-p)^{n-k}$$ with p = 1/2, k=2 and n=4. The result is 6/16 = 0.375. As you can see, there is a huge difference.Can Professor [REDACTED]or any of the TAs or any classmates please resolve the apparent puzzle for me?Â I think classical result is exact while binomial is an approximation or even flawed. I believe the binomial method is not applicable to this type of problem. In other words, I don't believe Tableau 10.1:e is correct.Therefore, people selected the classical result should probably be credited also.Thanks",5
233,1425643506,"If we allow more than one ball per urn, the total number of ways you can allocate 3 balls to 7 urns is 7^3.If we allow no more than one ball per urn, we have 7*6*5.The number of ways that leaves a specific urn, such as the 5th, empty is 6^3 under the first scenario.For the second, we have 6*5*3.That gives me 0.37 and 0.42. How did you guys get 0.49? Also not sure what you mean by balls being indistinguishable.",4
1385,1430107639,"Prof. [REDACTED] &amp; staff, just a quick note to say ""thank you!"" for a wonderful course. You are a ""master educator"" who knows how to breakdown complex concepts for easy consumption. You made the course very engaging and showed the beauty in probability. Thank you! Like many others, I look forward to an opportunity to take another course from you (probability or otherwise). Best wishes to you and your staff!",1
843,1427827210,"But we know that the first toss was a head. Call that Event A. We want to find P(B|A) not the unconditioned P(B), so the calculations for the second toss should use P(F|A) and P(H|A) instead of the unconditioned P(F) and P(H). By Bayes, P(F|A) = 1/3 and P(H|A) = 2/3, so P(B|A) = (1/2)*(1/3) + (1)*(2/3) = 5/6 as required.",2
1241,1429599087,Could a member of staff please check that the correct answer is among the choices given. Thank you.,3
264,1425804435,"My name is [REDACTED], from [REDACTED]. Thank you for the amazing lectures!",1
325,1425959803,"In this question the ordering does not matter. Because all that we care about is whether a seat is empty or occupied, and how the empty and occupied seats are located next to each other. So it does not matter how and in what order some seats are occupied, so long as we know that those particular seats are occupied.",2
1436,1430455063,"I was waiting to see if anyone else wanted to chime in, [REDACTED], but with the course having ended this might be asking for too much dedication. Â The analysis I am going to outline will require a little patience but each step is elementary.To begin we should realise that [REDACTED]'s analysis is based on expected values and subtleties can be lost in broad brush approximations. Â So now we should formulate the question a little more precisely.To begin consider a single family. Â Let $$X$$ denote the number of girls and $$w(n):=Â \operatorname{\mathbf{P}}\{X= n\} = 2^{-n-1}$$ for $$n\geq0$$ the associated mass function.Â  (This is the geometric distribution seen briefly in Lecture 6.1: d.) Â Under the conditions of the problem, the family has exactly one boy and so the probability that there is one boy and no girls (in other words, boys exceed girls) is given by Â \( \operatorname{\mathbf{P}}\{ X = 0 \} =Â w(0) = \frac12 \). Â The probability that there is precisely one boy and one girl (in other words, the genders are in balance) is given byÂ \(Â \operatorname{\mathbf{P}}\{ X = 1 \} =Â w(1) = \frac14 \).Â And the probability that there is more than one girl (girls exceed boys) is given byÂ \(Â \operatorname{\mathbf{P}}\{ X \geq 2 \} =Â \sum_{n=2}^\infty w(n) = 1 - w(0) - w(1) = 1 - \frac12 - \frac14 = \frac14 \). Â Thus, the probability that boys exceed girls is twice as large as the probability that girls exceed boys and the intuition based on expected values only seems to break down.What if we have many families, say $$n$$? Â Suppose that the number of girls in each of these families is represented by \( X_1 \), \( X_2 \), \( \dots \), \( X_n \). Â Then the total number of boys in the population is $$n$$ while the number of girls is chance-driven and given by \( S_n = X_1 + \dots + X_n \). Â The mass function of $$S_n$$ is given by the negative binomial distributionÂ \begin{equation*}Â  (\star) \qquad w_n(k) :=Â \operatorname{\mathbf{P}}\{S_n = k\} = \binom{n+k-1}{n-1} 2^{-k-n} \qquad (k\geq0).\end{equation*}How do we prove this? Â The convolutional mechanism that we had used to derive the stability of the Poisson distribution in the Dangerous Bend Lecture 10.2: p is one way to show this but a direct combinatorial argument is available. Imagine that we arrange the children from the first family from left to right first in order of age with \( X_1 \) girls followed by the sole boy; then the children of the second family with \( X_2 \) girls followed by their boy; and so on. Â Viewed from left to right in our probability model, we have a string of Bernoulli trials where we have successive ""failures"" (girls) punctuated by ""successes"" (boys). Â (It is a sad commentary that our metaphorical language of Bernoulli successes and failures may actually be a fact of life in some parts of the world.) Â The sequence terminates with the \( n \)th ""success"" and so we can think of the number of girls in total in this metaphorical sense as the waiting time (or the number of failures) till the \( n \)th success. Â If you've had a chance to listen to Dangerous Bend Lecture 10.2: t you may be struck with a feeling of dÃ©jÃ  vu. Â It is not an accident: the exponential density is the continuous counterpart of the geometric mass function. Â With this understanding in mind, we realise that the final trial must be a success (the \( n \)th boy). Â If the waiting time till the \( n \)th success (that is to say, the total number of girls) is \( k \) then there must be a total of \( k + n \) trials of which the last is a success. Â But then there must be exactly \( k \) failures distributed arbitrarily in the first \( k + n - 1 \) trials. Â As we are dealing with a fair coin, the probability of this is given by the binomial probability \( \binom{k + n - 1}k 2^{-(k + n - 1)} = \binom{k + n - 1}{n-1} 2^{-(k + n - 1)} \) [in view of the binomial coefficient identity seen in Lecture 2.2: b]. Â We multiply this by \( 2^{-1} \) to account for the fact that the final trial [the \( (k + n) \)th trial] is independent of the first \( k + n - 1 \) trials and must be a success and so we recover the mass function given in \( (\star) \) for the waiting time till the \( n \)th success (or, in our context, the total number of girls).With \( (\star) \) in hand, what is the probability that the number of girls is fewer than the number of boys? Â As there are exactly $$n$$ boys, leveraging additivity, this is given byÂ \begin{equation*}Â Â \operatorname{\mathbf{P}}\{S_n\leq n-1\} = \sum_{k=0}^{n-1} w_n(k) = \sum_{k=0}^{n-1}Â \binom{n+k-1}{n-1} 2^{-k-n}.\end{equation*}This looks formidable but if you attempt a numerical calculation, say, for $$1\leq n\leq 100$$, you will discover that the right-hand side always seems to be equal to $$\frac12$$. Â You will surely feel that this cannot be an accident (or, at least, that this merits further investigation) and so accordingly you may be led to conjecture that\begin{equation*}Â Â \operatorname{\mathbf{P}}\{S_n\leq n-1\} = \frac12 \quad\text{or, equivalently,}\quadÂ Â \operatorname{\mathbf{P}}\{S_n\geq n\} = \frac12\end{equation*}for all $$n\geq1$$. Â There are several ways we can go about proving this but having guessed the answer the simplest approach is by mathematical induction. Â The base case has already been established for the case of a single family, $$n=1$$, as $$S_1 = X_1$$ and we have seen thatÂ \begin{equation*}Â Â \operatorname{\mathbf{P}}\{S_1\geq 1\} = Â \operatorname{\mathbf{P}}\{X_1\geq 1\}Â = 1 -Â \operatorname{\mathbf{P}}\{X_1 = 0\}Â  Â  = 1 - \frac12 = \frac12.\end{equation*}As induction hypothesis, suppose now that $$ \operatorname{\mathbf{P}}\{S_{n-1}\geq n-1\} = \frac12$$. Â Now, the inequality $$S_n\geq n$$ is satisfied when precisely one of the following two conditions holds: either $$S_{n-1}\geq n$$ or, for some $$0\leq k\leq n-1$$, Â $$S_{n-1} = k$$ and $$X_n\geq n-k$$. Â It follows that\begin{align*}Â Â \operatorname{\mathbf{P}}\{S_n\geq n\} Â  Â  &amp;\overset{\text{(a)}}=Â \operatorname{\mathbf{P}}\{S_{n-1}\geq n\} + Â \sum_{k=0}^{n-1} \operatorname{\mathbf{P}}\{S_{n-1} = k, X_n\geq n-k\}\\Â  Â  &amp;\overset{\text{(b)}}=Â \operatorname{\mathbf{P}}\{S_{n-1}\geq n-1\} -Â \operatorname{\mathbf{P}}\{S_{n-1} = n-1\}Â  Â  Â  + \sum_{k=0}^{n-1}Â \operatorname{\mathbf{P}}\{S_{n-1} = k\}Â \operatorname{\mathbf{P}}\{X_n\geq n-k\} \\Â  Â  &amp;\overset{\text{(c)}}= \frac12 -Â \operatorname{\mathbf{P}}\{S_{n-1} = n-1\}Â \cdot \bigl(1 -Â \operatorname{\mathbf{P}}\{X_n\geq n- (n-1)\}\bigr)Â  Â  Â Â + \sum_{k=0}^{n-2}Â \operatorname{\mathbf{P}}\{S_{n-1} = k\}Â \operatorname{\mathbf{P}}\{X_n\geq n-k\}.\end{align*}In this sequence, (a) follows by additivity; (b) by additivity to rewrite the first term on the right and by independence (as $$S_{n-1}$$ is independent of $$X_n$$) to factor the summands; and (c) by induction hypothesis and a little rearrangement of the terms of the sum to group the terms involving $$\operatorname{\mathbf{P}}\{S_{n-1} = n-1\}$$. To show that $$\operatorname{\mathbf{P}}\{S_n\geq n\} Â = \frac12$$ and so complete the induction it will hence suffice to show that\begin{equation*}Â Â \operatorname{\mathbf{P}}\{S_{n-1} = n-1\}Â \cdot \bigl(1 -Â \operatorname{\mathbf{P}}\{X_n\geq n- (n-1)\}\bigr)Â  Â  =Â Â \sum_{k=0}^{n-2}Â \operatorname{\mathbf{P}}\{S_{n-1} = k\}Â \operatorname{\mathbf{P}}\{X_n\geq n-k\}.\end{equation*}As $$X_n$$ is governed by the geometric distribution with mass function $$w(j) = 2^{-j-1}$$ for $$j\geq0$$, we see that, for any integer $$m\geq0$$, we have\begin{equation*}Â  \operatorname{\mathbf{P}}\{X_n\geq m\} = 2^{-m-1} + 2^{-m-2} + 2^{-m-3} + \dotsbÂ  Â  = 2^{-m-1}\bigl( 1 + 2^{-1} + 2^{-2} + \dotsb \bigr)Â  Â  = \frac{2^{-m-1}}{1 - 2^{-1}} = 2^{-m}.\end{equation*}And, as $$S_{n-1}$$ is governed by the negative binomial mass function \( w_{n-1}(k) = \binom{(n-1) + k -1}{(n-1) -1} 2^{-(n-1)-k} \) for $$k\geq0$$, the identity we are seeking to verify isÂ \begin{equation*}Â  \binom{(n-1) + (n-1) - 1}{(n-1) - 1} 2^{-(n - 1) - (n - 1)} \cdot \bigl(1 - 2^{-1}\bigr) Â  Â  = \sum_{k=0}^{n-2} \binom{(n-1) + k - 1}{(n - 1) - 1}Â 2^{-(n - 1) - k}\cdot 2^{-(n - k)},\end{equation*}or, what is the same thing,\begin{equation*}Â  \binom{2(n-2) + 1}{n-2} 2^{-2n + 2}\cdot 2^{-1}Â  Â  = 2^{-2n + 1} \sum_{k=0}^{n-2} \binom{(n - 2) + k}{n - 2}.\end{equation*}Simplifying both sides by cancellation of the common power of $$2$$, we hence wish to verify the identity\begin{multline*}Â  (\ast) \qquad \binom{2(n-2) + 1}{n-2} = \sum_{k=0}^{n-2} \binom{(n - 2) + k}{n - 2}Â  Â  Â  \overset{\text{(d)}}= \sum_{k=0}^{n-2}\binom{n-2+k}k\\Â  Â  Â  = \binom{2(n-2)}{n-2} + \binom{2(n-2)-1}{n-2-1} + \binom{2(n-2)-2}{n-2-2} + \dots + \binom{2(n-2) - (n-2)}{(n-2) - (n-2)},\end{multline*}where the step marked (d) follows by Lecture 2.2: b as $$\binom{n-2+k}{n-2} = \binom{n-2+k}k$$. Â Simplify the algebra by writing $$m = n - 2$$. Â By repeated applications of Pascal's triangle [Lecture 2.2: c] we see that\begin{align*}Â  \binom{2m + 1}m Â  Â  &amp;= \binom{2m}m + \binom{2m}{m-1} \\Â  Â  &amp;= \binom{2m}m + \binom{2m-1}{m-1} + \binom{2m-1}{m-2}\\Â  Â  &amp;= \binom{2m}m + \binom{2m-1}{m-1} + \binom{2m-2}{m-2} + \binom{2m-2}{m-3}\\[4pt]Â  Â  &amp;= \dotsb \\[4pt]Â  Â  &amp;= \binom{2m}m + \binom{2m-1}{m-1} + \binom{2m-2}{m-2} + \dots + \binom{2m-m}{m-m}.\end{align*}Identifying $$m = n-2$$ in $$(\ast)$$, we verify the given identity and hence, tracing our path backwards, that $$\operatorname{\mathbf{P}}\{S_n\geq n\} = \frac12$$, thus completing the induction.We conclude that $$\operatorname{\mathbf{P}}\{S_n\leq n-1\} = \frac12$$ for all $$n$$ and hence that the probability that boys exceed girls in the population is one-half.What can be said about the probability that there are exactly as many girls and boys? The probability that girls and boys are balanced is given by\begin{equation*}Â Â \operatorname{\mathbf{P}}\{S_n = n\} = w_n(n) = \binom{2n-1}n 2^{-2n}.\end{equation*}We may get a feeling about how the right-hand side behaves for large $$n$$ via Stirling's formula [which asserts that $$N!\thicksim \sqrt{2\pi N}\, \bigl(\frac{N}e\bigr)^N$$ as $$N\to\infty$$]. A little elbow grease is all that is requisite to simplify the expression on the right and we obtain\begin{equation*}Â Â \operatorname{\mathbf{P}}\{S_n = n\} \thicksim \frac1{2\sqrt{\pi n}} \qquad (n\to\infty).\end{equation*}The probability of balanced genders decreases slowly with $$n$$.We may now draw the following conclusions from the analysis. Â As $$\operatorname{\mathbf{P}}\{S_n = n\}$$ is strictly positive for all $$n$$, we conclude that\begin{equation*}Â  \frac12 =Â \operatorname{\mathbf{P}}\{S_n \leq n-1\} &gt;Â \operatorname{\mathbf{P}}\{S_n\geq n+1\}\end{equation*}and so the chances that boys outnumber girls are strictly better than the chances that girls outnumber boys. Â On the other hand,\begin{equation*}Â Â \operatorname{\mathbf{P}}\{S_n\leq n-1\} -Â \operatorname{\mathbf{P}}\{S_n\geq n+1\}Â  Â  = \operatorname{\mathbf{P}}\{S_n = n\} \to 0 \qquad (n\to\infty)\end{equation*}(though the rate of decay on the right is slow â€” it only decays at the rate $$n^{-1/2}$$). Â This says that for large populations boys have a tiny edge over girls but the edge is very small.We can now ask other questions such as, for a given population size, is a discrepancy seen adequately explained by this sanitised and simple model? Â We have the tools now to begin exploring such questions.",2
1128,1429113235,"An absolutely fantastic course. Â For sure, this course will become a classic on the Coursera menu. Â Dr [REDACTED]'s style of teaching is very rare to find and we are very lucky to have had this opportunity to get the foundations laid down for such a beautiful subject in a very engaging and clear manner. Â This course has cleared up so many niggling doubts I've had from studying this subject previously.I wish Dr [REDACTED] will have the time to produce a follow on course to this one. Â I'm sure anyone who has gone through this course will feel the same way.Many thanks for providing us this opportunity.",2
421,1426273513,"Thanks so much for that clarification, I'll be looking forward to the upcoming lecture.",1
184,1425499168,"When r=5 and the number of tosses are 100, the number there is 0.81 so there is 81% chance for this to happen right ??How we came up with 97% chance ? :/Thanks for your answers ,[REDACTED]",4
1037,1428688550,"Yes! Your insertion ""of"" is really great. Now if you allow me to bury our horse, I think I have a way to get the flowers to bloom on his grave.I think the mental problem of our situation occurs because we lose sight of what A and B are because the set of Aâˆ©Ac and Bâˆ©Bc do not have explicit names we can use to fully describe the parts of the implied sample space as a whole. So to describe in words our full situation let us generically define sample space Toss1 as bold A = A + Ac because Aâˆ©Ac = 0 subset A along with subset Ac are partitioned by rows (diagram Toss1 above). Similarly, B = B + Bc except that the subsets of B are partitioned by columns. (diagram Toss2 above). So when we say to Aâˆ©B we are referring to it as a subset of Aâˆ©B and as long as neither A or B are empty, then Aâˆ©B &gt; 0. In matrix algebra terms we say that A and B form orthogonal (rows and column partition lines are 90 degrees to each other) relationships whose values are determined by multiplication. The aforementioned will be strictly true as long as Aâˆ©B/B = A which is just a tautology at this point until we bring in the concept of conditional proportions. But for our coin tossing experiments we know this to be true. So OK so far.Now let's really cement in our insights by the following ""gedanken"" experiment: Place two heads, our expected number of heads in four tosses, in a row. Now place the expected two tails in a row just below the heads. Put a piece of plexiglass (designating the ending of toss 1) over the coins and scribe a horizontal line in the plastic to separate the two rows. Now put two heads in a left column in such a way as to still see the coins from toss 1 below. Similarly, place the two tails expected from our toss 2 experiment in a right hand column. Place another piece of plexiglass over these coins and scribe a vertical line in the plastic. Now note what we have here, a physical representation of our two toss sample space. Now notice that as you look down through the top plastic plate you will ""see"" Aâˆ©B as a combination of A with B by crossing the pane of plastic separating A with B. You can still ""see""Â  A across the top row and B along the left column. Their intersecting conjunction across the planes is 90 degrees to the row and column lines. We can say that our total sample space consists of orthogonal subsetsÂ of A with B.Â  The Omega of A is 4, the Omega of B isÂ  4, but the Omega of Aâˆ©B is also 4 even though it takes 8 coins to create this sample space. Now toÂ ""see""Â  our new set Aâˆ©B in a single plane, take a photo looking down through the plexiglass ""flattening"" our layers together. This would now be akin to the subsets created when tossing both coins together. These subsets could be relabeled, say AiBj. They are disjoint and strictly additive in the new sample space AxB. We no longer have to keep them in row by column arrangement to correctly calculate their combined proportions. This is akin to enumerating all the possible AxB subsets in a one planar sample space.The purpose of the rules for set algebra is to allow us to make correct inference and calculations in terms of the implied orthogonality ofÂ  subsetsÂ  A and B. E.g. AâˆªB = A + B - Aâˆ©B = Acâˆ©B + Aâˆ©B + Aâˆ©Bc = 1 - Acâˆ©Bc Next up: what the heck does conditionality really mean? Are you still interested in the conversation?",2
685,1427156331,"From the first paragraph of the announcement posted today: (it was emailed to you, as well, assuming your email is not anonymous.Â ""You will be able to view solutions for Homework 2 twenty-four hours after the deadline for submission.""",1
897,1428121878,"I think question 6 should be deleted from the grading, in fairness.Â  I answered one way, then, seeing it marked wrong, used my second try and answered a different way.Â  My second try came after the auto-grader was fixed, but I didn't realize that a problem existed at that point.Â  I simply redid the problem, even though I was sure I had been right the first time, and now I have an actually wrong answer and have exhausted all of my attempts.Â  Unless of course I got it wrong both times, but without giving it away I don't think I can know that.Â  Perhaps do to the mistake in the autograder this question should just be eliminated from the scoring, or marked correct for everyone.",5
700,1427199106,"Because you don't just put the one ball back, but also an amount of a balls in the designated colour are being added to the urn, so you have a (lot) more red balls in the urn the second time around, if the first draw showed a red ball.",2
33,1425185239,"[REDACTED] is my name. I'm a graduate student of economics at [REDACTED].I enrolled in this course to underpin my understanding of probability for some of the courses I'm taking in economics.Â I look forward to a great learning experience and discussions. Again, I wish you all the best in this endeavour.Â ",1
1330,1429917904,I found Dr. [REDACTED]'s teaching delivery to be quite charming. Please don't change a thing!Â ,1
744,1427366523,"I understand that subtitles are made by volunteers, but studying without them is a problem for me, being English not my first language. I have to wait until subtitles are all online, and homework deadline is approaching. I think the deadline should be postponed, otherwise I'll have to study everything in the last days (if subtitles are online by that time). This is a big handicap, and not fair at all towards student whose first language is not English. Can the homework deadline be postponed to a week AFTER all subtitles are loaded, please?",6
1265,1429644772,"How does chi square scale the way it is written in the second slide of this video (essentially linearly with the size of the observations)?I would understand that if the S_n's would have an explicit dependence on the number of observations so that one can factor out m from each term in the sum defining chi square. But this doesn't seem to be the case:$$\sum_k (S_{nm}^{(k)} - nmp_k)^2 /nmp_k = \sum_k m^2(S_{nm}^{(k)}/ m - 
np_k)^2 /nmp_k = m \sum_k (S_{nm}^{(k)} /m- np_k)^2 /np_k$$the last term is not $$m\chi^2$$!Where am I going wrong?",5
215,1425569372,"You're quite right of course that using the complement is a faster way to get to the answer (assuming one is not as comfortable with infinite series as with finite sums:-) Â And we could have used the same slightly faster tack in the analysis of the first throw in craps to argue that$$\mathbf{P}(\text{Continue})= 1 - \bigl(\mathbf{P}(\text{Win}) + \mathbf{P}(\text{Lose})\bigr) = 1 - \bigl(\tfrac{2}{9} + \tfrac{1}{9}\bigr) = \tfrac{2}{3}.$$The intent in Tableau 3.3 is, however, to reinforce the key notion of additivity, finite and infinite. Â Which is why the lecture takes the slightly longer path of summing an infinite geometric series. Â (A secondary motivation was to introduce a convergent infinite series early in the lectures to jog the memory of folks who're a bit rusty with these concepts.) Â But complementation also brings into view an important and useful aspect of additivity (we've already seen it in play in Chevalier de MÃ©rÃ©'s paradox). Â We will knit all these notions together in the lectures of Week 2 as we wind our way through Tableaux 5, 6.1, 6.2, and 7.",2
