id,post_time,post_text,Urgency_1_7
1216,1429541845,"To the master chef and assistant chefs:I am having, and I assume others are having, problems withtranscripts 11.1 j and kÂ Â Â Â Â Â Â Â Â Â Â Â Â Â Â Â Â Â 12,2 k and l,The transcripts in question appear to be identical.I am thoroughly enjoying your course.Â  You serve the best meal I have had in a long time.Thank you for all the thought and hard work you have all put into the course.",3
1424,1430356556,"I heard the hint of Ludwig's delightful On Certainty creep into one of the lectures with the utterance of the phrase ""grounds for belief."" Â That is definitely an essay that belongs very near the topics in the course. Â While Wittgenstein only a few time alludes to the notion of when knowledge is good enough to form the basis for action, I believe that's the operational difference in ""grounds for belief."" Â When is our knowledge of something good enough to form the bais for action or choice? Â Of course sometimes, as Rumsfeld said, we must choose regardless of knowledge. Â But it seems to me that science (coming from the Latin present participle ""sciens"" or knowing) is never truly settled. Â All the debate about climate change and science. Â The real issue is when is a body of knowledge possessed of enough ""grounds for belief"" to form the basis for our decisions. Â Even when we ""know"", there remains the question of values and cost-benefit analysis. Â Probability occupies an important place in making decisions. Â When we can quantify the chances, we are a little better off than Rumsfeld's known and unknown unknowns. Â All that aside, this was an unconventional presentation or great cultural relief that held my attention. Â I will never think of a galvinometer the same way ever again. Â And I won't soon forget the metaphorical mixtures of cooks and gourmands taking all those dangerous bends! Â Would you take a chance on riding with a chef? Â Not unless she were Grace Kelly in To Catch a Thief. Â Bon appetit and voyage! Â Nothing dull -- ever! Â Checkered flag in the Night Kitchen. Â Kudos! Â [REDACTED]",2
271,1425834113,"Dear [REDACTED],I can see how this could be useful for some users. Â But in this, the first incarnation of this course on Coursera, we're actually producing the finalised versions of these lectures on a week by week basis and we simply don't have all the lectures pre-assembled. Â So I'm afraid it is not going to be possible to produce a consolidated file at this time.I am glad, however, that you are enjoying the lectures. Â This is a wonderful subject and it gives me great happiness when others enjoy it as much as I do.",1
538,1426602017,Thanks Dr. [REDACTED]. This is really helpful.,1
948,1428330030,I think I see where your error was. Your logic is correct but when multiplying the probability of all the independent events its supposed to be p(H_4)*p(H_4)*..... 56 times. Or p(H_4)^56. Let me know if that helps.Â ,3
17,1425152555,"Hi,I'm [REDACTED]. I live in [REDACTED]. I studied applied mathematics. I'm an accountant. I love probability and hope to learn interesting things.",1
1430,1430384333,"So, no one can answer the good question raised by the OP? This has something to do with the false safety of the Martingale bet, in my opinion, but I can't elaborate further. Someone can? It would be awesome.",4
703,1427207060,"The definition of (Riemann) integral is the limit of a Riemann sum to infinitesimal length of interval, so this is actually not an approximation, but the real thing.",2
512,1426558789,I don't see an error between 7:00 and 7:45. Â Why don't you flesh it out a little bit more so we can take a look at what's worrying you? Â Is it the term $$\binom{n+m-1}m$$ in the numerator?,2
316,1425943796,"In that question we are not using cumulative probability, it is asking the probability that the game end on exactly n turns (not n or fewer turns).Â  As people are still working on it I'm not willing to say more.",2
1418,1430339041,If anyone would like to stretch themselves on the topic of probability and random walks etc try working on the problemsÂ in this thread: Â http://class.coursera.org/probability-001/forum/thread?thread_id=282 ,2
48,1425224044,Having watched more of the week 0 videos I see that the instructor raises my point in a later video. Tableau 2.2a.,1
84,1425285130,I think I got it now. Is this right?1.Suppose $$w\in(A\cup B)^c$$2.ThenÂ $$w\notin A $$ orÂ $$w \notin B$$3.IfÂ $$w\notin A $$ thenÂ $$w\in A^c$$4.if $$w\notin B $$ then $$w\in B^c$$5. Then $$w\in (A^c \cap B^c)$$,1
663,1427113346,"What is the rationale for the 50% penalty? I have scored a perfect 7/7 in the first two assignments but due to the hard deadline penalty (which, my bad, I had not noticed) I got only 3.5/7 on each. Now it is impossible to obtain a certificate with distinction even if I score a perfect 7/7 in the subsequent 5 assignments.",4
1083,1428936057,"Hi [REDACTED]. I think the ballot problem was supposed to be this sort of problem, but I do not understand the relation.",2
201,1425534458,I am still struggling to understand... I see that the probability of success run of 4 = 97%... success run of 5 = 81% and failure run of 5 = 81%... the both (OR) exceeds 97%... Would you be able to explain in the most simplistic form possible?,4
1339,1429943108,"Your joint definition is referring to the absolute probability of all cases, which includes the conditional term.Â  All of the joints sum to one.By definition, 1 - P(convicted | innocent) = P(!convicted | innocent)just as 1 - P(convicted | !innocent) = P(!convicted | !innocent).Â  These are not absolute but relative.Â  I'm thinking that ""erroneous conviction"" needs to be taken in context, that is, is unconditional or conditional being asked for.",2
1090,1428948197,"There will be one final homework next week, folks. Â It will be cumulative in nature and cover a swath of the course but it will not need any of the dangerous bend material.",1
35,1425186932,"We are here to learn Probability. He or She, this is just a 50-50 thing, don't think too much. Hope we can make progress together, guys! Cheer up!",1
44,1425216335,"I feel warmth and transcendence of our professor who is to from my homeland and cracked IIT, Â  which is the exam I am currently studying for . Â I would like to thank all chefs, Â Mrs [REDACTED]and Mr. [REDACTED]for this opportunity. I am obliged.Â Please Prof. Â [REDACTED] would you like to share your AIR in IIT exam as well as marks you obtained it will be very inspiring for me.Â Thank you all.Â It seems our chefs are fond Â of Â authentic cuisine and also are aware of unexpected deserts",1
313,1425941127,"Is it possible to combine the slidesÂ in pdf filesÂ by tableau number such asÂ tableau1.pdf, tableau2.pdf,... etc. ?It's much more convenient than dozens of small pdfs.",5
1029,1428633629,Correct answer is there in the options.,1
14,1425151167,"Can men take this course?Â  --Â  All introductory materials speak of ""she"".Most of the world-class chefs are men. Most of the world-class mathematicians - including, but not limited to probabilists - are and historically have been - almost exclusively - men - from Laplace to Bernoulli to AlfrÃ©d RÃ©nyi to Paul ErdÅ‘s

to ÃbrahÃ¡m Wald to JÃ¡nos von Neumann to KÃ¡roly Jordan to Michel LoÃ¨ve to A. N. Kolmogorov to Boris V. Gnedenko to... on and on.Is this going to be a course in probability theory - or is this going to be a course in ""applied social engineering""?à¤¸à¥‹à¤¶à¤² à¤‡à¤‚à¤œà¥€à¤¨à¤¿à¤¯à¤°à¤¿à¤‚à¤— à¤˜à¥‹à¤¡à¤¼à¥‡ à¤—à¤‚à¤¦à¤—à¥€ à¤•à¥‡ à¤¸à¤¾à¤¥ à¤ªà¤°à¥à¤¯à¤¾à¤ªà¥à¤¤",1
568,1426688278,(n-(n-k))!(0-k)!(-k)!-k!the denominator should be -k! right? any reason why the negative sign get omitted?,4
301,1425925626,"I came on to post that the grader is wrong on number 4.Â  A number of you beat me to it.Â  But I agree with [REDACTED].Â  While I am less sure, I think number 5 is wrong as well.Â  Else, how did I get 6 right.",4
400,1426180209,"This is a nice little technical catch! Â I had finessed it so as not to get embroiled in measure-theoretic detail but now that you have brought it up it deserves a fuller answer. Â The student who is willing to accept the fact that the continuum arises naturally from limiting sequences of discrete experiments can ignore this â€” the main point of the exercise was to make a case for the consideration of continuum experiments. Â For the others who would like a little more technical background, read on.You are quite right: there are numbers for which there are two dyadic representations. Â Generically, any number which can be expressed as a fraction with a power of 2 in the denominator can be represented in two ways: a terminating expansion (with an infinite sequence of trailing 0s) and a nonterminating expansion (with an infinite sequence of trailing 1s). Â Here's another example:$$\frac38 = .011\dot{0} = .010\dot{1}.$$But this observation is not problematic because: Â the set of real numbers with two different dyadic expansions has length zero. Â Â What you've just done is identify your first non-trivial set of probability zero! Â We may hence pick by convention either of the representations in the cases where there are two, for example, we may by convention always agree to pick the non-terminating expansion, and none of the calculations are affected as the sets are equivalent up to a set of zero length. Â Formally, with this convention under our belt, every real number $$0 &lt; x \leq 1$$ in the unit interval will have a unique non-terminating expansion which corresponds to a unique sequence of coin toss outcomes. Â This leaves out certain sequences of coin tosses from the specification (those with an infinite sequence of trailing tails). Â This entire set of sequences may be put in one-to-one correspondence with the equivalent sequences corresponding to the non-terminating expansions. Â And the latter set may be identified with a countably infinite collection of real numbers. Â Now any countable set has length (formally, Lebesgue measure) zero. Â (This has to be shown. Â But this takes us into a detour into Lebesgue's theory of measure and I will not do that here.) Â This means that the set of coin toss sequences that we have ignored collectively has zero probability. Â Adding sets of zero probability to events does not change the probability and so none of the calculations is affected.The bottom line is this: the coin tossing experiment is equivalent to the unit interval up to a set of sample points whose probability is zero.I would cheerfully have avoided this technical digression (as I did in the lecture!) but once you picked up on the technical nuance you've forced my hand!",2
527,1426574658,"Re: Homework 1 Problem 2:
I am not following why â€œThe coin lands on tails and die B shows up whiteâ€ and â€œDie B shows up redâ€ are not both valid complete characterizations of Â sample points for the described chance experiment.
For this experiment, our sample space $$\Omega$$ consists of four sample points:
1.Â  Die A shows up red, 	(with probability 3/16)
	2.Â  Die A shows up white, 	(with probability 5/16)
	3.Â  Die B shows up red, 	(with probability 5/16)
	4.Â  Die B shows up white, 	(with probability 3/16)
Whether the coin showed a head or a tail is implicit in the outcome:Â  if die A shows up, it was a head, if die B, a tail. Â The result of the coin toss seems to be merely a detail accounting for why the outcome is biased. Â We couldÂ  call outcome 4 â€œThe coin lands on tails, and die B shows up whiteâ€, but this describes the same outcome.Â  Â  As Professor [Redacted] notes in lecture 6.1b â€œIt makes little matter what we call an outcome,â€¦ a rose by any other name would smell as sweet â€¦â€
So why is â€œDie B shows up redâ€ not consideredÂ  a complete characterization of an outcome for this experiment? [Redacted]",5
453,1426387774,"Hi [REDACTED], it is a privilege for me to learn from you. This is my skype id ""[REDACTED]"". Let's learn together",1
183,1425495639,I've never encountered a Coursera course where they couldn't set out the videos in comprehensible and accessible order. I don't have the patience for such faffing about :-) Â  And what's all the patronising gibberish about larders and menus for?,4
415,1426259488,"Hi all,Consider only 2 individuals. The probability that they do not share a birthday is 364*365/(365*365) which is the same as 364/365.If one them has her/his birthday on one of 365 days, the other may have it on any of the remaining 364 days. The total possibilities, irrespective of the criteria we are looking for is 365*365.How many such pairs or combinations can we pick from a set of n individuals?n choose 2Â (the order does not matter since we ultimately have to map it to a comparison)Therefore the probability that none of the above pairs had common birthdays comes out to be (364/365)^(n choose 2).Subtract the above from one and we'll have the complementary probability needed.When I check it for smaller values of n, the diiference isn't much (on comparing my values with the ones in the lecture). However, for larger values, there seems to be a slight mismatch in the decimal values.This difference could be due to the way I value digits that fall after the decimal place. Nevertheless, I wouldn't want people making de MÃ©rÃ© - jokes about me just because I failed to consider a few significant digits after the decimal. So, please do let me know if my logic seems alright to you.",3
507,1426547857,"Even if the snitch is in the first room, there is a chance that he or she isn't found.",1
1446,1430779628,"Now the course is over and the results are in I would like to congratulate Prof [REDACTED] and his dedicated team for putting on the best course yet I have taken on Coursera. The fine quality of Â exposition and the videos can only be described as pace setting. So a big thank you to Prof [REDACTED], his team and of course everyone in the forums for making this a totally fantastic experience. I wish everyone the very best !",1
1007,1428512457,"Hi ! Computing E(x), we find that the max is another ""c"" than the grader accept.... So I totally agree with you !",2
438,1426333205,"Thank you for pointing it out, [REDACTED]. Â We'll send in a request for a replacement.",1
1240,1429587644,"If I had the time and money I'd easily study math at [REDACTED]. Â Probability and statistics with Prof. [REDACTED], calculus and topology with Prof [REDACTED], and even networks with Prof. [REDACTED] (who also did a coursera course called ""Networked Life"").Thanks for everything Prof. [REDACTED]! Â You (and your hard-working staff) went above and beyond to produce a course that is a beautiful fusion of mathematics and art. Â Although the odds are against it (judging from other coursera courses), I hope in the future to see another of your courses (excluding reruns of this course).[REDACTED]",1
943,1428315044,sampling a subset with replacement without orderIs this a 4Â° classification type ? Or is it a composite type between the 3 tyoes illustrated on combinatorial review ? ,4
72,1425270576,"Hi everyone,My name is [REDACTED] and Im a Â high school studentÂ from [REDACTED] . The main reason why im taking this course is because I have always found probability fascinating and in my country we usually dont have this kind of courses Â so Im very excited to learn new things.",1
579,1426726076,"I interpreted as a conjunction of winning first round, winning semifinal, losing final.",2
295,1425917954,Does sampling with and without replacement is it same as saying sampling with and without repeating the samples ?,4
461,1426432747,"as the time elapsed, could anyone explain the correct way to solve this problem?not sure about what i did...thanksÂ ",4
922,1428254185,"The question statements mean the answers to q3 and q4 are mutually exclusive, but the questions allow for choices not to be answers to either or both questions.",1
800,1427668158,"Here is a brain twister: Â Try Eddingtons ControversyIf A,B,C,D each speak the truth once in three times (independently) and A claims that B denies thatC declares that D is a liar, what is the probability that D was speaking the truth ?[Probability an introduction Grimett and Welsh 1986]",3
378,1426114411,"As the old saying goes, all models are false but some are useful.Â  Simpler models may be more useful because interpretability gives them plausibility. Â  ",2
699,1427178465,"Hi all,Great course, btw. Â I'm finding it really challenging and struggling to keep up, tbh, but loving every second of it.I'm thoroughly flummoxed with the progression around the 12mins mark from the Laplacian Succession formula P(H r+s | H r) = (r+1)/(s+r+1) to all of a sudden, the Laplacian Prior ( I think using the Copernican Principle) to Â P{S&lt;=s | R = r} = r/(s+r)Where have the ""1's"" gone? How has the ""observation point not special"" assumptions led to this new formula? Â Thanks in advance for any input![REDACTED]",5
305,1425930529,"You are right, there was a problem with the grader on this question. Â It's been fixed. ",1
852,1427878011,"""Key observation: a success run will occur at trial n if, and only if, there is a first success run occurring at some trial j at or before n""This is not true. The ""if, and only if"" part is wrong because ""the first success run occurring at some trial j at or before n"" is a necessary condition, but not sufficient. The rest of the analysis holds in any case, but nevertheless this is not true.",2
1461,1448256692,"That's my thought....This course should be continued, otherwise dr  [REDACTED]'s opera would look unfinished... a Venus from Milo without arms...https://ro.wikipedia.org/wiki/Venus_din_Milo#/media/File:1_Aphrodite_of_Milos.jpg",1
684,1427155911,"But, if there is no hard deadline, then solutions cannot be discussed and thus learning for some suffers.",3
82,1425280478,Same problem.,1
219,1425593359,I must agree with the OP. I really wish Coursera had more math courses!,1
340,1425981933,Please Help me in these questionsÂ I did not understand what to doÂ I understood question its about selecting 4 seats from 12 but 8 of them are already and randomly occupied !right ?I am not getting it !,4
1289,1429714906,"Thank you for pointing these out, [REDACTED]. Â We don't monitor the subtitling (primarily because we don't control them directly â€” they are generated by a wonderful volunteer staff) and so rely on students to let us know if there are problems with them.I've requested new subtitles for 8.2: b and 11.1: j. Â They should crop up in a few days.",1
211,1425560716,"Hello all,Please feel free to add me:Â [REDACTED]",1
1144,1429169596,"Hi all,Back again looking for tips! Â I think I've ground my way toward correct answers for Q6&amp;7 and had a lot of fun along the way.But I'm going round in circles with Q8.I recognise the hint of the mass function and I recognise the fact that I'm looking for the expectation of k.I figure I need to work out the E(k) similar to the lectures, but I keep on getting the answer ""1""! I'm happy my mass function is normalised, but getting from that to the expectation is evading me...Any pointers much appreciated.",4
129,1425352509,please answer the question above,3
73,1425270702,This is [REDACTED] from [REDACTED]. This course is fundamental to understanding the phenomenon that is Big Data and Data Science. Have been waiting a long time for this course. The pre-course videos are fascinating and I am excited to be part of this 4 week journey.,1
396,1426162137,"In this lesson is stated: ""Every real number x in the unit interval has a dyadic expansion .x1x2x3... and conversely""But then it is stated then 0.0001111111... corresponds to 1/8. Right, but also 0.00100000000.... corresponds to 1/8. So the relation is not biunivocal, and more than one result of our infinite coin toss is represented by the same real number. Isn't this a problem?",4
530,1426577417,The solutions are already posted. You need to review your previous attempt and you will now see the explanations to each question.,1
149,1425388306,"Perhaps due to this course's rather...idiosyncratic organization of videos, some of them are not available for download on https://class.coursera.org/probability-001/lecture .That's a problem because I usually download videos on my computer to play them on my android smartphone.I tried using the Coursera android client application too, and the videos don't even play there.Will there ever be a fix?",6
1149,1429187122,"Thanks [REDACTED]....ok, maybe I'll sleep on it.I truly have gone through this forensically. Â The more I analyse it, the more perplexed I get. Â Given the formula above you state,Â E[X]=âˆ‘iâˆ—p(X=i), (which exactly what I used) once you substitute for k.p(k;lamda) = lamda.p(k-1;lamda), the only terms inside the summation are p(X=i-1) which by definition for any legitimate mass function will ALWAYS sum to one ( and I've proved it about 5 times now in my various attempts to get a different answer:-). Â Therefore, the only possible answer is the constant outside the sum.Â Hoping for the ""aha"" moment first tomorrow morning:-) Â (getting late now here in [REDACTED]).",4
1150,1429187841,hold on! Â I may have cracked it...can you give me a clue? Â Is this statement correct: the basic Poisson identity stated in the lectures [ k.p(k;lamda) = lamda(k-1;lamda)] has to be altered slightly?M,5
1314,1429848979,"Keep in mind that this isn't a perfect Bernoulli trial. For each person in the sample, you administer the test, but the test isn't 100% accurate. Only some of those you test will actually have disease. As pointed out above, Q1 on HW 6 has a good outline of how to adjust Chebyshev's inequality. With the proper adjustments I got an answer within rounding of one of the choices provided.",2
693,1427169739,"I set this problem up quickly, did the calculation, and turned in the homework. My answer was wrong. I tried again. The set up was right, I came up with a different answer, turned it in. Wrong again. When I worked it again this morning with the same set up, it turned out that I had forgotten how to add fractions for about an hour and a half during the test. I wonder if the Professor could make an exception to the rules in case of unpredictable brain...anomalies. Â ",4
116,1425339673,"Nope, not fixed.The online versions are still seizing up every few seconds, and the mp4 download links do not work: all you get is an empty file named ""download"".",6
1172,1429356226,"Here is an interesting extension about Q.3 of Homework 6.What happens to the distribution of males and females in the next generation?Suppose there are 1000 males and 1000 females in the society i.e. 1000 couples. What are the expected numbers of boys andÂ  girls in the next generation i.e. children of the couples.I don't know if this is a correct time for discussing this problem or not because the quiz is still available and maybe our discussion will reveal something about the answer of the original problem. I don't want to violate honor code.If there is anything wrong with this forum, I ask TA's to freeze it for a short time please. ",3
983,1428426816,"import randomimport numpy as npdef ran_walk(N):Â Â Â  pos = 0Â Â Â  latest = 0Â Â Â  for i in range(N):Â Â Â Â Â Â Â  pos += random.choice((-1,1))Â Â Â Â Â Â Â  if pos == 0:Â Â Â Â Â Â Â Â Â Â Â  latest = i+1Â Â Â  return latestrun = 2400res = []for i in range(10000):Â Â Â  last_ret = ran_walk(run)Â Â Â  res.append(last_ret)Â Â Â Â Â Â Â Â Â Â  print np.std(res)",2
549,1426610137,"It's okay to discuss problem approaches, [REDACTED]. Â But you're providing and asking for too much detail on the mechanics of the problem. Â Explicit equation specifications will almost always cross the line of what is permissible to discuss.",2
392,1426133051,"I've spotted that we can find the solution for the problem using slightly different way.The generic ball and urn problem is nice to demonstrate it:1. How likely is that the first ball is in the second urn?Of course the answer is 1/32a. The second ball matters only if the first one is not in the second urn. So how likely is that the first ball is not in the second urn?Of course 1 - 1/3 = 2/32b. Now, how likely is that the second ball is in the second urn?It is the same case like in point 1 so: 1/3So finally we have 1/3 + 2/3 * 1/3 = 3/9 + 2/9 = 5/9We can extend that approach to as many urns and balls but the scheme is always same.For example suppose we have 3 balls:How likely is that any of the first two balls is not in the second urn?It is in contrary to the previous task so:1 - 5/9Of course independently probability that the 3rd ball is in the 2nd urn is as always: 1/3So the final solution is:1/3 + 2/3 * 1/3 + (1-5/9)*(1/3) = 1/3 + 2/3 * 1/3 + 4/9 * 1/3 = 9/27 + 6/27 + 4/27 = 19/27",2
236,1425658921,HiÂ my name is shown a bit above of here !! :D ;)I'm from [REDACTED] and I'm senior bachelorÂ student of Information Technology . I'm really glad to enrolled this course and I love Probability and its application to Data science ;).wish You all the best !!,1
