id,post_time,post_text,Urgency_1_7
1587,1380309560,"Hi again. Anonymous posted three links -- thanks for doing so.www.chop.edu/export/download/pdfs/articles/vaccine-education-center/vaccine-ingredients.pdfwww.skepticalraptor.com/skepticalraptorblog.php/judging-quality-science-sources/www.skepticalraptor.com/skepticalraptorblog.php/pseudoscience-fool/At this moment, I've only had time to go through the first, and only quickly. My impression is that nobody nails down the molecules, structures, cells or development cascades&nbsp;that go wrong, so the possibilities still loom. That remains true for the CHOP document -- it says&nbsp;""Researchers have shown that after vaccines are injected, the quantity of&nbsp;aluminum detectable in an infant?? blood does not change and that about half of the aluminum from vaccines is eliminated from the body within one day.""&nbsp;Etc. Well, (1) what about exceptional infants? (2) what happens in the brain, if the BBB isn't yet mature? (3) did the researchers focus minutely enough, or choose the appropriate cohort to spot some vitally important pattern? To continue the ""correlation"" thought, to say there's no correlation found is NOT to say one doesn't exist.&nbsp;So studies saying there's no reason to worry because no correlation has been found don't conclusively end the problem. The mice aren't cooperating. Shaw injected aluminum hydroxide into mice, and saw motor nerve destruction. What experiments, on mice or monkeys or anything, indicate Shaw's experiment was wrong or irrelevant?",4
1017,1378940898,"If its normal or refined peanut oil (not cold pressed, or labeled ""aromatic""), it actually shouldn't contain any peanut proteins which is what causes peanut allergies.However, I usually do not recommend people with severe peanut allergies to consume peanut oil just because I have no idea how the peanut oil was actually pressed. If the guy in the factory did a careless job, there could be peanut bits with peanut proteins floating around in the oil.&nbsp;",2
1248,1379307728,"""Professor [Redacted], you suggest that antibody titre testing is expensive (more than $100), and expertscontend thereno downside to a second shot.?5""I feel you just answered your own question - or at least the answer you require is in the question that you ask. &nbsp;Making children take blood tests is expensive and just not needed as there are no downsides to a second shot. &nbsp; Just my experience but I can also envisage that it is time consuming and invasive to ask children to get pathology collections compared to a vaccination.&nbsp;By the way .. I don't think lecturers are allowed to contribute in forms from my experience with Coursera, &nbsp;so don't be disappointed or go on the attack if you don't get a direct answer here.",5
1757,1381179861,"It depends, but generally, no.",1
2384,1383582317,"We overused our personal data limit so I was unable to stream anything for the last 9 days, meaning i missed the deadline.I need to go to bed now, but I hope the lectures remain up for a few more days so i can catch the final one.Thank you for the course, it was very good.[REDACTED]",6
2538,1384767285,"Thank you everyone, I thought th is course was great! I am taking an epidemology course on here and anytime there is a debate about vaccines I am either advocating for vaccines and have the background information to help educate others as far as myths and reasons why things are done in the way they are done, I knew a lot about vaccines and this course helped fill in the blanks of the information I was missing. Thsnk you for your time and energy in making a great course that was easy to follow. Will there be a more advanced vaccines course? I would love to learn more!",4
1140,1379123215,"The vaccines book mentioned on another thread will provide lots of information, citations,etc - I can't remember what thread I posted it on, but here is a link to the book on Amazon: 1,570 pages and thousands of references. Chapters written by experts on that topic.",2
621,1378388606,"Ok that looks good will give a read and thank you. It was just a
little alarming to learn that myocarditis may be
caused by the smallpox vaccine and it being one
the early vaccines that it is just being studied now.
I am guessing due to lack of technology to test 
this seems to be the case. 
",2
1836,1381354898,"The study shows little correlation between HCW's getting immunized and reduction in morbidity/mortality in an institutionalized elderly population.&nbsp; However, that does not mean that there is no benefit, since that population is not isolated to just the HCW's:&nbsp; Family and friends may visit, etc, spreading disease.I get the annual flu vaccination to keep from getting ill myself.&nbsp; That 
it may also keep my patients from getting ill is a bonus.&nbsp; ",2
1837,1381359165,"Where can I find b/c studies done on each vaccine?  When considering costs and benefits is it cost benefits to a representative 2, 4,6 month old or to society?
",4
1089,1379061542,thnx [REDACTED]  .. :) this helped me ...now i understand this.,1
2568,1385038874,"Firstly, apologies for posting this in a few different threads. I just felt that it was important news that deserved to be shared with you all since clearly by participating in this thread you are interested in the topic. ?The following is taken from the Voices for Vaccines page:""Last week, we asked you to write to Congressional Oversight Committee members to ask that they cancel an anti-vaccine hearing. They listened. The hearing has been indefinitely postponed.Here is the letter VFV sent to those OGR members:http://www.voicesforvaccines.org/wpvfv/wp-content/uploads/2013/11/VFVlettertooversightcommittee.pdfAnd this is the anti-vaccine reaction to the cancellation of the hearing:?http://www.autisminvestigated.com/nvicp-hearing-cancelled/Nice work, vaccine advocates!""",3
1068,1379023894,"We have a bit of an epidemic of parents and the general public inaccurately connecting causation without considering the other possibilities. Kids grow up in such a less germy environment these days. From what I understood, this may be more of a factor than anything else (though, I'd bet, as with most things, it's more complicated than that). Their immune system is not stressed ENOUGH and overreacts to proteins in foods. But, after hearing about a 13 yr old who died of a peanut allergy reaction, I more than ever feel that we need to focus attention on allergic reactions. Not only are they a life nuisance but they can kill.&nbsp;",2
776,1378555243,"[Redacted], sorry but what is AE? I looked it up but couldn't find anything that made sense.&nbsp;",4
938,1378812701,"Hi, my name is [REDACTED], I am from [REDACTED]. Nowadays, I am living in [REDACTED]. is there anybody around here to create a group?",3
363,1378261092,Hi Fellow Learners-I am a mom living in [REDACTED]. I have a toddler and work in&nbsp;the healthcare field (non clinical.) I am looking to gain knowledge on vaccines to make informed decisions and attain knowledge.,1
881,1378739832,i like the pics.,1
394,1378268114,Thanks for sharing the info. I look forward to checking it out.,1
962,1378840506,"Yup, more or less you got it :) That's mostly why we have most of our vaccinations out the way as babies or before starting school :)",2
502,1378311066,"I am a Registered Nurse, and I am a refuser, because my endocrinlogist has determined it unsafe for me to have any more. Its a long story that ended in me wondering why my GP was not aware of certain contraindications before giving me all the vaccines I had to have for uni. I am very angry about it, because it made me extremely sick. I think I am here for answers more than anything.&nbsp;I have PAS-III autoimmune syndrome. A combination of Gardasil and HepB (given the same day) made me extremely sick and I wish I had never had them. I wish my GP had known I shouldnt have had them. I wish I had known.&nbsp;I guess I want to know why they are considered blanket safe, when thats not possible. Is it just forgotten? Is it on purpose? Do they just not care?",5
1185,1379220527,Why are people so scared of the measles? Isn't it similar to chickenpox?&nbsp;,4
830,1378644180,"Hi everybody!I realised there isn't a facebook group for the newest offering of this course so far.If there is one, please share the link over here.If not, I look forward to connecting with everyone over here:[REDACTED]",2
1013,1378933333,"There's something wrong with subtitles in the lecture ""History of Vaccines Part 2"". I'm not a native English speaker, so I always use subs to be sure that I get everything right. But in this lecture there were no subs till minute 16, when they started to rapidly blink on the screen. It's not that I didn't understand the material but as the lecturer speaks quite fast I lost a few points asked in the 3rd quiz. So could you please fix this technical issue.Thanks!",6
2091,1382476877,First of all the doctor could of given you the vaccine and made you wait before leaving to make sure you were not going to have problems.I have asthma too. I use a rescue inhaler too. I get the flu shot every year because I have diabetes. The doctor was just to concern about possibilities that dont usually happen if precautions are taken.The only thing I have to do is wait 1/2 hour before I leave the office. I am in [REDACTED] so I dont know if there are differences in the way medical personal ?deal with it.,2
1381,1379694536,Ahem....I think there's plenty of attacking from the extreme anti &amp; pro contributors on the threads.,3
103,1378217074,"Hello! I am [REDACTED], a student/stay at home mother of two children and a staunch supporter of vaccinations. I have been wanting to take this course for a while and look forward to it. I am excited to see so many health professionals here. Side note: Dr. [REDACTED], I really enjoyed your latest book! Very interesting.",3
1949,1381853248,Perhaps this course on infectious diseases would be of interest to some people on here:https://class.coursera.org/epidemics-001/classIt just started today :),2
759,1378516517,There is now a flu vaccine that is produced without the use of egg protein for those with that allergy. I do not know the availability of it but it just came out this year.,2
1534,1380115566,"I wanted to share the following news release about the avian flu vaccine since&nbsp;many of you work in the medical field:For Immediate Release: Wednesday, September 18, 2013NIH begins testing H7N9 avian influenza vaccine candidatePossible role for adjuvants to be examinedResearchers at nine sites nationwide have begun testing in humans an investigational H7N9 avian influenza vaccine. The two concurrent Phase II clinical trials, sponsored by the National Institute of Allergy and Infectious Diseases (NIAID), part of the National Institutes of Health, are designed to gather critical information about the safety of the candidate vaccine and the immune system responses it induces when administered at different dosages and with or without adjuvants, substances designed to boost the body immune response to vaccination.Human cases of H7N9 influenza first emerged in China in February 2013, with the majority of reported infections occurring in the spring. As of Aug. 12, 135 confirmed human cases, including 44 deaths, have been reported by the World Health Organization. Most of these cases involved people who came into contact with infected poultry. Although no H7N9 influenza cases have been reported outside of China and the virus has not demonstrated sustained person-to-person transmission, there is concern that it could mutate to pose a much greater public health threat.??7N9 avian influenza virus ??like all novel influenza virus strains to which people have not been exposed ??has the potential to cause widespread sickness and mortality,??said NIAID Director Anthony S. Fauci, M.D. ??e are now testing a vaccine candidate with and without adjuvant in an effort to prepare for and, hopefully, protect against this possibility.??/p>The two clinical trials, which will enroll healthy adults ages 19 to 64, will evaluate an investigational H7N9 vaccine developed by Sanofi Pasteur. The candidate vaccine was made from inactivated H7N9 virus isolated in Shanghai, China in 2013. Adjuvants are being tested with the investigational vaccine because previous vaccine research involving other H7 influenza viruses has suggested that two doses of vaccine without adjuvant may not produce an immune response adequate to provide effective protection. In pandemic situations, adjuvants also can be used as part of a dose-sparing strategy, which would allow production of more doses of vaccine from the available supply of the viral antigen, thereby allowing a greater number of people to be vaccinated more quickly.The first clinical trial, led by Mark J. Mulligan, M.D., of Emory University in Atlanta, will enroll as many as 700 study participants who will be randomly assigned to one of seven groups (up to 100 participants in each group). Each group will receive two equivalent dosages (3.75 micrograms [mcg], 7.5 mcg, 15 mcg or 45 mcg) of the candidate vaccine, approximately 21 days apart. Five of the groups will receive the vaccinations along with MF59 adjuvant, developed by Novartis Vaccines and Diagnostics.Of these five groups, three will receive adjuvant with both vaccinations; one group of participants will receive adjuvant only with the first vaccination; and another group of participants will receive adjuvant only with the second vaccination. Two groups of participants will not receive adjuvant. The MF59 adjuvant that is being tested is also contained in the Fluad seasonal influenza vaccine currently licensed in Europe and Canada for use in people age 65 years or older.The second trial, led by Lisa A. Jackson, M.D., M.P.H., of Group Health Research Institute in Seattle, will enroll as many as 1,000 participants. Each participant will be randomly assigned to one of 10 groups (up to 100 participants per group) and will receive two equivalent doses (same dosages as the other trial) of the investigational H7N9 vaccine given 21 days apart.Seven of these groups will receive the vaccinations either with or without AS03 adjuvant, developed by GlaxoSmithKline Biologics. Two groups will receive their first vaccination with AS03 or MF59 adjuvant and then receive the alternate adjuvant at time of second vaccination. One group will receive the MF59 adjuvant at both vaccinations. The AS03 adjuvant that is being tested was used in a 2009 H1N1 influenza vaccine, Pandemrix, used in several European countries during the 2009-2010 H1N1 influenza pandemic.In both studies, which are expected to conclude in December 2014, a panel of independent experts will closely monitor safety data at regular intervals throughout the trial.The vaccine studies are being conducted at the eight NIAID-funded Vaccine and Treatment Evaluation Units: Baylor College of Medicine, Houston; Children?? Hospital Medical Center, Cincinnati; Emory University, Atlanta; Group Health Cooperative, Seattle; Saint Louis University, St. Louis; University of Iowa, Iowa City; University of Maryland School of Medicine, Baltimore; and Vanderbilt University, Nashville. The University of Texas Medical Branch at Galveston will conduct the trial as a subcontractor to Baylor College of Medicine.Further information about both clinical trials can be found at&nbsp;http://www.ClinicalTrials.gov&nbsp;using the identifiers:NCT01938742&nbsp;and&nbsp;NCT01942265.For more information, visit&nbsp;NIAID?? Influenza Web portal. For U.S. government information on avian and pandemic influenza, see&nbsp;http://www.Flu.gov&nbsp;.NIAID conducts and supports research ??at NIH, throughout the United States, and worldwide ??to study the causes of infectious and immune-mediated diseases, and to develop better means of preventing, diagnosing and treating these illnesses. News releases, fact sheets and other NIAID-related materials are available on the NIAID Web site athttp://www.niaid.nih.gov.",2
1459,1379944473,Wow I am a little bit scared now. My name is so unusual and have been posting with my full name. I hope I'm ok. ,1
1557,1380195714,"Vaccination and immunization are the same thing. &nbsp;Vaccination/immunization results in and active immune response - this can only happen when the body (immune system) is in contact with an antigen that invokes an immune response, so either a vaccine, virus, bacteria, etc etc. &nbsp;Passive immunity is what is obtained when mothers breast-feed their babies, for example, which passes antibodies to them. &nbsp;This only infers immunity for a short period of time, and the baby is required to build up their own antibodies, which is only done by coming into contact with the antigen. &nbsp;So, a mother could pass some short-term immunity to her baby by breast-feeding, which will keep the baby protected until it receives it's vaccination...or until it comes in contact with the disease, whichever comes first.",2
1719,1381027987,I'm just amazed that because Medical Students must be very busy studying in their courses already but still are willing to take more courses online! I think that it's great. ,1
604,1378380624,"Thanks guys!&nbsp; I first considered the possibility that the drying was&nbsp;responsible,&nbsp;but&nbsp;thought that, if so, it should apply to both species.&nbsp; I hope that we will learn exactly why the virus would be attenuated in the rabbit (if it is a less susceptible host?) when it is not in the dog...",4
293,1378245978,"Hello/hola/Merhaba/bonjour/
My name is [REDACTED] and I wanted to introduce myself. I am from [REDACTED] and I love travel, art, photography, politics, and philosophy. Among tons of other things. :)
I am 26 years old and I have taken coursera courses before. This is my first medical course ever and I am beyond excited to share my notes and thoughts with anyone interested. I hope to meet new friends and learn from you all. 
Please feel free to help me help you. Learn from each other around the world. Education is beautiful 
",2
2607,1386455937,"Problem: No certificate Browser: Mobile Safari 5.1OS: iOS 5.1.1Additional details: I took this course on my iPad and completed it on time. I got all of the answers correct, yet when I checked my course statements it says I got zero correct. Frustrating since I did all the work and would like a grade for my effort. Please assist. Thank you.",7
2528,1384641314,"Having taken the course they (and you) should be aware that this is about a lot more than opinion or belief. It is about science and facts and people who deny those, having taken the course and been fully informed, deserve to have their 'opinions' downvoted.",2
1086,1379058253,"My name's [REDACTED] and I'm currently a mom to 1 and pregnant with number 
2. Also I am a birth and postpartum doula by trade. With all the controversy surrounding vaccines I felt it was 
important to get educated. I like this class so far and I like receiving
 information they just don't teach in schools. I am very pro choice, not pro vax or anti vax. Instead of picking a side, I prefer to stay on the fence, asking questions, developing theories, absorbing fact and opinion, proposing my own thread of thought. I was a bit disappointed the presentations for the class did not have references for these facts, I was hoping to find a public plethora of information and citations marking this and that, dates, names, facts and figures, like an encyclopedia or history book of sorts, without bias of course. If there isn't one, there needs to be. haha",3
311,1378250371,"Whenever people ask me about immunizations in my role as a public health and licensed school nurse I would tell them about my paternal grandmother. She lost 4 children to diphtheria. Their deaths devastated her. This was early 1900's. My father survived, probably because an earlier tonsillectomy, performed at home, had accidentally taken part of his soft palate so he had a larger airway.Do we really want to return to those days?",2
1254,1379346621,"The last I heard, D.O. were still not allowed
to be licensed as physicians in Canada.&nbsp; 

I spent most of my childhood in a small town in
[REDACTED] ]where we had three hospitals ?two for the MDs and one for the Dos.&nbsp; We went to both.&nbsp; The osteopathic hospital functioned basically
just like the other two, except that the DOs also knew how to perform
manipulations. Since I was just a kid at the time, I didnt really know what
the difference was between these two types of doctors.&nbsp; When I was 8 my mother took a job as the
reception in the office of an MD who was also the county health officer who
could not hide distain for DOs, even referring to them as ??r.??nbsp; Now the town just has one hospital and I
think MDs and DOs work side by side.

When I was 15 I moved to [REDACTED] which
was just in the process of recognizing DOs. I recall one of my high school
teachers warning us that a new doctor in the area was a DO (i.e. not a real doctor.)&nbsp; Based on my family experience,
that sounded odd to me.&nbsp; About 13 years
later, I took a job as an EEG tech. in a hospital located in logging town near
the [REDACTED] &nbsp; It had both MDs
and DOs, but I soon got the impression that the DOs were still the new kids on
the block, and not accepted by everyone, including my supervisor ??until she
finally got up the courage to let one of them use manipulations to treat her
aching neck.&nbsp; She had a much more
positive attitude towards DOs after that.&nbsp;
Another DO there was an orthopedic surgeon.&nbsp; He removed two of my bunions and did a great
job.&nbsp; Now in the U.S., DOs specialize in
every major field of medicine just like MDs. ( In fact, some would complain
that theye become to much like MDs, perhaps having overly embraced the
allopathic treatments and forgetting some other their more holistic osteopathic
roots. 

DOs may obtain a license by passing the Osteopathic
Medicine board exams but many also take all the levels of the USMLE (taken by
MDs) so that they may undergo residencies in large medical centers.&nbsp; Now some of the osteopathic medical schools
are even attached to state universities in states as diverse as Texas, Oklahoma,
Florida, and Ohio.&nbsp; Most such schools are
private.&nbsp; Many of their grads set up
practice in areas where there is a shortage of physicians. Many patients prefer
DOs to MDs as their primary care physician because they tend to look at the
patient condition from a more holistic perspective, and often have a much
better bedside manner than MDs.&nbsp; If I
were interested in training as a physician, I?? much rather become a DO than
and MD.

Mercola, by the way, is the only DO I
personally have ever heard of who markets health products.&nbsp; Again, I included his article because of its
information about the revolving door relationship between US government health
agencies and big Pharma.&nbsp; I think that
this problem and the freedom manufactures of alternative treatments have to
make unsubstantiated claims have the same root cause, namely the excessive
corporate power that is so prevalent in the U.S. Alternative medicine
manufacturers tend to be careful in complying with the FDA?? restriction that
they not claim that their products actually cure any diseases.&nbsp; So, instead they just say, for example, that
their products support hair growth, or support the immune system.&nbsp; Of course even claims such as these should be
substantiated.&nbsp; The real tragedy here is
twofold.&nbsp; First, thousands (or millions)
of people throw away their hard-earned money on products that aren?? going to
help them.&nbsp; Secondly, by not routinely
testing alternative treatments, we fail to find out which ones actually work
and, according, which ones it?? actually worthwhile for patients to spend their
money and place their hopes.&nbsp; The end
result is that extremists on both ends (allopathic and alternative
practitioners) may unfairly slander each other.&nbsp;&nbsp;

I personally am encouraged to see more and more
integrative medicine clinics popping up at places like the Univ. of Bridgeport,
the Univ. of Arizona (under Andrew Weil, M.D.) and, I think also at U.C. San
Francisco School of Medicine.&nbsp; However,
whatever wonderful treatments they uncover must be thoroughly tested by
qualified experts who do not stand to gain from their licensing by the FDA or
their subsequent marketing.&nbsp; Otherwise,
the result would be far worse for consumers than what they have now, because at
least now, most understand that it?? a buyer-beware
jungle out there.&nbsp; If unscrupulous
alternative treatment docs and marketers were able to financially influence or
speed-up the FDA approval process of their products and treatments, then the
public (at least initially) might not be aware that the buyer-beware jungle would not have gone away, but rather would only
have been cleverly cloaked in official approval. Yes, we??e been there and done
that before, haven?? we?",2
1889,1381521633,Vaccines course brings CERTIFICATE ????,5
2577,1385112072,Yes it works. There are already threads discussing this - please take some time to read them. And how you think that the link you posted provides any kind of credible data or evidence on the subject I do not understand...,3
912,1378784018,why some &nbsp;of the vaccines Produce hypersensitivity reaction in one child and not in the other?,4
2278,1383229713,"Thank you for this beautiful and very informative course,Regards [REDACTED]",1
1321,1379467168,"[Redacted]and [Redacted]: when the virus is attenuated then there is &quot;no&quot; chance of getting a full-blown case if the virus?
",4
