id,post_time,post_text,Urgency_1_7
1950,1381853264,Perhaps this course on infectious diseases would be of interest to some people on here:https://class.coursera.org/epidemics-001/classIt just started today :),2
2304,1383280434,"The reason religious exemptions are problematic is not because religious predated vaccines. Judaism, Christianity and Islam (in chronological order) predated cars, the internet, modern banking, and TV and they all say things about each of those. It's because most religions, as interpreted according to the canons of interpretation, support vaccines. Here are some links:Judaism:http://new.ohr.edu/5503/print

















http://www.jewishvaluesonline.org/566???Islam:http://islamicarticles.wordpress.com/medicine??
















http://www.comminit.com/?q=polio/node/303223.
http://www.onislam.net/english/ask-the-scholar/fiqh/451044-vaccines-and-the-dangerous-ingredients-therein.html.???http://www.vaccinesafety.edu/Porcine-vaccineapproval.htm?? ?Christianity:http://www.ncbcenter.org/page.aspx?pid=251?http://www.ncbcenter.org/Document.Doc?id=7??

















http://www.elca.org/Who-We-Are/History/ELCA-Archives/Archival-Documents/Predecessor-Body-Statements/Lutheran-Church-in-America/Death-and-Dying.aspx? ??http://www.lds.org/liahona/1978/07/immunize-children-leaders-urge?lang=eng.???And so forth.?? ?",2
1382,1379698285,"[REDACTED], thank you soooo much!
",1
1383,1379698379,"[REDACTED], thank you sooo much!
",1
815,1378600900,"Hi [REDACTED]],
First of all, I have never said that you have to treat your patients or I treat my patients exclusively with homotoxicologic medicine... Why? Because I don&#39;t think like that!
Homotoxicology is a complementary therapy. I don&#39;t use it alone.
For example Traumeel, this is the medication that has deeper studies, Traumeel is an inflammation  regulatory medication, it makes the effect and NSAID, this medication is used by sport teams like Real Madrid, Bayern Munich, Chelsea, etc.
Remember that the water we use in our clinics or the hospital is Sterile! It won&#39;t have faeces, or any other thing!? Or do you inject water from the faucet!? I&#39;m sure you don&#39;t!
I&#39;m not defending the pharmaceutical Heel, but I think like all the other pharmaceuticals, Heel also have quality controls.
Believe me, I understand your scepticism, you are not the only one with these questions.
Of all the medicine they have, maybe 5-10% is diluted above the number of Avogadro, and not all the components.
I invite you to study a little bit of this topic, and if you want try it. With yourself if you want, so you can prove that am not inventing, dreaming or lying!
[REDACTED].
",3
1274,1379370783,"Hi!...Well i'm very allergic person. And my MD suggest me a vaccine. I'm not sure about the efficiency and effectiveness and the most important thing the adverse effects.&nbsp;So what do you think, i took the vaccines to improve my health?",3
1352,1379587124,"Dear All, Please let me know the how to improve the Drug Development of Mailarial Vaccine &amp; On what basis we will conduct the clinical trails for Vaccines.",4
1938,1381822531,"[REDACTED], it may be to do with finance. The UK is in a similar position. Healthy adults are less likely to suffer complications from flu than those in high risk groups so it is the latter groups that are given the vaccine. Flu vaccine is freely available for those in high risk groups, but there isn't the money or resouces to provide it for everyone.http://www.nhs.uk/Conditions/vaccinations/Pages/flu-vaccine-questions-answers.aspx#anyoneelseI had my flu vaccine last week, but it was given in my local supermarket and I paid for it privately.",2
700,1378453867,"I am [REDACTED]from [REDACTED] and i am a Md specialized in Preventive Medicine and Public Health. I am the responsible of an international vaccination center. I love this topic. I decide the vaccines that a traveller should get to visit other countries.I work in a acute hospital too, chosing the vaccines the patients should get before, during or after their admitance.",2
185,1378229150,"Hi. My name is [REDACTED]] and I'm in [REDACTED]; I am a radiotherapist by trade but now work&nbsp;as a&nbsp;university lecturer,&nbsp;training the next generation of health professionals.&nbsp; While&nbsp;I have covered bits of immunolgy in both my BSc and MSc, it&nbsp;always had an oncology slant due to my job/nature of the&nbsp;qualifications concerned&nbsp;and so&nbsp;I would like to fill in some gaps - especially as&nbsp;vaccination seems to be becoming such a contenious issue, despite the science behind it.",2
2061,1382376123,There is one more week after this one. &nbsp;Quiz deadlines are Nov 4th.,3
1193,1379240587,though ethical issue in vaccine is important. But I think learned friends are more involved in [Redacted]'s ethical issue.I hope you need to focus on vaccine itself and refrain from too much discussion about ethical issue.,2
1562,1380220220,"I have posted this in other threads, but this is relevant to the ""be open minded, there are two sides!"" narrative:False 
equivalence is a logical fallacy where there appears to be a logical 
equivalence between two opposing arguments, but when in fact there is 
none. Journalists use a form of this logical fallacy when comparing two 
sides of a scientific debate in an attempt to provide a balance between a
 scientific and denialist point of view. However, there is no 
equivalence between the two sides, when one is supported by evidence, 
and the other side with little or no evidence, of which most is of low 
quality. In other words, in false equivalence, someone will state that 
the opposing arguments have a passing similarity in support, when, on 
close examination, there is large difference between the quality of 
evidenceThere are often two sides, but oftentimes, the evidence points strongly in the direction of one.&nbsp; In these cases, you should reject the side that is not supported by evidence - this has nothing to do with ""being closed minded"" or ""not considering the other side.""&nbsp; One should approach scientific questions with an open mind, but one should also be ready to accept viewpoints which run counter to one's pre-established prejudices when scientific evidence challenges them.&nbsp; Holding staunchly to our beliefs when evidence points the other direction is the epitome of having a closed mind, one which is static, unchangeable, and immune to the probings of reality.&nbsp; ",4
29,1378199837,Hello I am [REDACTED]. I am a quality assurance engineer in the pharma. I have just started working in [REDACTED].I am [REDACTED] but right now I am in [REDACTED].,1
1084,1379056257,"Hi everyone, I'm [REDACTED] from [REDACTED], first of all Thank to Dr [REDACTED] ]for this instructive course, is a pleasure to meet you Sir. I just wanted to ask by the way in this year polio have caught a dozen children in my country because vaccine according to reports. My question is, what other causes different to poor storage could have triggered this problem? and Could these cases are contagious to people around them? Thanks in advance for your answer",4
172,1378226688,"Hi everyone.&nbsp;Currently I am a stay at home mom of 4. 2 of my children are autistic. No I do not believe there is a connection to vaccines. I am a former medic and nurse. I get stuck in the vaccine debate every once in a while and I gotta say it makes my head spin sometimes. One of the first books I read when I entered the world of autism was Dr. [Redacted]'s book&nbsp;Autism's
False Prophets: Bad Science, Risky Medicine, and the Search for a Cure&nbsp;as well as Deadly Choices: How the Anti-Vaccine Movement Threatens Us All.&nbsp;I have to say though my go to book when stuck in the debate is Seth Mnookin's The Panic Virus: The True Story Behind the Vaccine-Autism Controversy. If you haven't figured it out yet I am very pro-vax. My jobs in the medical field I have seen the nasty side of preventable disease. I'm always up for a good debate as long as it stays civil.",2
671,1378423706,"Hello, I'm [REDACTED] from [REDACTED], I'm chemical pharmacist, i work in [REDACTED] (is the national regulatory agency from [REDACTED]). I study the documents for obtain the licence pre-marketing. We don't know many things about the manufacture of the Vaccines and all aspects relationed with this.",1
125,1378220250,"[REDACTED], also in [REDACTED].&nbsp; Nice to meet all of you!&nbsp; I have a Masters in Library and Information Science.&nbsp; As an information professional, it's a good idea to have an informed idea about vaccines, given the debate about them.&nbsp; Looking forward to the rest of the course!",2
1471,1379963683,"""Last winter, the kid who got the flu shot was home sick more often than the one who didn't.""It only protects against flu...not every bug or virus going round. If it wasn't flu either had then whether one was vaccinated and the other not has absolutely nothing to do with it.&nbsp;Yes it only protects fully against one strain, but they don't just ""guess"" what it may be. There is a lot of research goes into this, monitoring all the strains which are circulating the planet plus any new mutations. The fact that illness and death rates have decreased demonstrate this.Another important point is that it also confers some protection to similar strains. I had my flu jag for the[Redacted] last winter...then I caught a different strain while in[Redacted]on holiday...thankfully due to the vaccine I didn't get a full-blown case of the flu (yes this was confirmed by medical tests before anyone asks.)",3
1330,1379500111,"The course lectures are great and I have learnt a lot. &nbsp;However, I would really like to have more quiz questions, or more quizzes, to test my understanding more thoroughly. &nbsp;",5
940,1378816341,"Hi everyone,I wanted to share this website for those of you who may not be able to get in to view academic papers (let's face it they're the best source of info, but not so easy to access!). &nbsp;This website has loads of info but most importantly has a section on vaccines and and autism/vaccines which is updated with the most recent research (I've included some screenshots for you). &nbsp;So it seems that we moms can put our minds at ease when it comes to vaccines :) &nbsp;That totally makes sense though because my neighbor didn't vaccinate any of her children and 2 of her boys are autistic! &nbsp;It was actually her who directed me to this site so that I didn't make the same mistake with my baby (all 3 of her kids have had whooping cough, but thankfully they got through it). &nbsp;So now we probably need to start looking a bit more closely with what we are in contact with during pregnancy...but since there are genetic factors too it may be completely out of our control. &nbsp;I'm looking forward to the next few years of research to see how the genetics are involved... especially if they can do some tests to find out if the baby carries the genetic factors... and maybe gene therapy can even cure it in the future, who knows! :)http://www.helpguide.org/mental/autism_signs_symptoms.htmHope this is helpful :)[REDACTED]",3
1171,1379186105,I would like to know too :),2
2079,1382450611,"This is rather long and I'm no expert, so it probably has a few mistakes. Your question's interesting so I accidentally wrote an essay.There are lots of rules about experimenting on human subjects, for good reason. You have to make sure that you're not putting the participants at unjustifiable risk (if there's any risk you have to be able to explain your reason for thinking this study will benefit people enough to be worth it.) It's considered unethical to compare something to no treatment if there's a better alternative available- for example you should compare a new painkiller to ibuprofen or something rather than sugar pills- or to deny someone an effective treatment they would otherwise get. Now think about this in the context of a randomised controlled trial of vaccines. You're putting both the participants and anyone exposed to them at risk of vaccine-preventible disease. They are, essentially, being denied the standard of care. And you're either telling parents that their children won't get the vaccine or will get the vaccine because you flipped a coin- or else not just letting them know. Now, that's necessary in a randomized controlled trial, but a lot of people might not want to participate in this, and you'll need a large sample size to see if there are any problems with the vaccine. You could also do an observational study, and they have been done&nbsp;(not always well), but there are a few problems with this too. First of all you'll need a lot of participants, especially because the unvaccinated control&nbsp;population is often a lot smaller. Unless whatever you're looking for happens almost all the time you'll need a ton of participants for&nbsp;both- think of the rotovirus vaccine in the most recent lecture, with intussusception in 1 in 10,000 children.&nbsp;You'll also potentially find some differences which are purely by chance, especially if you have fewer people than you should. Then&nbsp;people who vaccinate and people who don't&nbsp;vaccinate may be different in other ways too. People who have&nbsp;expensive cars are probably going to live longer than those who don't, because people who can afford expensive cars are likely to be richer and therefore live longer. It doesn't mean awesome cars extend your lifespan.  http://pediatrics.aappublications.org/content/114/1/187.fullIn order to do this trial, especially for the RCT, the evidence&nbsp;should say there's a chance that kids getting vaccines or a vaccine might not be better off. So you have to get that evidence first, for vaccines in general, because that's the standard that's been set by people who don't believe in any vaccination- that vaccines, in general, rather than one specific one, are harmful or more harmful than beneficial. Testing one specific vaccine is a whole 'nother kettle of fish and has been done, and is done.",3
132,1378221069,"Dear guys,I am curious about the rabies story in the video,it said that rabbit spinal cord can attenuate the rabies virus, so it can induce immune response in human.That means what Pasteur injected in human body was not an antibody, its an antigen.What confused me is: is it safe or perhaps effective to inject antigen when you already have infected by so-called the wild antigen?&nbsp;I thought that vaccine as an active innate immunization should be given prior to pathogen exposure.Please correct me if I'm wrong",4
269,1378242069,"Lets start with some of your questions .. Smallpox is a good one.Smallpox existed for many thousands of years, it has been found in Egyptian mummies. &nbsp; It is known to have killed 400,000 Europeans each year during the 18th Century. &nbsp; I think Paul stated that it is estimated that over time it has killed 500 Million people which is not unreasonable I suppose.You only see it's rapid decline after the introduction of vaccination. &nbsp; One of the major factors with Smallpox is that it needs human to human transmission, &nbsp;it does not live in another host and it cannot lay dormant in the body or things like the soil. When you read about it's eradication you see how it was done, &nbsp;the WHO used Ring vaccination in the end to stop outbreaks from spreading. &nbsp; When someone was discovered with Smallpox then whole areas were vaccinated around the outbreak so that it could not spread. &nbsp; This saved having to vaccinate every single person.The only debate that I can see is whether the last remaining samples of Smallpox in labs should be destroyed or not so that it cannot be used as a biological weapon. &nbsp;&nbsp;",2
504,1378312431,"I am a parent to a child with autism.&nbsp; She was diagnosed with encephalopathy following her well baby visit where she had received the MMR and Varicella vaccination (short version of her reaction).&nbsp; This diagnosis of course remained until she was later (at 2 1/2) diagnosed on the autism spectrum.&nbsp; I find the idea that the science is ""in"" and vaccines absolutely cannot cause autism ridiculous.&nbsp; If we had never sought help for my daughter and recieved that second diagnosis of autism based on behaviors, then the medical community would still be saying my daughter had this damage from her vaccines.&nbsp; It is plain and simple words games.&nbsp; If you look up the definition of encephalopathy in the injuries awarded by our US government it is ""strangely"" the same things they use to diagnose someone with autism.&nbsp;&nbsp; I find it funny that there is even a debate so many years later.&nbsp; The scientific and medical communities cannot have it both ways.&nbsp; You can't deny any possibility and in the same breath admit that in ""some people with underlying conditions it can"" or that if you call it what it is ""encephalopathy, seizures, etc"" and skip that autism label it is true.&nbsp; Just nonsense.&nbsp; We scream about why parents do not trust or why they do not just look at the ""evidence""...and yet that evidence sits right there in the manufacturers inserts and vaccine trials and we continue to deny it.&nbsp; I am not saying ALL autism is a vaccine injury, or the MMR is the culprit in all autism;&nbsp; but I am saying that lying about those cases that are, has served only to add fuel to the fire.&nbsp; I now teach parents how to research the facts for themselves, so that they can make an informed decision.&nbsp; I don't claim to know what is right for their family or guarantee anything but I can empower them to learn as much as possible and show them how to find the facts.&nbsp; I think this is a great that there is such open discussion and even debate as that is how people learn and love that parents are speaking about their decisions!",2
392,1378267980,I only completed 4 questions and there no 5 and 6 on quiz 1.1.,5
1928,1381798281,"The attitudes and stance of the anti-vaxxers is surely an example of the Dunning-Kruger Effect:The Dunning??ruger effect is a cognitive bias in which unskilled individuals suffer from illusory superiority, mistakenly rating their ability much higher than average. This bias is attributed to a metacognitive inability of the unskilled to recognize their mistakes.[1]",3
1039,1378989866,"I apologize for my delayed response to this request; it just came to my attention. The statement in question is being taken out of context in that our statement is&nbsp;being made in reference to pregnancy not in general. The primary source of this information was the Sorenson paper cited as a reference at the end of the page. Admittedly, the paper is an older one, but in preparation for our aluminum-related comments we read more than 250 scientific papers about aluminum and felt that the statements made by Sorenson were supported by the information in bullet points in the same&nbsp;section of the page. If additional, well-controlled studies have been published in reputable journals (check here for tips on evaluating scientific studies - toward bottom of page: http://www.chop.edu/service/vaccine-education-center/related-information/vaccine-information-for-edu...)&nbsp;&nbsp;that make this information invalid, we would appreciate someone sharing them with us. Anyone who is unwilling to point out errors or&nbsp;share information just to bring into question the integrity of another individual or group clearly does not have&nbsp;the best interests of children in mind.",3
1216,1379265102,There is lots of useful information and links that people have posted on these forums. Will we still be able to access them when the course is over?,6
2425,1383662658,Yes. The final quiz is 9.1. All the best! :-),3
1365,1379656291,is it ok if i answered the quiz of a lecture after the flowing lecture came out ?,6
1081,1379053918,"When I was pregnant, I saw two different gynecologist and both advised me against the Flu vaccine and said not to get it and to refuse it.&nbsp;&nbsp;When it came to the&nbsp;tetanus shot,&nbsp;they said I had&nbsp;no probability of getting it&nbsp;unless I worked/lived in a farm or where there were metals or other rare circumstances which I didn't have so they said I didn't really need it. Can anyone explain to me why? These were private doctors, but I know the government clinics do give these two shots to pregnant women.",4
581,1378365225,"Hello,I'm [REDACTED] from [REDACTED]. I'm a physician and I work in a hospital. I expect to update my knowledge on this field.",1
1427,1379857556,"Interesting, since this&nbsp; ""so called"" anti-vax Mom called someone out here specifically for using a meme with misinformation.&nbsp; Now we have established that memes don't exactly bring credibility and neither does generalizing people.&nbsp; ",2
26,1378199101,Hello everyone! I'm [REDACTED] and I'm from [REDACTED]] but I've been living in [REDACTED] for the last six years. I'm anxious to learn about vaccines as I start to think about having a family. It's nice to meet you all. ,1
1032,1378973585,"My name is [REDACTED],I am a Pediatrician  with more than 30 years of experience. I work in a little town in the [REDACTED] Coast.  Thankyou for this fantanstic course.     Saludos desde [REDACTED] para todos.
",1
1963,1381915799,Here are a few links that I just found which may be of interest...http://theconversation.com/science-and-fear-a-review-of-vaccination-documentary-jabbed-14291http://theconversation.com/vaccine-program-changes-protect-kids-but-with-fewer-ouches-15614,2
1870,1381443614,"Hi [REDACTED]],If you refer back to the video lecture, it discusses which type of Mercury is in Thimerosol. Methyl Mercury is incorrect, although it is touched upon in the lecture.I hope this helps,[REDACTED]",3
726,1378474407,"it really is more exciting than that. a lot of places are taking the mooc's seriously. like google offered a person an internship for there 30 classes. got that from coursera's posts on f/b so its safe to say its credible. also some school dist. are accepting these classes as cont. ed credit. and yahoo will reimburse for sig. track if you take classed related to your job with them and score high enough. again all off of the coursera f/b page, but ive been told f/b and all the internet is not credible, on one of this classes forums. by students. so you might ask coursera directly how credible they are. I belive that they are very credible but all I have is my phd in religious studies so according to some of the students who have ""real degrees"" ie doc. in science and nursing and ed. that I mine&nbsp; don't count as its in religion and there fore not credible. and after all I am just a dumb hick from a little town in [REDACTED] that had only 250 people there when I was born. but I like these classes and so I take them.",3
1540,1380129245,We learn that hepatitis B is the only blood vaccine and came from the effected hepatitis B people,2
41,1378204781,"Greetings! I'm [REDACTED] from [REDACTED]. I am not from medical field, but I am interested in the subject. I get vaccinated against flu every year and it helps. I would like to know if there are other important vaccines.",1
2193,1382995810,A huge thank you to Prof. [REDACTED] and his team for an enjoyable and informative course on Vaccines. I'll be keeping an eye out for further courses offered by him and the [REDACTED]. Thanks again!,3
198,1378233280,"Hi to everyone, My name is [REDACTED] from [REDACTED] but moving back to [REDACTED] this month, &nbsp;I took this course to help expand my knowledge while going to school to pursue a career in the medical field.&nbsp;",1
1034,1378973865,"Perhaps it would be better not to feed the Trolls. After all, people who are anti-vaccine are often not interested in considering that they might be wrong. They are very often expressing views that make them feel good: i.e. cleverer than the rest of us plebs who aren't in the know. It's very sad that they need to do this, but it can't be resolved here. I'm not wasting my time ""discussing"" vaccinations with them. For those interested in some personal experience of vaccination...my children received all the scheduled vaccination for the country in which we live... and all the optional vaccinations... at about 100 euros each (ouch!) for meningitis jabs. They were slightly ill after some of the combined jabs... but it's a small price to pay so that they can't get polio and co. My sister in law had meningitis as a child and it has left it's mark with some learning difficulties, which while mild have affected her life. Also bear in mind, that by vaccinating my healthy children, I am helping to protect children too young or too seriously unwell to receive the shots, because I'm contributing to herd immunity. There has been a measles epidemic in Wales recently... and it caused a death... there have been cases in Germany where anti-vac people have taken their children to the doctors with measles and infected newborns, who later developed complications and died. I do think&nbsp;in these cases, the people who took their unvaccinated, measles-infected children to the doctors should answer before the courts. [REDACTED]",3
